proyecto de investigacion
marcia rojas
369
--------[ AIDA64 Extreme Edition ]--------------------------------------------------------------------------------------

    Versión                                           AIDA64 v3.00.2529 Beta/es
    Módulo de rendimiento                             4.0.568-x32
    Página principal                                  http://www.aida64.com/
    Tipo de informe                                   Asistente de informes
    Equipo                                            LAB_AGUAS
    Generador                                         Administrador
    Sistema operativo                                 Microsoft Windows XP Professional 5.1.2600 (WinXP RTM)
    Fecha                                             2015-06-30
    Hora                                              09:23


--------[ Resumen ]-----------------------------------------------------------------------------------------------------

    Equipo:
      Tipo de equipo                                    Equipo multiprocesador ACPI
      Sistema operativo                                 Microsoft Windows XP Professional
      Service Pack del SO                               Service Pack 3
      Internet Explorer                                 6.0.2900.5512
      DirectX                                           4.09.00.0904 (DirectX 9.0c)
      Nombre del equipo                                 LAB_AGUAS
      Nombre de usuario                                 Administrador
      Dominio de inicio de sesión                       LAB_AGUAS
      Fecha / Hora                                      2015-06-30 / 09:23

    Placa base:
      Tipo de CPU                                       Intel Pentium 4 630, 3000 MHz (15 x 200)
      Nombre de la placa base                           Asus P5GD1-HVM
      Chipset de la placa base                          Intel Grantsdale-G i915G
      Memoria del sistema                               247 MB  (PC3200 DDR SDRAM)
      DIMM3: Nanya M2U25664DS88C3G-5T                   256 MB PC3200 DDR SDRAM  (3.0-3-3-8 @ 200 MHz)  (2.5-3-3-7 @ 166 MHz)
      Tipo de BIOS                                      AMI (06/24/05)
      Puerto de comunicación                            Puerto de comunicaciones (COM1)
      Puerto de comunicación                            Puerto de comunicaciones (COM2)
      Puerto de comunicación                            Puerto de impresora ECP (LPT1)

    Pantalla:
      Adaptador de video                                Intel(R) 82915G/GV/910GL Express Chipset Family  (64 MB)
      Adaptador de video                                Intel(R) 82915G/GV/910GL Express Chipset Family  (64 MB)
      Aceleradora 3D                                    Intel GMA 900
      Monitor                                           LG Flatron 710E  [17" CRT]  (150532354)
      Monitor                                           LG Flatron 710E  [17" CRT]  (150532354)
      Monitor                                           LG Flatron 710E  [17" CRT]  (150532354)

    Multimedia:
      Adaptador de audio                                Realtek ALC880(D) @ Intel 82801FB ICH6 - High Definition Audio Controller [B-1]

    Almacenamiento:
      Controlador IDE                                   Intel(R) 82801FB Ultra ATA Storage Controllers - 2651
      Controlador IDE                                   Intel(R) 82801FB/FBM Ultra ATA Storage Controllers - 266F
      Unidad de disquetes                               Unidad de disquete
      Unidad de disco                                   Kingston DataTraveler 102 USB Device  (3 GB, USB)
      Unidad de disco                                   ST380817AS  (80 GB, 7200 RPM, SATA)
      Unidad óptica                                     HL-DT-ST DVD-ROM GDR8163B  (16x/52x DVD-ROM)
      Estado SMART de los discos duros                  Aceptar

    Particiones:
      C: (NTFS)                                         17312 MB (5458 MB libre)
      D: (NTFS)                                         59004 MB (39636 MB libre)
      Tamaño total                                      74.5 GB (44.0 GB libre)

    Entrada:
      Teclado                                           Standard 101/102-Key or Microsoft Natural PS/2 Keyboard with HP QLB
      Mouse                                             Mouse PS/2 de Microsoft

    Red:
      Dirección IP primaria                             127.0.0.1
      Dirección MAC primaria                            00-15-F2-00-2B-D2
      Adaptador de red                                  Intel(R) PRO/1000 MT Network Connection

    Periféricos:
      Impresora                                         Adobe PDF
      Impresora                                         Microsoft Office Document Image Writer
      Controlador USB1                                  Intel 82801FB ICH6 - USB Universal Host Controller [B-1]
      Controlador USB1                                  Intel 82801FB ICH6 - USB Universal Host Controller [B-1]
      Controlador USB1                                  Intel 82801FB ICH6 - USB Universal Host Controller [B-1]
      Controlador USB1                                  Intel 82801FB ICH6 - USB Universal Host Controller [B-1]
      Controlador USB2                                  Intel 82801FB ICH6 - Enhanced USB2 Controller [B-1]
      Dispositivo USB                                   Dispositivo de almacenamiento masivo USB

    DMI:
      Vendedor del BIOS DMI                             American Megatrends Inc.
      Versión del BIOS DMI                              1002.006
      Fabricante del sistema DMI                        To Be Filled By O.E.M.
      Producto del sistema DMI                          To Be Filled By O.E.M.
      Versión del sistema DMI                           To Be Filled By O.E.M.
      Número de serie del sistema DMI                   To Be Filled By O.E.M.
      UUID del sistema DMI                              987CCDD8-8538DA11-BC6C1214-FD376B2F
      Fabricante de la placa base DMI                   ASUSTeK Computer INC.
      Producto de la placa base DMI                     P5GD1-HVM
      Versión de la placa base DMI                      Rev 1.xx
      Número de serie de la placa base DMI              MB-1234567890
      Fabricante del chasis DMI                         Chassis Manufacture
      Versión del chasis DMI                            Chassis Version
      Número de serie del chasis DMI                    Chassis Serial Number
      Identificador del chasis DMI                      Asset-1234567890
      Tipo de chasis DMI                                Desktop Case
      Sockets de memoria Totales / Libres DMI           4 / 3


--------[ Debug - PCI ]-------------------------------------------------------------------------------------------------

    B00 D00 F00:  Intel 82915G Memory Controller Hub [C-2]
                  
      Offset 000:  86 80 80 25  06 00 90 20  0E 00 00 06  00 00 00 00 
      Offset 010:  00 00 00 00  00 00 00 00  00 00 00 00  00 00 00 00 
      Offset 020:  00 00 00 00  00 00 00 00  00 00 00 00  86 80 80 25 
      Offset 030:  00 00 00 00  E0 00 00 00  00 00 00 00  00 00 00 00 
      Offset 040:  00 90 D1 FE  00 40 D1 FE  00 00 00 E0  00 80 D1 FE 
      Offset 050:  00 00 30 00  19 00 00 B8  00 00 00 00  00 00 00 00 
      Offset 060:  00 30 D1 FE  00 00 00 00  00 00 00 00  00 00 00 00 
      Offset 070:  00 00 00 00  00 00 00 00  00 00 00 00  00 00 00 00 
      Offset 080:  00 00 00 00  00 00 00 00  00 00 00 00  00 00 00 00 
      Offset 090:  10 11 11 00  00 33 33 00  00 00 00 00  10 0A 38 00 
      Offset 0A0:  00 00 00 00  00 00 00 00  00 00 00 00  00 00 00 00 
      Offset 0B0:  00 00 00 00  00 00 00 00  00 00 00 00  00 00 00 00 
      Offset 0C0:  00 00 00 00  00 00 00 00  00 00 00 00  00 00 00 00 
      Offset 0D0:  00 00 00 00  00 00 00 00  00 00 00 00  00 01 00 00 
      Offset 0E0:  09 00 09 21  02 B3 9B 08  02 00 00 00  00 00 00 00 
      Offset 0F0:  00 00 00 00  00 00 00 00  00 00 0E 00  00 00 00 00 

    B00 D02 F00:  Intel 82915G Graphics Controller 0
                  
      Offset 000:  86 80 82 25  07 00 90 00  0E 00 00 03  00 00 80 00 
      Offset 010:  00 00 D8 CF  01 68 00 00  08 00 00 D0  00 00 E8 CF 
      Offset 020:  00 00 00 00  00 00 00 00  00 00 00 00  43 10 82 25 
      Offset 030:  00 00 00 00  D0 00 00 00  00 00 00 00  10 01 00 00 
      Offset 040:  00 00 00 00  E0 00 00 00  09 00 09 21  02 B3 9B 08 
      Offset 050:  02 00 30 00  19 00 00 B8  00 00 00 00  00 00 80 0F 
      Offset 060:  00 00 00 00  00 00 00 00  00 00 00 00  00 00 00 00 
      Offset 070:  00 00 00 00  00 00 00 00  00 00 00 00  00 00 00 00 
      Offset 080:  00 00 00 00  00 00 00 00  00 00 00 00  00 00 00 00 
      Offset 090:  00 00 00 00  00 00 00 00  00 00 00 00  00 00 00 00 
      Offset 0A0:  00 00 00 00  00 00 00 00  00 00 00 00  00 00 00 00 
      Offset 0B0:  00 00 00 00  00 00 00 00  00 00 00 00  00 00 00 00 
      Offset 0C0:  00 00 00 00  00 00 00 00  00 00 00 00  00 00 00 00 
      Offset 0D0:  01 00 22 00  00 00 00 00  00 00 00 00  00 00 00 00 
      Offset 0E0:  20 00 00 00  00 00 00 00  00 00 00 00  00 00 00 00 
      Offset 0F0:  44 05 64 34  00 00 00 00  00 00 0E 00  00 00 00 00 

    B00 D02 F01:  Intel 82915G Graphics Controller 1
                  
      Offset 000:  86 80 82 27  07 00 90 00  0E 00 80 03  00 00 80 00 
      Offset 010:  00 00 E0 CF  00 00 00 00  00 00 00 00  00 00 00 00 
      Offset 020:  00 00 00 00  00 00 00 00  00 00 00 00  43 10 82 25 
      Offset 030:  00 00 00 00  D0 00 00 00  00 00 00 00  00 00 00 00 
      Offset 040:  00 00 00 00  E0 00 00 00  09 00 09 21  02 B3 9B 08 
      Offset 050:  02 00 30 00  19 00 00 B8  00 00 00 00  00 00 80 0F 
      Offset 060:  00 00 00 00  00 00 00 00  00 00 00 00  00 00 00 00 
      Offset 070:  00 00 00 00  00 00 00 00  00 00 00 00  00 00 00 00 
      Offset 080:  00 00 00 00  00 00 00 00  00 00 00 00  00 00 00 00 
      Offset 090:  00 00 00 00  00 00 00 00  00 00 00 00  00 00 00 00 
      Offset 0A0:  00 00 00 00  00 00 00 00  00 00 00 00  00 00 00 00 
      Offset 0B0:  00 00 00 00  00 00 00 00  00 00 00 00  00 00 00 00 
      Offset 0C0:  00 00 00 00  00 00 00 00  00 00 00 00  00 00 00 00 
      Offset 0D0:  01 00 22 00  00 00 00 00  00 00 00 00  00 00 00 00 
      Offset 0E0:  20 00 00 00  00 00 00 00  00 00 00 00  00 00 00 00 
      Offset 0F0:  44 05 64 34  00 00 00 00  00 00 0E 00  00 00 00 00 

    B00 D1B F00:  Intel 82801FB ICH6 - High Definition Audio Controller [B-1]
                  
      Offset 000:  86 80 68 26  06 00 10 00  03 00 03 04  04 00 00 00 
      Offset 010:  04 80 EF CF  00 00 00 00  00 00 00 00  00 00 00 00 
      Offset 020:  00 00 00 00  00 00 00 00  00 00 00 00  43 10 96 81 
      Offset 030:  00 00 00 00  50 00 00 00  00 00 00 00  10 01 00 00 
      Offset 040:  03 00 00 00  07 00 00 00  00 00 00 00  00 00 00 00 
      Offset 050:  01 60 42 C8  00 00 00 00  00 00 00 00  00 00 00 00 
      Offset 060:  05 70 80 00  00 00 00 00  00 00 00 00  00 00 00 00 
      Offset 070:  10 00 91 00  00 00 00 00  00 08 10 00  00 00 00 00 
      Offset 080:  00 00 00 00  00 00 00 00  00 00 00 00  00 00 00 00 
      Offset 090:  00 00 00 00  00 00 00 00  00 00 00 00  00 00 00 00 
      Offset 0A0:  00 00 00 00  00 00 00 00  00 00 00 00  00 00 00 00 
      Offset 0B0:  00 00 00 00  00 00 00 00  00 00 00 00  00 00 00 00 
      Offset 0C0:  00 00 00 01  00 00 00 00  00 00 00 00  00 00 00 00 
      Offset 0D0:  00 00 00 00  00 00 00 00  00 00 00 00  00 00 00 00 
      Offset 0E0:  00 00 00 00  00 00 00 00  00 00 00 00  00 00 00 00 
      Offset 0F0:  00 00 00 00  00 00 00 00  80 0F 03 00  00 00 00 00 

    B00 D1C F00:  Intel 82801FB ICH6 - PCI Express Port 1 [B-1]
                  
      Offset 000:  86 80 60 26  07 01 10 00  03 00 04 06  04 00 81 00 
      Offset 010:  00 00 00 00  00 00 00 00  00 05 05 00  E0 E0 00 20 
      Offset 020:  F0 FF 00 00  F1 FF 01 00  00 00 00 00  00 00 00 00 
      Offset 030:  00 00 00 00  40 00 00 00  00 00 00 00  10 01 06 00 
      Offset 040:  10 80 41 01  E0 0F 00 00  00 00 10 00  11 4C 01 01 
      Offset 050:  00 00 01 10  60 00 08 00  00 00 00 00  00 00 00 00 
      Offset 060:  00 00 00 00  00 00 00 00  00 00 00 00  00 00 00 00 
      Offset 070:  00 00 00 00  00 00 00 00  00 00 00 00  00 00 00 00 
      Offset 080:  05 90 00 00  00 00 00 00  00 00 00 00  00 00 00 00 
      Offset 090:  0D A0 00 00  00 00 00 00  00 00 00 00  00 00 00 00 
      Offset 0A0:  01 00 02 C8  00 00 00 00  00 00 00 00  00 00 00 00 
      Offset 0B0:  00 00 00 00  00 00 00 00  00 00 00 00  00 00 00 00 
      Offset 0C0:  00 00 00 00  00 00 00 00  00 00 00 00  00 00 00 00 
      Offset 0D0:  00 00 00 00  00 00 00 00  00 00 11 00  00 00 00 00 
      Offset 0E0:  00 00 00 00  00 00 00 00  00 00 00 00  00 00 00 00 
      Offset 0F0:  00 00 00 00  00 00 00 00  80 0F 03 00  00 00 00 00 

    B00 D1C F01:  Intel 82801FB ICH6 - PCI Express Port 2 [B-1]
                  
      Offset 000:  86 80 62 26  07 01 10 00  03 00 04 06  04 00 81 00 
      Offset 010:  00 00 00 00  00 00 00 00  00 04 04 00  D0 D0 00 20 
      Offset 020:  F0 FF 00 00  F1 FF 01 00  00 00 00 00  00 00 00 00 
      Offset 030:  00 00 00 00  40 00 00 00  00 00 00 00  11 02 06 00 
      Offset 040:  10 80 41 01  E0 0F 00 00  00 00 10 00  11 4C 01 02 
      Offset 050:  00 00 01 10  60 00 10 00  00 00 00 00  00 00 00 00 
      Offset 060:  00 00 00 00  00 00 00 00  00 00 00 00  00 00 00 00 
      Offset 070:  00 00 00 00  00 00 00 00  00 00 00 00  00 00 00 00 
      Offset 080:  05 90 00 00  00 00 00 00  00 00 00 00  00 00 00 00 
      Offset 090:  0D A0 00 00  00 00 00 00  00 00 00 00  00 00 00 00 
      Offset 0A0:  01 00 02 C8  00 00 00 00  00 00 00 00  00 00 00 00 
      Offset 0B0:  00 00 00 00  00 00 00 00  00 00 00 00  00 00 00 00 
      Offset 0C0:  00 00 00 00  00 00 00 00  00 00 00 00  00 00 00 00 
      Offset 0D0:  00 00 00 00  00 00 00 00  00 00 11 00  00 00 00 00 
      Offset 0E0:  00 00 00 00  00 00 00 00  00 00 00 00  00 00 00 00 
      Offset 0F0:  00 00 00 00  00 00 00 00  80 0F 03 00  00 00 00 00 

    B00 D1C F02:  Intel 82801FB ICH6 - PCI Express Port 3 [B-1]
                  
      Offset 000:  86 80 64 26  07 01 10 00  03 00 04 06  04 00 81 00 
      Offset 010:  00 00 00 00  00 00 00 00  00 03 03 00  C0 C0 00 20 
      Offset 020:  F0 FF 00 00  F1 FF 01 00  00 00 00 00  00 00 00 00 
      Offset 030:  00 00 00 00  40 00 00 00  00 00 00 00  12 03 06 00 
      Offset 040:  10 80 41 01  E0 0F 00 00  00 00 10 00  11 4C 01 03 
      Offset 050:  00 00 01 10  60 00 18 00  00 00 00 00  00 00 00 00 
      Offset 060:  00 00 00 00  00 00 00 00  00 00 00 00  00 00 00 00 
      Offset 070:  00 00 00 00  00 00 00 00  00 00 00 00  00 00 00 00 
      Offset 080:  05 90 00 00  00 00 00 00  00 00 00 00  00 00 00 00 
      Offset 090:  0D A0 00 00  00 00 00 00  00 00 00 00  00 00 00 00 
      Offset 0A0:  01 00 02 C8  00 00 00 00  00 00 00 00  00 00 00 00 
      Offset 0B0:  00 00 00 00  00 00 00 00  00 00 00 00  00 00 00 00 
      Offset 0C0:  00 00 00 00  00 00 00 00  00 00 00 00  00 00 00 00 
      Offset 0D0:  00 00 00 00  00 00 00 00  00 00 11 00  00 00 00 00 
      Offset 0E0:  00 00 00 00  00 00 00 00  00 00 00 00  00 00 00 00 
      Offset 0F0:  00 00 00 00  00 00 00 00  80 0F 03 00  00 00 00 00 

    B00 D1C F03:  Intel 82801FB ICH6 - PCI Express Port 4 [B-1]
                  
      Offset 000:  86 80 66 26  07 01 10 00  03 00 04 06  04 00 81 00 
      Offset 010:  00 00 00 00  00 00 00 00  00 02 02 00  B0 B0 00 20 
      Offset 020:  F0 FF 00 00  F1 FF 01 00  00 00 00 00  00 00 00 00 
      Offset 030:  00 00 00 00  40 00 00 00  00 00 00 00  13 04 06 00 
      Offset 040:  10 80 41 01  E0 0F 00 00  00 00 10 00  11 4C 01 04 
      Offset 050:  00 00 01 10  60 00 20 00  00 00 00 00  00 00 00 00 
      Offset 060:  00 00 00 00  00 00 00 00  00 00 00 00  00 00 00 00 
      Offset 070:  00 00 00 00  00 00 00 00  00 00 00 00  00 00 00 00 
      Offset 080:  05 90 00 00  00 00 00 00  00 00 00 00  00 00 00 00 
      Offset 090:  0D A0 00 00  00 00 00 00  00 00 00 00  00 00 00 00 
      Offset 0A0:  01 00 02 C8  00 00 00 00  00 00 00 00  00 00 00 00 
      Offset 0B0:  00 00 00 00  00 00 00 00  00 00 00 00  00 00 00 00 
      Offset 0C0:  00 00 00 00  00 00 00 00  00 00 00 00  00 00 00 00 
      Offset 0D0:  00 00 00 00  00 00 00 00  00 00 11 00  00 00 00 00 
      Offset 0E0:  00 00 00 00  00 00 00 00  00 00 00 00  00 00 00 00 
      Offset 0F0:  00 00 00 00  00 00 00 00  80 0F 03 00  00 00 00 00 

    B00 D1D F00:  Intel 82801FB ICH6 - USB Universal Host Controller [B-1]
                  
      Offset 000:  86 80 58 26  05 00 80 02  03 00 03 0C  00 00 80 00 
      Offset 010:  00 00 00 00  00 00 00 00  00 00 00 00  00 00 00 00 
      Offset 020:  01 70 00 00  00 00 00 00  00 00 00 00  43 10 A6 80 
      Offset 030:  00 00 00 00  00 00 00 00  00 00 00 00  17 01 00 00 
      Offset 040:  00 00 00 00  00 00 00 00  00 00 00 00  00 00 00 00 
      Offset 050:  00 00 00 00  00 00 00 00  00 00 00 00  00 00 00 00 
      Offset 060:  10 00 00 00  00 00 00 00  00 00 00 00  00 00 00 00 
      Offset 070:  00 00 00 00  00 00 00 00  00 00 00 00  00 00 00 00 
      Offset 080:  00 00 00 00  00 00 00 00  00 00 00 00  00 00 00 00 
      Offset 090:  00 00 00 00  00 00 00 00  00 00 00 00  00 00 00 00 
      Offset 0A0:  00 00 00 00  00 00 00 00  00 00 00 00  00 00 00 00 
      Offset 0B0:  00 00 00 00  00 00 00 00  00 00 00 00  00 00 00 00 
      Offset 0C0:  00 2F 00 00  00 00 00 00  00 00 01 00  00 00 00 00 
      Offset 0D0:  00 00 00 00  00 00 00 00  00 00 00 00  00 00 00 00 
      Offset 0E0:  00 00 00 00  00 00 00 00  00 00 00 00  00 00 00 00 
      Offset 0F0:  00 00 00 00  00 00 00 00  80 0F 03 00  00 00 00 00 

    B00 D1D F01:  Intel 82801FB ICH6 - USB Universal Host Controller [B-1]
                  
      Offset 000:  86 80 59 26  05 00 80 02  03 00 03 0C  00 00 00 00 
      Offset 010:  00 00 00 00  00 00 00 00  00 00 00 00  00 00 00 00 
      Offset 020:  01 74 00 00  00 00 00 00  00 00 00 00  43 10 A6 80 
      Offset 030:  00 00 00 00  00 00 00 00  00 00 00 00  13 02 00 00 
      Offset 040:  00 00 00 00  00 00 00 00  00 00 00 00  00 00 00 00 
      Offset 050:  00 00 00 00  00 00 00 00  00 00 00 00  00 00 00 00 
      Offset 060:  10 00 00 00  00 00 00 00  00 00 00 00  00 00 00 00 
      Offset 070:  00 00 00 00  00 00 00 00  00 00 00 00  00 00 00 00 
      Offset 080:  00 00 00 00  00 00 00 00  00 00 00 00  00 00 00 00 
      Offset 090:  00 00 00 00  00 00 00 00  00 00 00 00  00 00 00 00 
      Offset 0A0:  00 00 00 00  00 00 00 00  00 00 00 00  00 00 00 00 
      Offset 0B0:  00 00 00 00  00 00 00 00  00 00 00 00  00 00 00 00 
      Offset 0C0:  00 2F 00 00  00 00 00 00  00 00 01 00  00 00 00 00 
      Offset 0D0:  00 00 00 00  00 00 00 00  00 00 00 00  00 00 00 00 
      Offset 0E0:  00 00 00 00  00 00 00 00  00 00 00 00  00 00 00 00 
      Offset 0F0:  00 00 00 00  00 00 00 00  80 0F 03 00  00 00 00 00 

    B00 D1D F02:  Intel 82801FB ICH6 - USB Universal Host Controller [B-1]
                  
      Offset 000:  86 80 5A 26  05 00 80 02  03 00 03 0C  00 00 00 00 
      Offset 010:  00 00 00 00  00 00 00 00  00 00 00 00  00 00 00 00 
      Offset 020:  01 78 00 00  00 00 00 00  00 00 00 00  43 10 A6 80 
      Offset 030:  00 00 00 00  00 00 00 00  00 00 00 00  12 03 00 00 
      Offset 040:  00 00 00 00  00 00 00 00  00 00 00 00  00 00 00 00 
      Offset 050:  00 00 00 00  00 00 00 00  00 00 00 00  00 00 00 00 
      Offset 060:  10 00 00 00  00 00 00 00  00 00 00 00  00 00 00 00 
      Offset 070:  00 00 00 00  00 00 00 00  00 00 00 00  00 00 00 00 
      Offset 080:  00 00 00 00  00 00 00 00  00 00 00 00  00 00 00 00 
      Offset 090:  00 00 00 00  00 00 00 00  00 00 00 00  00 00 00 00 
      Offset 0A0:  00 00 00 00  00 00 00 00  00 00 00 00  00 00 00 00 
      Offset 0B0:  00 00 00 00  00 00 00 00  00 00 00 00  00 00 00 00 
      Offset 0C0:  00 2F 00 00  00 00 00 00  00 00 01 00  00 00 00 00 
      Offset 0D0:  00 00 00 00  00 00 00 00  00 00 00 00  00 00 00 00 
      Offset 0E0:  00 00 00 00  00 00 00 00  00 00 00 00  00 00 00 00 
      Offset 0F0:  00 00 00 00  00 00 00 00  80 0F 03 00  00 00 00 00 

    B00 D1D F03:  Intel 82801FB ICH6 - USB Universal Host Controller [B-1]
                  
      Offset 000:  86 80 5B 26  05 00 80 02  03 00 03 0C  00 00 00 00 
      Offset 010:  00 00 00 00  00 00 00 00  00 00 00 00  00 00 00 00 
      Offset 020:  01 80 00 00  00 00 00 00  00 00 00 00  43 10 A6 80 
      Offset 030:  00 00 00 00  00 00 00 00  00 00 00 00  10 04 00 00 
      Offset 040:  00 00 00 00  00 00 00 00  00 00 00 00  00 00 00 00 
      Offset 050:  00 00 00 00  00 00 00 00  00 00 00 00  00 00 00 00 
      Offset 060:  10 00 00 00  00 00 00 00  00 00 00 00  00 00 00 00 
      Offset 070:  00 00 00 00  00 00 00 00  00 00 00 00  00 00 00 00 
      Offset 080:  00 00 00 00  00 00 00 00  00 00 00 00  00 00 00 00 
      Offset 090:  00 00 00 00  00 00 00 00  00 00 00 00  00 00 00 00 
      Offset 0A0:  00 00 00 00  00 00 00 00  00 00 00 00  00 00 00 00 
      Offset 0B0:  00 00 00 00  00 00 00 00  00 00 00 00  00 00 00 00 
      Offset 0C0:  00 2F 00 00  00 00 00 00  00 00 01 00  00 00 00 00 
      Offset 0D0:  00 00 00 00  00 00 00 00  00 00 00 00  00 00 00 00 
      Offset 0E0:  00 00 00 00  00 00 00 00  00 00 00 00  00 00 00 00 
      Offset 0F0:  00 00 00 00  00 00 00 00  80 0F 03 00  00 00 00 00 

    B00 D1D F07:  Intel 82801FB ICH6 - Enhanced USB2 Controller [B-1]
                  
      Offset 000:  86 80 5C 26  06 00 90 02  03 20 03 0C  00 00 00 00 
      Offset 010:  00 FC EF CF  00 00 00 00  00 00 00 00  00 00 00 00 
      Offset 020:  00 00 00 00  00 00 00 00  00 00 00 00  43 10 A6 80 
      Offset 030:  00 00 00 00  50 00 00 00  00 00 00 00  17 01 00 00 
      Offset 040:  00 00 00 00  00 00 00 00  00 00 00 00  00 00 00 00 
      Offset 050:  01 58 C2 C9  00 00 00 00  0A 00 A0 20  00 00 00 00 
      Offset 060:  20 20 FF 01  00 00 00 00  01 00 00 00  00 00 00 C0 
      Offset 070:  00 00 FF 3F  00 00 00 00  00 00 00 00  00 00 00 00 
      Offset 080:  00 00 00 00  01 00 00 00  00 00 00 00  00 00 00 00 
      Offset 090:  00 00 00 00  00 00 00 00  00 00 00 00  00 00 00 00 
      Offset 0A0:  00 00 00 00  00 00 00 00  00 00 00 00  00 00 00 00 
      Offset 0B0:  00 00 00 00  00 00 00 00  00 00 00 00  00 00 00 00 
      Offset 0C0:  00 00 00 00  00 00 00 00  00 00 00 00  00 00 00 00 
      Offset 0D0:  00 00 00 00  00 AA FF 00  55 55 FF 00  20 00 00 00 
      Offset 0E0:  00 00 00 00  00 00 00 00  00 00 00 00  00 00 00 00 
      Offset 0F0:  00 80 00 09  88 8C 40 00  80 0F 03 00  06 17 00 00 

    B00 D1E F00:  Intel 82801FB I/O Controller Hub 6 (ICH6) [B-1]
                  
      Offset 000:  86 80 4E 24  07 01 10 00  D3 01 04 06  00 00 01 00 
      Offset 010:  00 00 00 00  00 00 00 00  00 01 01 20  A0 A0 80 22 
      Offset 020:  F0 CF F0 CF  F1 FF 01 00  00 00 00 00  00 00 00 00 
      Offset 030:  00 00 00 00  50 00 00 00  00 00 00 00  00 00 06 00 
      Offset 040:  00 00 00 00  00 00 00 00  00 00 00 00  00 00 00 00 
      Offset 050:  0D 00 00 00  00 00 00 00  00 00 00 00  00 00 00 00 
      Offset 060:  00 00 00 00  00 00 00 00  00 00 00 00  00 00 00 00 
      Offset 070:  00 00 00 00  00 00 00 00  00 00 00 00  00 00 00 00 
      Offset 080:  00 00 00 00  00 00 00 00  00 00 00 00  00 00 00 00 
      Offset 090:  00 00 00 00  00 00 00 00  00 00 00 00  00 00 00 00 
      Offset 0A0:  00 00 00 00  00 00 00 00  00 00 00 00  00 00 00 00 
      Offset 0B0:  00 00 00 00  00 00 00 00  00 00 00 00  00 00 00 00 
      Offset 0C0:  00 00 00 00  00 00 00 00  00 00 00 00  00 00 00 00 
      Offset 0D0:  00 00 00 00  00 00 00 00  00 00 00 00  00 00 00 00 
      Offset 0E0:  00 00 00 00  00 00 00 00  00 00 00 00  00 00 00 00 
      Offset 0F0:  00 00 00 00  00 00 00 00  80 0F 03 00  00 00 00 00 

    B00 D1F F00:  Intel 82801FB ICH6 - LPC Bridge [B-1]
                  
      Offset 000:  86 80 40 26  07 00 00 02  03 00 01 06  00 00 80 00 
      Offset 010:  00 00 00 00  00 00 00 00  00 00 00 00  00 00 00 00 
      Offset 020:  00 00 00 00  00 00 00 00  00 00 00 00  00 00 00 00 
      Offset 030:  00 00 00 00  00 00 00 00  00 00 00 00  00 00 00 00 
      Offset 040:  01 08 00 00  80 00 00 00  81 04 00 00  10 00 00 00 
      Offset 050:  00 00 00 00  00 00 00 00  00 00 00 00  00 00 00 00 
      Offset 060:  8A 85 8B 8A  D0 00 00 00  80 80 80 8A  00 00 00 00 
      Offset 070:  00 00 00 00  00 00 00 00  00 00 00 00  00 00 00 00 
      Offset 080:  10 00 0F 14  00 00 00 00  91 02 00 00  00 00 00 00 
      Offset 090:  00 00 00 00  00 00 00 00  00 00 00 00  00 00 00 00 
      Offset 0A0:  28 02 00 00  01 00 00 00  00 00 00 00  00 03 00 00 
      Offset 0B0:  00 00 00 00  00 00 00 00  00 00 00 00  00 00 00 00 
      Offset 0C0:  00 00 00 00  00 00 00 00  00 00 00 00  00 00 00 00 
      Offset 0D0:  33 22 31 00  67 45 00 00  C0 80 00 00  00 00 00 00 
      Offset 0E0:  00 00 00 00  00 00 00 00  00 00 00 00  00 00 00 00 
      Offset 0F0:  01 C0 D1 FE  00 00 00 00  80 0F 03 00  00 00 00 00 

    B00 D1F F01:  Intel 82801FB ICH6 - ATA-100 IDE Controller [B-1]
                  
      Offset 000:  86 80 6F 26  05 00 80 02  03 8A 01 01  00 00 00 00 
      Offset 010:  01 00 00 00  01 00 00 00  01 00 00 00  01 00 00 00 
      Offset 020:  A1 FF 00 00  00 00 00 00  00 00 00 00  43 10 A6 80 
      Offset 030:  00 00 00 00  00 00 00 00  00 00 00 00  00 01 00 00 
      Offset 040:  30 C0 00 00  0B 00 00 00  02 00 20 00  00 00 00 00 
      Offset 050:  00 00 00 00  00 00 00 00  00 00 00 00  00 00 00 00 
      Offset 060:  00 00 00 00  00 00 00 00  00 00 00 00  00 00 00 00 
      Offset 070:  00 00 00 00  00 00 00 00  00 00 00 00  00 00 00 00 
      Offset 080:  00 00 00 00  00 00 00 00  00 00 00 00  00 00 00 00 
      Offset 090:  00 00 00 00  00 00 00 00  00 00 00 00  00 00 00 00 
      Offset 0A0:  00 00 00 00  00 00 00 00  00 00 00 00  00 00 00 00 
      Offset 0B0:  00 00 00 00  00 00 00 00  00 00 00 00  00 00 00 00 
      Offset 0C0:  00 00 00 00  03 00 00 00  00 00 00 00  00 00 00 00 
      Offset 0D0:  00 00 00 00  00 00 00 00  00 00 00 00  00 00 00 00 
      Offset 0E0:  00 00 00 00  00 00 00 00  00 00 00 00  00 00 00 00 
      Offset 0F0:  00 00 00 00  00 00 00 00  80 0F 03 00  00 00 00 00 

    B00 D1F F02:  Intel 82801FB ICH6 - Serial-ATA/150 IDE Controller [B-1]
                  
      Offset 000:  86 80 51 26  05 00 B0 02  03 8F 01 01  00 00 00 00 
      Offset 010:  01 98 00 00  01 94 00 00  01 90 00 00  01 88 00 00 
      Offset 020:  01 84 00 00  00 00 00 00  00 00 00 00  43 10 01 26 
      Offset 030:  00 00 00 00  70 00 00 00  00 00 00 00  13 02 00 00 
      Offset 040:  00 80 70 C0  B0 00 00 00  08 00 00 10  00 00 00 00 
      Offset 050:  00 00 00 00  C0 80 00 00  00 00 00 00  00 00 00 00 
      Offset 060:  00 00 00 00  00 00 00 00  00 00 00 00  00 00 00 00 
      Offset 070:  01 00 02 40  00 00 00 00  00 00 00 00  00 00 00 00 
      Offset 080:  05 70 00 00  00 00 00 00  00 00 00 00  00 00 00 00 
      Offset 090:  00 00 8F 00  82 01 80 00  00 00 00 00  00 00 00 00 
      Offset 0A0:  00 00 00 00  00 00 00 00  00 00 00 00  00 00 00 00 
      Offset 0B0:  00 00 00 00  00 00 00 00  00 00 00 00  00 00 00 00 
      Offset 0C0:  00 00 00 00  0D 00 00 00  00 00 00 00  00 00 00 00 
      Offset 0D0:  00 00 00 00  00 00 00 00  00 00 00 00  00 00 00 00 
      Offset 0E0:  00 00 00 00  00 00 00 00  00 00 00 00  00 00 00 00 
      Offset 0F0:  00 00 00 00  00 00 00 00  80 0F 03 00  00 00 00 00 

    B00 D1F F03:  Intel 82801FB ICH6 - SMBus Controller [B-1]
                  
      Offset 000:  86 80 6A 26  01 00 80 02  03 00 05 0C  00 00 00 00 
      Offset 010:  00 00 00 00  00 00 00 00  00 00 00 00  00 00 00 00 
      Offset 020:  01 04 00 00  00 00 00 00  00 00 00 00  43 10 A6 80 
      Offset 030:  00 00 00 00  00 00 00 00  00 00 00 00  05 02 00 00 
      Offset 040:  01 00 00 00  00 00 00 00  00 00 00 00  00 00 00 00 
      Offset 050:  00 00 00 00  00 00 00 00  00 00 00 00  00 00 00 00 
      Offset 060:  00 00 00 00  00 00 00 00  00 00 00 00  00 00 00 00 
      Offset 070:  00 00 00 00  00 00 00 00  00 00 00 00  00 00 00 00 
      Offset 080:  00 00 00 00  00 00 00 00  00 00 00 00  00 00 00 00 
      Offset 090:  00 00 00 00  00 00 00 00  00 00 00 00  00 00 00 00 
      Offset 0A0:  00 00 00 00  00 00 00 00  00 00 00 00  00 00 00 00 
      Offset 0B0:  00 00 00 00  00 00 00 00  00 00 00 00  00 00 00 00 
      Offset 0C0:  00 00 00 00  00 00 00 00  00 00 00 00  00 00 00 00 
      Offset 0D0:  00 00 00 00  00 00 00 00  00 00 00 00  00 00 00 00 
      Offset 0E0:  00 00 00 00  00 00 00 00  00 00 00 00  00 00 00 00 
      Offset 0F0:  00 00 00 00  00 00 00 00  80 0F 03 00  00 00 00 00 

    B01 D09 F00:  Intel 82540EM Based Gigabit Network Adapter
                  
      Offset 000:  86 80 0E 10  07 00 30 02  02 00 00 02  04 40 00 00 
      Offset 010:  00 00 FE CF  00 00 00 00  01 A8 00 00  00 00 00 00 
      Offset 020:  00 00 00 00  00 00 00 00  00 00 00 00  43 10 EE 80 
      Offset 030:  00 00 00 00  DC 00 00 00  00 00 00 00  11 01 FF 00 
      Offset 040:  00 00 00 00  00 00 00 00  00 00 00 00  00 00 00 00 
      Offset 050:  00 00 00 00  00 00 00 00  00 00 00 00  00 00 00 00 
      Offset 060:  00 00 00 00  00 00 00 00  00 00 00 00  00 00 00 00 
      Offset 070:  00 00 00 00  00 00 00 00  00 00 00 00  00 00 00 00 
      Offset 080:  00 00 00 00  00 00 00 00  00 00 00 00  00 00 00 00 
      Offset 090:  00 00 00 00  00 00 00 00  00 00 00 00  00 00 00 00 
      Offset 0A0:  00 00 00 00  00 00 00 00  00 00 00 00  00 00 00 00 
      Offset 0B0:  00 00 00 00  00 00 00 00  00 00 00 00  00 00 00 00 
      Offset 0C0:  00 00 00 00  00 00 00 00  00 00 00 00  00 00 00 00 
      Offset 0D0:  00 00 00 00  00 00 00 00  00 00 00 00  01 E4 22 C8 
      Offset 0E0:  00 20 00 FF  07 F0 02 00  00 00 40 04  00 00 00 00 
      Offset 0F0:  05 00 80 00  00 00 00 00  00 00 00 00  00 00 00 00 

    PCI-8086-2580:  Intel i910/915/925/E7221 MCHBAR
                  
      Offset 100:  00 00 00 00  00 00 00 00  00 00 00 00  00 00 00 00 
      Offset 110:  E8 20 84 86  11 78 80 01  FF 03 00 00  FF 01 FF 03 
      Offset 120:  05 2A 00 40  00 04 00 00  F0 01 00 00  00 00 00 00 
      Offset 130:  C4 06 00 00  6D 06 1A 87  08 01 02 04  00 00 00 00 
      Offset 140:  00 00 00 00  00 00 00 00  00 00 00 00  00 00 00 00 
      Offset 150:  00 00 00 00  00 00 00 00  00 00 00 00  80 00 00 00 
      Offset 160:  00 00 00 00  20 00 00 00  55 AA 00 22  98 87 22 20 
      Offset 170:  00 00 00 00  00 00 00 00  00 00 00 00  00 00 00 00 
      Offset 180:  08 08 08 08  00 00 00 00  03 00 00 00  07 00 00 00 
      Offset 190:  E8 20 84 86  11 78 80 01  FF 03 00 00  FF 01 FF 03 
      Offset 1A0:  05 2A 00 40  00 05 00 A0  00 00 00 00  00 00 00 00 

    PCI-8086-2580:  Intel i910/915/925/E7221 MCHBAR
                  
      Offset 200:  04 04 0F 00  00 00 00 00  08 01 02 04  00 00 00 00 
      Offset 210:  01 00 00 00  00 00 00 00  00 00 00 00  00 00 00 00 

    PCI-8086-2580:  Intel i910/915/925/E7221 MCHBAR
                  
      Offset C00:  22 00 00 20  01 01 01 01  00 00 00 00  00 00 00 00 
      Offset C10:  00 00 00 00  03 00 80 00  00 00 00 00  00 05 00 00 
      Offset C20:  00 00 00 00  00 00 00 00  00 00 00 00  00 00 00 00 
      Offset C30:  00 00 00 00  00 00 00 00  00 00 00 00  00 00 00 00 
      Offset C40:  00 00 00 00  00 00 00 00  00 00 00 00  00 00 00 00 
      Offset C50:  00 00 00 00  00 00 00 00  00 00 00 00  00 00 00 00 
      Offset C60:  00 00 00 00  00 00 00 00  00 00 00 00  00 00 00 00 
      Offset C70:  00 00 00 00  00 00 00 00  00 00 00 00  00 00 00 00 
      Offset C80:  00 00 00 00  00 00 00 00  00 00 00 00  00 00 00 00 
      Offset C90:  00 00 00 00  00 00 00 00  00 00 00 00  00 00 00 00 
      Offset CA0:  00 00 00 00  00 00 00 00  00 00 00 00  00 00 00 00 
      Offset CB0:  00 00 00 00  00 00 00 00  00 00 00 00  00 00 00 00 
      Offset CC0:  00 00 00 00  00 00 00 00  00 00 00 00  00 00 00 00 
      Offset CD0:  00 00 00 00  00 00 00 00  00 00 00 FF  00 00 00 00 
      Offset CE0:  00 00 00 00  00 00 00 00  00 00 00 00  00 00 00 00 
      Offset CF0:  00 00 00 00  00 00 00 00  00 00 00 00  00 00 00 00 


--------[ Debug - Video BIOS ]------------------------------------------------------------------------------------------

    C000:0000  U.R...000000000000...!.k@...00IBM VGA Compatible BIOS. .[.k.y...
    C000:0040  PCIR...%.................g...............u.............0........
    C000:0080  ....................................d......d......d.....0d......
    C000:00C0  d......d......d......d.....0d......d.....0d......d......d......d
    C000:0100  ......d.....0d......d......d.....0$......$......d.......... ....
    C000:0140  `".......N... ....@............ ...88.......... .1X. (.........V
    C000:0180  . .1X. .P.......... .0X.  @........d..@A.&0..6.......... A. 0.`.
    C000:01C0  ........$.`A.(00`........0*..Q.*@0p.........4..Q.*@...........=.
    C000:0200  .Q.0@@.........H?@0b.2@@..........O@0b.2@@..........Y@0b.2@@....
    C000:0240  .....h[..r.<P...........t..r.<P..........0.7..2.m..4....8....:..
    C000:0280  ..<.E..A.7..C.m..E....I....K....M.E..P 7..R m..T ...X ...Z ...\ 
    C000:02C0  E..`.o..a.o..b o..c....d....e ...f....g....h ...................
    C000:0300  ................................................................
    C000:0340  ............For Evaluation Use Only....(........c-'(.+..........
    C000:0380  .......................................(........c-'(.+..........
    C000:03C0  .......................................P........c_OP.U..........


------------------------------------------------------------------------------------------------------------------------

The names of actual companies and products mentioned herein may be the trademarks of their respective owners.
