credito chino
mario cruz
369
--------[ AIDA64 Extreme Edition ]--------------------------------------------------------------------------------------

    Versión                                           AIDA64 v3.00.2529 Beta/es
    Módulo de rendimiento                             4.0.568-x32
    Página principal                                  http://www.aida64.com/
    Tipo de informe                                   Asistente de informes
    Equipo                                            FOUNDER-FPC
    Generador                                         founder
    Sistema operativo                                 Microsoft Windows 7 Professional 6.1.7601.17640 (Win7 RTM)
    Fecha                                             2015-06-30
    Hora                                              09:34


--------[ Resumen ]-----------------------------------------------------------------------------------------------------

    Equipo:
      Tipo de equipo                                    ACPI x86-based PC
      Sistema operativo                                 Microsoft Windows 7 Professional
      Service Pack del SO                               Service Pack 1
      Internet Explorer                                 9.0.8112.16421 (IE 9.0)
      DirectX                                           DirectX 11.0
      Nombre del equipo                                 FOUNDER-FPC
      Nombre de usuario                                 founder
      Dominio de inicio de sesión                       founder-FPC
      Fecha / Hora                                      2015-06-30 / 09:34

    Placa base:
      Tipo de CPU                                       QuadCore Intel Core i5, 3100 MHz (31 x 100)
      Nombre de la placa base                           Unknown Motherboard
      Chipset de la placa base                          Intel Cougar Point H61, Intel Ivy Bridge
      Memoria del sistema                               3557 MB  (DDR3-1600 DDR3 SDRAM)
      DIMM3: Kingston ACR16D3LU1NGG/4G                  4 GB DDR3-1600 DDR3 SDRAM  (11-11-11-28 @ 800 MHz)  (10-10-10-27 @ 761 MHz)  (9-9-9-24 @ 685 MHz)  (8-8-8-22 @ 609 MHz)  (7-7-7-19 @ 533 MHz)  (6-6-6-16 @ 457 MHz)
      Tipo de BIOS                                      AMI (07/10/2013)
      Puerto de comunicación                            Communications Port (COM1)
      Puerto de comunicación                            Communications Port (COM2)
      Puerto de comunicación                            Printer Port (LPT1)

    Pantalla:
      Adaptador de video                                NVIDIA GeForce GT 620  (1 GB)
      Adaptador de video                                NVIDIA GeForce GT 620  (1 GB)
      Aceleradora 3D                                    nVIDIA GeForce GT 620
      Monitor                                           Generic PnP Monitor [NoDB]  (F0K080028117)

    Multimedia:
      Adaptador de audio                                nVIDIA HDMI/DP @ nVIDIA GF119 - High Definition Audio Controller
      Adaptador de audio                                Realtek ALC662 @ Intel Cougar Point PCH - High Definition Audio Controller [B-3]

    Almacenamiento:
      Controlador IDE                                   Intel(R) 6 Series/C200 Series Chipset Family 2 port Serial ATA Storage Controller - 1C08
      Controlador IDE                                   Intel(R) 6 Series/C200 Series Chipset Family 4 port Serial ATA Storage Controller - 1C00
      Unidad de disco                                   Kingston DataTraveler 102 USB Device  (3 GB, USB)
      Unidad de disco                                   ST1000DM003-1CH162 ATA Device  (1000 GB, 7200 RPM, SATA-III)
      Unidad óptica                                     ATAPI DVD A  DH16ACSH ATA Device
      Estado SMART de los discos duros                  Aceptar

    Particiones:
      C: (NTFS)                                         465.7 GB (422.6 GB libre)
      D: (NTFS)                                         460.2 GB (445.0 GB libre)
      Tamaño total                                      925.8 GB (867.6 GB libre)

    Entrada:
      Teclado                                           Standard PS/2 Keyboard
      Mouse                                             HID-compliant mouse

    Red:
      Dirección IP primaria                             10.6.49.222
      Dirección MAC primaria                            74-27-EA-F6-4F-6F
      Adaptador de red                                  Realtek PCIe GBE Family Controller  (10.6.49.222)

    Periféricos:
      Impresora                                         Adobe PDF
      Impresora                                         Fax
      Impresora                                         Microsoft XPS Document Writer
      Controlador USB2                                  Intel Cougar Point PCH - USB EHCI #1 Controller [B-3]
      Controlador USB2                                  Intel Cougar Point PCH - USB EHCI #2 Controller [B-3]
      Dispositivo USB                                   Generic USB Hub
      Dispositivo USB                                   Generic USB Hub
      Dispositivo USB                                   USB Input Device
      Dispositivo USB                                   USB Mass Storage Device

    DMI:
      Vendedor del BIOS DMI                             Founder
      Versión del BIOS DMI                              MAP07SB
      Fabricante del sistema DMI                        Founder
      Producto del sistema DMI                          Wenxiang E620
      Versión del sistema DMI                           
      Número de serie del sistema DMI                   DTF4JCNJ28344020E99600
      UUID del sistema DMI                              A2FAB304-B641E311-943C189B-850F7A99
      Fabricante de la placa base DMI                   Founder
      Producto de la placa base DMI                     H61H2-AM3
      Versión de la placa base DMI                      v1.0
      Número de serie de la placa base DMI              DBF4FC1001343008289100
      Fabricante del chasis DMI                         Founder
      Versión del chasis DMI                            
      Número de serie del chasis DMI                    
      Identificador del chasis DMI                      
      Tipo de chasis DMI                                Desktop Case


--------[ Debug - PCI ]-------------------------------------------------------------------------------------------------

    B00 D00 F00:  Intel Ivy Bridge-DT - Host Bridge/DRAM Controller
                  
      Offset 000:  86 80 50 01  06 00 90 20  09 00 00 06  00 00 00 00 
      Offset 010:  00 00 00 00  00 00 00 00  00 00 00 00  00 00 00 00 
      Offset 020:  00 00 00 00  00 00 00 00  00 00 00 00  25 10 4A 07 
      Offset 030:  00 00 00 00  E0 00 00 00  00 00 00 00  00 00 00 00 
      Offset 040:  01 90 D1 FE  00 00 00 00  01 00 D1 FE  00 00 00 00 
      Offset 050:  03 00 00 00  09 00 00 00  00 00 00 00  01 00 80 DF 
      Offset 060:  05 00 00 F8  00 00 00 00  01 80 D1 FE  00 00 00 00 
      Offset 070:  00 00 00 FF  00 00 00 00  00 0C 00 FF  7F 00 00 00 
      Offset 080:  10 11 11 00  00 00 11 00  1A 00 00 00  00 00 00 00 
      Offset 090:  01 00 00 00  01 00 00 00  01 00 F0 1E  01 00 00 00 
      Offset 0A0:  01 00 00 00  01 00 00 00  01 00 00 1F  01 00 00 00 
      Offset 0B0:  01 00 00 E0  01 00 00 E0  01 00 80 DF  01 00 00 E0 
      Offset 0C0:  00 00 00 00  00 00 00 00  00 00 00 00  00 00 00 00 
      Offset 0D0:  00 00 00 00  00 00 00 00  00 00 00 00  00 00 00 00 
      Offset 0E0:  09 00 0C 01  92 E0 00 E2  D0 00 40 04  00 00 00 00 
      Offset 0F0:  00 00 00 00  00 00 00 00  C8 0F 09 00  00 00 00 00 

    B00 D01 F00:  Intel Ivy Bridge-DT - PCI Express Graphics Root Port
                  
      Offset 000:  86 80 51 01  07 04 10 00  09 00 04 06  10 00 81 00 
      Offset 010:  00 00 00 00  00 00 00 00  00 01 01 00  E0 E0 00 20 
      Offset 020:  00 F6 00 F7  01 E8 F1 F1  00 00 00 00  00 00 00 00 
      Offset 030:  00 00 00 00  88 00 00 00  00 00 00 00  00 01 18 00 
      Offset 040:  00 00 00 00  00 00 00 00  00 00 00 00  00 00 00 00 
      Offset 050:  00 00 00 00  00 00 00 00  00 00 00 00  00 00 00 00 
      Offset 060:  00 00 00 00  00 00 00 00  00 00 00 00  00 00 00 00 
      Offset 070:  00 00 00 00  00 00 00 00  00 00 00 00  00 00 00 0A 
      Offset 080:  01 90 03 C8  08 00 00 00  0D 80 00 00  25 10 4A 07 
      Offset 090:  05 A0 01 00  0C F0 E0 FE  B0 49 00 00  00 00 00 00 
      Offset 0A0:  10 00 42 01  01 80 00 00  00 00 00 00  03 AD 61 02 
      Offset 0B0:  40 00 01 51  80 25 0C 00  00 00 40 00  08 00 00 00 
      Offset 0C0:  00 00 00 00  00 00 00 00  00 00 00 00  0E 00 00 00 
      Offset 0D0:  43 00 00 00  00 00 00 00  00 00 00 00  00 00 00 00 
      Offset 0E0:  00 00 00 00  00 00 00 00  00 00 00 00  00 00 00 00 
      Offset 0F0:  00 00 00 00  00 00 01 00  00 00 00 00  01 00 10 00 

    B00 D16 F00:  Intel Cougar Point PCH - Manageability Engine Interface 1 [B-2]
                  
      Offset 000:  86 80 3A 1C  06 00 10 00  04 00 80 07  00 00 80 00 
      Offset 010:  04 90 20 F7  00 00 00 00  00 00 00 00  00 00 00 00 
      Offset 020:  00 00 00 00  00 00 00 00  00 00 00 00  25 10 4A 07 
      Offset 030:  00 00 00 00  50 00 00 00  00 00 00 00  10 01 00 00 
      Offset 040:  45 02 00 1E  10 00 01 80  06 01 00 60  F0 0F 00 10 
      Offset 050:  01 8C 03 C8  08 00 00 00  00 00 00 00  00 00 00 00 
      Offset 060:  00 00 00 00  00 00 00 00  00 00 00 00  00 00 00 00 
      Offset 070:  00 00 00 00  00 00 00 00  00 00 00 00  00 00 00 00 
      Offset 080:  00 00 00 00  00 00 00 00  00 00 00 00  05 00 80 00 
      Offset 090:  00 00 00 00  00 00 00 00  00 00 00 00  00 00 00 00 
      Offset 0A0:  00 00 00 00  00 00 00 00  00 00 00 00  00 00 00 00 
      Offset 0B0:  00 00 00 00  00 00 00 00  00 00 00 00  02 00 00 C0 
      Offset 0C0:  84 B5 E8 AB  37 42 28 78  9C 5B 78 5B  C7 3F 55 C6 
      Offset 0D0:  62 86 B1 22  8F 55 2B 45  38 D1 70 75  C3 1C 0C 75 
      Offset 0E0:  00 00 00 00  00 00 00 00  00 00 00 00  00 00 00 00 
      Offset 0F0:  00 00 00 00  00 00 00 00  00 00 00 00  00 00 00 00 

    B00 D1A F00:  Intel Cougar Point PCH - USB EHCI #2 Controller [B-3]
                  
      Offset 000:  86 80 2D 1C  06 00 90 02  05 20 03 0C  00 00 00 00 
      Offset 010:  00 70 20 F7  00 00 00 00  00 00 00 00  00 00 00 00 
      Offset 020:  00 00 00 00  00 00 00 00  00 00 00 00  25 10 4A 07 
      Offset 030:  00 00 00 00  50 00 00 00  00 00 00 00  10 01 00 00 
      Offset 040:  00 00 00 00  00 00 00 00  00 00 00 00  00 00 00 00 
      Offset 050:  01 58 C2 C9  00 00 00 00  0A 98 A0 20  00 00 00 00 
      Offset 060:  20 20 81 07  00 00 00 00  01 00 00 01  00 20 00 00 
      Offset 070:  00 00 DF 3F  00 00 00 00  00 00 00 00  00 00 00 00 
      Offset 080:  00 00 80 00  11 88 0C 93  30 0D 00 24  00 00 00 00 
      Offset 090:  00 00 00 00  00 00 00 00  13 00 06 03  00 00 00 00 
      Offset 0A0:  00 00 00 00  00 00 00 00  00 00 00 00  00 00 00 00 
      Offset 0B0:  00 00 00 00  00 00 00 00  00 00 00 00  00 00 00 00 
      Offset 0C0:  00 00 00 00  00 00 00 00  00 00 00 00  00 00 00 00 
      Offset 0D0:  00 00 00 00  00 AA FF 00  00 00 00 00  00 00 00 00 
      Offset 0E0:  00 00 00 00  00 00 00 00  00 00 00 00  84 90 BE DB 
      Offset 0F0:  00 00 00 00  88 85 80 00  87 0F 07 08  08 17 5B 20 

    B00 D1B F00:  Intel Cougar Point PCH - High Definition Audio Controller [B-3]
                  
      Offset 000:  86 80 20 1C  06 00 10 00  05 00 03 04  10 00 00 00 
      Offset 010:  04 00 20 F7  00 00 00 00  00 00 00 00  00 00 00 00 
      Offset 020:  00 00 00 00  00 00 00 00  00 00 00 00  25 10 4A 07 
      Offset 030:  00 00 00 00  50 00 00 00  00 00 00 00  16 01 00 00 
      Offset 040:  01 00 00 05  00 00 00 00  00 00 00 00  00 00 00 00 
      Offset 050:  01 60 42 C8  00 00 00 00  00 00 00 00  00 00 00 00 
      Offset 060:  05 70 80 00  00 00 00 00  00 00 00 00  00 00 00 00 
      Offset 070:  10 00 91 00  00 00 00 10  00 00 10 00  00 00 00 00 
      Offset 080:  00 00 00 00  00 00 00 00  00 00 00 00  00 00 00 00 
      Offset 090:  00 00 00 00  00 00 00 00  00 00 00 00  00 00 00 00 
      Offset 0A0:  00 00 00 00  00 00 00 00  00 00 00 00  00 00 00 00 
      Offset 0B0:  00 00 00 00  00 00 00 00  00 00 00 00  00 00 00 00 
      Offset 0C0:  00 04 02 01  00 24 00 40  00 0C A3 82  10 00 33 02 
      Offset 0D0:  00 0C A3 02  10 00 33 02  00 00 00 00  00 00 00 00 
      Offset 0E0:  00 00 00 00  00 00 00 00  00 00 00 00  00 00 00 00 
      Offset 0F0:  00 00 00 00  00 00 00 00  87 0F 07 08  00 00 00 00 

    B00 D1C F00:  Intel Cougar Point PCH - PCI Express Port 1 [B-3]
                  
      Offset 000:  86 80 10 1C  04 04 10 00  B5 00 04 06  10 00 81 00 
      Offset 010:  00 00 00 00  00 00 00 00  00 02 02 00  F0 00 00 20 
      Offset 020:  F0 FF 00 00  F1 FF 01 00  00 00 00 00  00 00 00 00 
      Offset 030:  00 00 00 00  40 00 00 00  00 00 00 00  00 01 00 00 
      Offset 040:  10 80 42 01  00 80 00 00  00 00 10 00  12 4C 11 01 
      Offset 050:  03 00 01 18  00 B2 04 00  00 00 00 00  08 00 00 00 
      Offset 060:  00 00 00 00  16 00 00 00  00 00 00 00  00 00 00 00 
      Offset 070:  01 00 01 00  00 00 00 00  00 00 00 00  00 00 00 00 
      Offset 080:  05 90 01 00  0C F0 E0 FE  A0 49 00 00  00 00 00 00 
      Offset 090:  0D A0 00 00  25 10 4A 07  00 00 00 00  00 00 00 00 
      Offset 0A0:  01 00 02 C8  00 00 00 00  00 00 00 00  00 00 00 00 
      Offset 0B0:  00 00 00 00  00 00 00 00  00 00 00 00  00 00 00 00 
      Offset 0C0:  00 00 00 00  00 00 00 00  00 00 00 00  00 00 00 00 
      Offset 0D0:  00 00 00 01  02 0B 00 00  00 80 11 81  00 00 00 00 
      Offset 0E0:  00 3F 00 00  00 00 00 00  03 00 00 00  00 00 00 00 
      Offset 0F0:  00 00 00 00  00 00 00 00  87 0F 07 08  00 00 00 00 

    B00 D1C F02:  Intel Cougar Point PCH - PCI Express Port 3 [B-3]
                  
      Offset 000:  86 80 14 1C  07 04 10 00  B5 00 04 06  10 00 81 00 
      Offset 010:  00 00 00 00  00 00 00 00  00 03 03 00  D0 D0 00 00 
      Offset 020:  10 F7 10 F7  F1 FF 01 00  00 00 00 00  00 00 00 00 
      Offset 030:  00 00 00 00  40 00 00 00  00 00 00 00  00 03 00 00 
      Offset 040:  10 80 42 01  00 80 00 00  00 00 10 00  12 3C 11 03 
      Offset 050:  40 00 11 70  00 B2 14 00  00 00 40 00  08 00 00 00 
      Offset 060:  00 00 00 00  16 00 00 00  00 00 00 00  00 00 00 00 
      Offset 070:  01 00 01 00  00 00 00 00  00 00 00 00  00 00 00 00 
      Offset 080:  05 90 01 00  0C F0 E0 FE  90 49 00 00  00 00 00 00 
      Offset 090:  0D A0 00 00  25 10 4A 07  00 00 00 00  00 00 00 00 
      Offset 0A0:  01 00 02 C8  00 00 00 00  00 00 00 00  00 00 00 00 
      Offset 0B0:  00 00 00 00  00 00 00 00  00 00 00 00  00 00 00 00 
      Offset 0C0:  00 00 00 00  00 00 00 00  00 00 00 00  00 00 00 00 
      Offset 0D0:  00 00 00 01  02 0B 00 00  00 80 11 81  00 00 00 00 
      Offset 0E0:  00 03 00 00  00 00 00 00  01 00 00 00  00 00 00 00 
      Offset 0F0:  00 00 00 00  00 00 00 00  87 0F 07 08  00 00 00 00 

    B00 D1D F00:  Intel Cougar Point PCH - USB EHCI #1 Controller [B-3]
                  
      Offset 000:  86 80 26 1C  06 00 90 02  05 20 03 0C  00 00 00 00 
      Offset 010:  00 60 20 F7  00 00 00 00  00 00 00 00  00 00 00 00 
      Offset 020:  00 00 00 00  00 00 00 00  00 00 00 00  25 10 4A 07 
      Offset 030:  00 00 00 00  50 00 00 00  00 00 00 00  17 01 00 00 
      Offset 040:  00 00 00 00  00 00 00 00  00 00 00 00  00 00 00 00 
      Offset 050:  01 58 C2 C9  00 80 00 00  0A 98 A0 20  00 00 00 00 
      Offset 060:  20 20 01 06  00 00 00 00  01 00 00 01  00 20 00 00 
      Offset 070:  00 00 DF 3F  00 00 00 00  00 00 00 00  00 00 00 00 
      Offset 080:  00 00 80 00  11 88 0C 93  30 0D 00 24  00 00 00 00 
      Offset 090:  00 00 00 00  00 00 00 00  13 00 06 03  00 00 00 00 
      Offset 0A0:  00 00 00 00  00 00 00 00  00 00 00 00  00 00 00 00 
      Offset 0B0:  00 00 00 00  00 00 00 00  00 00 00 00  00 00 00 00 
      Offset 0C0:  00 00 00 00  00 00 00 00  00 00 00 00  00 00 00 00 
      Offset 0D0:  00 00 00 00  00 AA FF 00  00 00 00 00  00 00 00 00 
      Offset 0E0:  00 00 00 00  00 00 00 00  00 00 00 00  04 40 93 DC 
      Offset 0F0:  00 00 00 00  88 85 80 00  87 0F 07 08  08 17 5B 20 

    B00 D1F F00:  Intel H61 PCH - LPC Interface Controller [B-3]
                  
      Offset 000:  86 80 5C 1C  07 00 10 02  05 00 01 06  00 00 80 00 
      Offset 010:  00 00 00 00  00 00 00 00  00 00 00 00  00 00 00 00 
      Offset 020:  00 00 00 00  00 00 00 00  00 00 00 00  25 10 4A 07 
      Offset 030:  00 00 00 00  E0 00 00 00  00 00 00 00  00 00 00 00 
      Offset 040:  01 04 00 00  80 00 00 00  01 05 00 00  10 00 00 00 
      Offset 050:  F8 00 00 00  00 00 00 00  00 00 00 00  00 00 00 00 
      Offset 060:  8A 85 8A 8A  90 00 00 00  80 8B 85 85  F8 F0 00 00 
      Offset 070:  78 F0 78 F0  78 F0 78 F0  78 F0 78 F0  78 F0 78 F0 
      Offset 080:  10 00 04 14  01 0A 3C 00  E1 03 04 00  00 00 00 00 
      Offset 090:  00 00 00 00  00 0F 00 00  00 00 00 00  00 00 00 00 
      Offset 0A0:  08 0E 80 00  09 38 06 00  00 47 00 00  00 00 00 80 
      Offset 0B0:  00 00 00 00  00 00 00 00  04 20 00 00  00 00 00 00 
      Offset 0C0:  00 00 00 00  00 00 00 00  00 00 00 00  00 00 00 00 
      Offset 0D0:  33 22 11 00  67 45 00 00  CF FF 00 00  08 00 00 00 
      Offset 0E0:  09 00 0C 10  00 00 00 00  5F 0A 64 0C  00 00 00 00 
      Offset 0F0:  01 C0 D1 FE  00 00 00 00  87 0F 07 08  00 00 00 00 

    B00 D1F F02:  Intel Cougar Point PCH - SATA Controller [B-3]
                  
      Offset 000:  86 80 00 1C  05 00 B0 02  05 8F 01 01  00 00 00 00 
      Offset 010:  D1 F0 00 00  C1 F0 00 00  B1 F0 00 00  A1 F0 00 00 
      Offset 020:  91 F0 00 00  81 F0 00 00  00 00 00 00  25 10 4A 07 
      Offset 030:  00 00 00 00  70 00 00 00  00 00 00 00  15 02 00 00 
      Offset 040:  00 80 00 80  00 00 00 00  00 00 00 00  00 00 00 00 
      Offset 050:  00 00 00 00  00 00 00 00  00 00 00 00  00 00 00 00 
      Offset 060:  00 00 00 00  00 00 00 00  00 00 00 00  00 00 00 00 
      Offset 070:  01 B0 03 00  08 00 00 00  00 00 00 00  00 00 00 00 
      Offset 080:  05 70 00 00  00 00 00 00  00 00 00 00  00 00 00 00 
      Offset 090:  00 2E 01 81  83 01 00 2E  08 42 5C 01  01 00 00 00 
      Offset 0A0:  E0 00 00 00  39 00 00 00  00 00 00 00  00 00 00 00 
      Offset 0B0:  13 00 06 03  00 00 00 00  00 00 00 00  00 00 00 00 
      Offset 0C0:  00 00 00 00  05 00 00 00  00 00 00 00  00 00 00 00 
      Offset 0D0:  00 00 00 00  00 00 00 00  00 00 00 00  00 00 00 00 
      Offset 0E0:  00 00 00 00  00 00 00 00  00 00 00 00  00 00 00 00 
      Offset 0F0:  00 00 00 00  00 00 00 00  87 0F 07 08  00 00 00 00 

    B00 D1F F03:  Intel Cougar Point PCH - SMBus Controller [B-3]
                  
      Offset 000:  86 80 22 1C  03 00 80 02  05 00 05 0C  00 00 00 00 
      Offset 010:  04 50 20 F7  00 00 00 00  00 00 00 00  00 00 00 00 
      Offset 020:  01 F0 00 00  00 00 00 00  00 00 00 00  25 10 4A 07 
      Offset 030:  00 00 00 00  00 00 00 00  00 00 00 00  0A 03 00 00 
      Offset 040:  01 00 00 00  00 00 00 00  00 00 00 00  00 00 00 00 
      Offset 050:  00 00 00 00  00 00 00 00  00 00 00 00  00 00 00 00 
      Offset 060:  03 04 04 00  00 00 08 08  00 00 00 00  00 00 00 00 
      Offset 070:  00 00 00 00  00 00 00 00  00 00 00 00  00 00 00 00 
      Offset 080:  04 00 00 00  00 00 00 00  00 00 00 00  00 00 00 00 
      Offset 090:  00 00 00 00  00 00 00 00  00 00 00 00  00 00 00 00 
      Offset 0A0:  00 00 00 00  00 00 00 00  00 00 00 00  00 00 00 00 
      Offset 0B0:  00 00 00 00  00 00 00 00  00 00 00 00  00 00 00 00 
      Offset 0C0:  00 00 00 00  00 00 00 00  00 00 00 00  00 00 00 00 
      Offset 0D0:  00 00 00 00  00 00 00 00  00 00 00 00  00 00 00 00 
      Offset 0E0:  00 00 00 00  00 00 00 00  00 00 00 00  00 00 00 00 
      Offset 0F0:  00 00 00 00  00 00 00 00  87 0F 07 08  00 00 00 00 

    B00 D1F F05:  Intel Cougar Point PCH - SATA 2-Port Controller [B-3]
                  
      Offset 000:  86 80 08 1C  05 00 B0 02  05 85 01 01  00 00 00 00 
      Offset 010:  71 F0 00 00  61 F0 00 00  51 F0 00 00  41 F0 00 00 
      Offset 020:  31 F0 00 00  21 F0 00 00  00 00 00 00  25 10 4A 07 
      Offset 030:  00 00 00 00  70 00 00 00  00 00 00 00  15 02 00 00 
      Offset 040:  00 80 00 80  00 00 00 00  00 00 00 00  00 00 00 00 
      Offset 050:  00 00 00 00  00 00 00 00  00 00 00 00  00 00 00 00 
      Offset 060:  00 00 00 00  00 00 00 00  00 00 00 00  00 00 00 00 
      Offset 070:  01 B0 03 00  08 00 00 00  00 00 00 00  00 00 00 00 
      Offset 080:  00 00 00 00  00 00 00 00  00 00 00 00  00 00 00 00 
      Offset 090:  00 02 01 01  00 00 00 00  00 00 00 00  00 00 00 00 
      Offset 0A0:  00 00 00 00  00 00 00 00  00 00 00 00  00 00 00 00 
      Offset 0B0:  13 00 06 03  00 00 00 00  00 00 00 00  00 00 00 00 
      Offset 0C0:  00 00 00 00  00 00 00 00  00 00 00 00  00 00 00 00 
      Offset 0D0:  00 00 00 00  00 00 00 00  00 00 00 00  00 00 00 00 
      Offset 0E0:  00 00 00 00  00 00 00 00  00 00 00 00  00 00 00 00 
      Offset 0F0:  00 00 00 00  00 00 00 00  87 0F 07 08  00 00 00 00 

    B00 D1F F06:  Intel Cougar Point PCH - Thermal Management Controller [B-3]
                  
      Offset 000:  86 80 24 1C  00 00 10 00  05 00 80 11  00 00 00 00 
      Offset 010:  04 00 00 00  00 00 00 00  00 00 00 00  00 00 00 00 
      Offset 020:  00 00 00 00  00 00 00 00  00 00 00 00  25 10 4A 07 
      Offset 030:  00 00 00 00  50 00 00 00  00 00 00 00  0A 03 00 00 
      Offset 040:  05 00 00 E0  00 00 00 00  00 00 00 00  00 00 00 00 
      Offset 050:  01 00 23 00  08 00 00 00  00 00 00 00  00 00 00 00 
      Offset 060:  00 00 00 00  00 00 00 00  00 00 00 00  00 00 00 00 
      Offset 070:  00 00 00 00  00 00 00 00  00 00 00 00  00 00 00 00 
      Offset 080:  05 00 00 00  00 00 00 00  00 00 00 00  00 00 00 00 
      Offset 090:  00 00 00 00  00 00 00 00  00 00 00 00  00 00 00 00 
      Offset 0A0:  00 00 00 00  00 00 00 00  00 00 00 00  00 00 00 00 
      Offset 0B0:  00 00 00 00  00 00 00 00  00 00 00 00  00 00 00 00 
      Offset 0C0:  00 00 00 00  00 00 00 00  00 00 00 00  00 00 00 00 
      Offset 0D0:  00 00 00 00  00 00 00 00  00 00 00 00  00 00 00 00 
      Offset 0E0:  00 00 00 00  00 00 00 00  00 00 00 00  00 00 00 00 
      Offset 0F0:  00 00 00 00  00 00 00 00  87 0F 07 08  00 00 00 00 

    B01 D00 F00:  Zotac GeForce GT 620 Video Adapter
                  
      Offset 000:  DE 10 49 10  07 00 10 00  A1 00 00 03  10 00 80 00 
      Offset 010:  00 00 00 F6  0C 00 00 E8  00 00 00 00  0C 00 00 F0 
      Offset 020:  00 00 00 00  01 E0 00 00  00 00 00 00  4B 17 20 06 
      Offset 030:  00 00 00 00  60 00 00 00  00 00 00 00  10 01 00 00 
      Offset 040:  4B 17 20 06  00 00 00 00  00 00 00 00  00 00 00 00 
      Offset 050:  01 00 00 00  01 00 00 00  CE D6 23 00  00 00 00 00 
      Offset 060:  01 68 03 00  08 00 00 00  05 78 80 00  00 00 00 00 
      Offset 070:  00 00 00 00  00 00 00 00  10 B4 02 00  E0 8D 2C 01 
      Offset 080:  10 29 00 00  01 2D 06 00  40 01 01 11  00 00 00 00 
      Offset 090:  00 00 00 00  00 00 00 00  00 00 00 00  10 00 00 00 
      Offset 0A0:  00 00 00 00  00 00 00 00  01 00 00 00  00 00 00 00 
      Offset 0B0:  00 00 00 00  09 00 14 01  00 00 00 00  00 00 00 00 
      Offset 0C0:  00 00 00 00  00 00 00 00  00 00 00 00  00 00 00 00 
      Offset 0D0:  00 00 00 00  00 00 00 00  00 00 00 00  00 00 00 00 
      Offset 0E0:  00 00 00 00  00 00 00 00  00 00 00 00  00 00 00 00 
      Offset 0F0:  00 00 00 00  00 00 00 00  00 00 00 00  00 00 00 00 

    B01 D00 F01:  nVIDIA GF119 - High Definition Audio Controller
                  
      Offset 000:  DE 10 08 0E  06 00 10 00  A1 00 03 04  10 00 80 00 
      Offset 010:  00 00 08 F7  00 00 00 00  00 00 00 00  00 00 00 00 
      Offset 020:  00 00 00 00  00 00 00 00  00 00 00 00  4B 17 20 06 
      Offset 030:  00 00 00 00  60 00 00 00  00 00 00 00  11 02 00 00 
      Offset 040:  4B 17 20 06  00 00 00 00  00 00 00 00  00 00 00 00 
      Offset 050:  00 00 00 00  00 00 00 00  CE D6 23 00  00 00 00 00 
      Offset 060:  01 68 03 00  08 00 00 00  05 78 80 00  00 00 00 00 
      Offset 070:  00 00 00 00  00 00 00 00  10 00 02 00  A0 8D 2C 01 
      Offset 080:  00 21 00 00  01 2D 05 00  40 01 01 11  00 00 00 00 
      Offset 090:  00 00 00 00  00 00 00 00  00 00 00 00  10 00 00 00 
      Offset 0A0:  00 00 00 00  00 00 00 00  00 00 00 00  00 00 00 00 
      Offset 0B0:  00 00 00 00  00 00 00 00  00 00 00 00  00 00 00 00 
      Offset 0C0:  00 00 00 00  00 00 00 00  00 00 00 00  00 00 00 00 
      Offset 0D0:  00 00 00 00  00 00 00 00  00 00 00 00  00 00 00 00 
      Offset 0E0:  00 00 00 00  00 00 00 00  00 00 00 00  00 00 00 00 
      Offset 0F0:  00 00 00 00  00 00 00 00  00 00 00 00  00 00 00 00 

    B03 D00 F00:  Realtek RTL8168/8111 PCI-E Gigabit Ethernet Adapter
                  
      Offset 000:  EC 10 68 81  07 04 10 00  06 00 00 02  10 00 00 00 
      Offset 010:  01 D0 00 00  00 00 00 00  0C 40 10 F7  00 00 00 00 
      Offset 020:  0C 00 10 F7  00 00 00 00  00 00 00 00  25 10 4A 07 
      Offset 030:  00 00 00 00  40 00 00 00  00 00 00 00  00 01 00 00 
      Offset 040:  01 50 C3 FF  08 01 00 00  00 00 00 00  00 00 00 00 
      Offset 050:  05 70 80 00  00 00 00 00  00 00 00 00  00 00 00 00 
      Offset 060:  00 00 00 00  00 00 00 00  00 00 00 00  00 00 00 00 
      Offset 070:  10 B0 02 02  C1 8C 90 05  07 50 11 00  11 3C 07 00 
      Offset 080:  40 00 11 10  00 00 00 00  00 00 00 00  00 00 00 00 
      Offset 090:  00 00 00 00  10 00 00 00  10 00 00 00  00 00 00 00 
      Offset 0A0:  00 00 00 00  00 00 00 00  00 00 00 00  00 00 00 00 
      Offset 0B0:  11 D0 03 80  04 00 00 00  04 08 00 00  00 00 00 00 
      Offset 0C0:  00 00 00 00  00 00 00 00  00 00 00 00  00 00 00 00 
      Offset 0D0:  03 00 00 00  00 00 00 00  00 00 00 00  00 00 00 00 
      Offset 0E0:  00 00 00 00  00 00 00 00  00 00 00 00  00 00 00 00 
      Offset 0F0:  00 00 00 00  00 00 00 00  00 00 00 00  00 00 00 00 

    PCI-8086-0150:  Intel SNB/IVB/HSW/CRW MCHBAR
                  
      Offset 4000:  66 66 14 00  44 43 10 86  00 00 00 00  6A 59 00 00 
      Offset 4010:  00 00 00 00  00 00 00 00  00 00 00 00  00 00 10 00 
      Offset 4020:  05 00 10 00  20 20 20 20  00 00 0E 00  00 00 00 00 

    PCI-8086-0150:  Intel SNB/IVB/HSW/CRW MCHBAR
                  
      Offset 4280:  00 00 00 00  00 00 00 00  00 00 00 00  44 00 00 00 
      Offset 4290:  80 40 00 00  0F 98 00 00  04 10 B4 46  00 00 00 00 
      Offset 42A0:  00 00 00 00  00 B2 00 01  00 00 00 00  00 00 00 00 

    PCI-8086-0150:  Intel SNB/IVB/HSW/CRW MCHBAR
                  
      Offset 4400:  BB 8B 1C 00  65 64 18 0C  20 22 04 0A  B4 58 00 00 
      Offset 4410:  00 00 00 00  00 00 00 00  00 00 00 00  00 00 10 00 
      Offset 4420:  05 00 10 00  29 29 20 20  33 00 0E 00  00 00 00 00 

    PCI-8086-0150:  Intel SNB/IVB/HSW/CRW MCHBAR
                  
      Offset 4680:  00 00 00 00  00 00 0C 00  00 00 00 00  44 00 00 00 
      Offset 4690:  80 40 00 00  FF 98 00 00  60 18 80 6C  18 42 00 00 
      Offset 46A0:  03 10 00 00  00 82 F8 41  00 00 00 00  01 00 00 00 

    PCI-8086-0150:  Intel SNB/IVB/HSW/CRW MCHBAR
                  
      Offset 4800:  00 00 00 00  00 00 00 00  00 00 00 00  00 00 00 00 
      Offset 4810:  00 00 00 00  00 00 00 00  00 00 00 00  00 00 00 00 

    PCI-8086-0150:  Intel SNB/IVB/HSW/CRW MCHBAR
                  
      Offset 4A80:  00 00 00 00  00 00 00 00  00 00 00 00  00 00 00 00 
      Offset 4A90:  00 00 00 00  00 00 00 00  00 00 00 00  00 00 00 00 

    PCI-8086-0150:  Intel SNB/IVB/HSW/CRW MCHBAR
                  
      Offset 5000:  21 00 00 00  00 00 60 00  10 00 62 00  00 00 60 00 
      Offset 5010:  00 00 00 00  00 00 00 00  00 00 00 00  00 00 00 00 

    PCI-8086-0150:  Intel SNB/IVB/HSW/CRW MCHBAR
                  
      Offset 5880:  E7 71 91 CA  00 00 00 00  D0 DA E4 00  00 00 00 00 
      Offset 5890:  00 00 00 00  C3 4F F7 00  00 00 00 00  00 00 00 00 
      Offset 58A0:  00 00 00 00  00 00 00 00  00 00 00 00  00 00 00 00 
      Offset 58B0:  00 00 00 00  00 00 00 00  00 00 00 00  00 00 00 00 
      Offset 58C0:  00 00 00 00  00 00 00 00  00 00 00 00  00 00 00 00 
      Offset 58D0:  00 00 00 00  00 00 00 00  00 00 00 00  00 00 00 00 
      Offset 58E0:  00 00 00 00  00 00 00 00  00 00 00 00  00 00 00 00 
      Offset 58F0:  00 00 00 00  00 00 00 00  00 00 00 00  00 00 00 00 
      Offset 5900:  00 00 00 00  00 00 00 00  00 00 00 00  00 00 00 00 
      Offset 5910:  00 00 00 00  00 00 00 00  00 00 00 00  00 00 00 00 
      Offset 5920:  00 00 00 00  10 00 00 00  E6 5F 6C 1A  00 00 00 00 
      Offset 5930:  68 02 E0 01  00 00 0D 00  03 10 0A 00  28 03 18 8A 
      Offset 5940:  00 00 00 00  00 00 00 00  00 00 00 00  00 00 00 00 
      Offset 5950:  00 00 00 00  00 00 04 00  00 1F 01 E0  00 10 08 00 
      Offset 5960:  00 00 00 00  BC C9 CB BC  88 AF CB BC  A3 AE 68 F1 
      Offset 5970:  00 00 00 00  00 00 00 00  2A 00 00 00  2A 00 00 00 
      Offset 5980:  2A 00 00 00  D4 7D E2 7B  00 00 00 00  00 00 00 00 
      Offset 5990:  FF 00 00 00  FF 00 00 00  15 0D 07 00  00 14 69 00 
      Offset 59A0:  00 00 00 00  00 00 00 00  00 00 00 00  00 00 00 00 
      Offset 59B0:  80 03 00 80  94 14 14 18  70 01 00 80  94 14 14 18 
      Offset 59C0:  00 00 42 88  00 00 00 00  00 00 00 00  00 00 00 00 

    PCI-8086-0150:  Intel SNB/IVB/HSW/CRW MCHBAR
                  
      Offset 5E00:  06 00 00 00  06 00 00 00  00 00 00 00  00 00 00 00 
      Offset 5E10:  00 00 00 00  00 00 00 00  00 00 00 00  00 00 00 00 

    PCI-8086-1C24:  Intel 5/6/7/8-series PCH TBARB
                  
      Offset 00:  00 BA 00 EA  2B 3A 00 00  82 00 2D 00  00 00 C0 00 
      Offset 10:  00 00 40 1A  87 DE 8C 80  00 00 3F FF  00 00 00 00 
      Offset 20:  00 00 25 0A  00 00 00 00  00 00 00 00  00 00 00 00 
      Offset 30:  00 00 00 00  00 00 00 00  00 00 00 00  00 00 80 80 
      Offset 40:  00 02 00 FF  00 00 00 00  00 00 00 00  00 00 00 00 
      Offset 50:  00 00 00 00  00 00 00 00  00 00 00 00  00 00 00 00 
      Offset 60:  00 00 00 00  00 00 00 00  00 00 00 00  20 1B 16 05 
      Offset 70:  00 00 00 00  00 00 00 00  00 00 00 00  00 00 00 00 
      Offset 80:  00 00 00 04  6A 6B 00 FF  00 00 00 00  00 00 00 00 
      Offset 90:  F8 6E BA 49  00 00 00 00  00 00 00 00  00 00 00 00 
      Offset A0:  00 00 00 00  00 00 00 00  00 00 00 00  00 00 00 00 
      Offset B0:  00 00 00 00  00 00 00 00  00 00 00 00  00 00 00 00 
      Offset C0:  00 00 00 00  00 00 00 FF  00 00 00 00  00 00 00 00 
      Offset D0:  00 00 00 00  00 00 00 00  38 00 77 00  00 00 00 00 
      Offset E0:  00 00 00 00  00 00 00 00  00 00 00 00  00 00 00 00 
      Offset F0:  00 00 00 00  00 00 00 00  00 00 00 00  00 00 00 00 


--------[ Debug - Video BIOS ]------------------------------------------------------------------------------------------

    C000:0000  U.p.K7400.L.w.VIDEO ..........IBM VGA Compatible......)Q12/10/12
    C000:0040  ..........P......q+.K. ..../.d..........9....E..EPMIDl.o.......
    C000:0080  .....3GeForce GT 620 VGA BIOS (VB1).............................
    C000:00C0  .......................Version 75.19.64.00.0B ...Copyright (C) 1
    C000:0100  996-2012 NVIDIA Corp..............GF119 Board - 13100003........
    C000:0140  .....Chip Rev   ................................................
    C000:0180  ........PCIR..I.........p.......HYB$..BIT......E2...,.B.!.8.C...
    C000:01C0  Y.D...g.A...k.I...n.L.....M.....N.....P.D...S.....T.....U.....V.
    C000:0200  ....x.....d.....p.....i.C.....S.SK.b.k-..................d.u....
    C000:0240  ..............\\....0.............L....;O.C....M.M.M.M.N;O.M..;O
    C000:0280  KT..L.L.p..=q..rM...k...l...n...p...p.......p......Fp...l.......
    C000:02C0  ....l...l...l............P.....(SK.gK#".#E...P.K..K.K...........
    C000:0300  a.b.b............d.u...7.......06/28/12.........................
    C000:0340  300.13100003..................u.n.............E....b .........u.
    C000:0380  n.........,......b1.......5...........n.....G.....L...X...Q.f.u.
    C000:03C0  ......;...0...........U...a.....X.f...............n.....q.....t.


--------[ Debug - Unknown ]---------------------------------------------------------------------------------------------

    Monitor ID      FND02B8: Generic PnP Monitor [NoDB]
    Monitor Model   F191WL


------------------------------------------------------------------------------------------------------------------------

The names of actual companies and products mentioned herein may be the trademarks of their respective owners.
