5011551
annia hernandez
367
--------[ AIDA64 Extreme Edition ]--------------------------------------------------------------------------------------

    Versión                                           AIDA64 v3.00.2529 Beta/es
    Módulo de rendimiento                             4.0.568-x32
    Página principal                                  http://www.aida64.com/
    Tipo de informe                                   Asistente de informes
    Equipo                                            LENOVO11-PC
    Generador                                         lenovo
    Sistema operativo                                 Microsoft Windows 7 Ultimate 6.1.7600.16385 (Win7 RTM)
    Fecha                                             2015-06-30
    Hora                                              09:47


--------[ Resumen ]-----------------------------------------------------------------------------------------------------

    Equipo:
      Tipo de equipo                                    ACPI x86-based PC  (Mobile)
      Sistema operativo                                 Microsoft Windows 7 Ultimate
      Service Pack del SO                               -
      Internet Explorer                                 8.0.7600.16385 (IE 8.0 - Windows 7)
      DirectX                                           DirectX 11.0
      Nombre del equipo                                 LENOVO11-PC
      Nombre de usuario                                 lenovo
      Dirección de correo electrónico SMTP              annia@fbio.uh.cu
      Dominio de inicio de sesión                       LENOVO11-PC
      Fecha / Hora                                      2015-06-30 / 09:47

    Placa base:
      Tipo de CPU                                       Mobile DualCore Intel Core i3-2330M, 2200 MHz (22 x 100)
      Nombre de la placa base                           Lenovo ThinkPad E420
      Chipset de la placa base                          Intel Cougar Point HM65, Intel Sandy Bridge
      Memoria del sistema                               1953 MB  (DDR3-1333 DDR3 SDRAM)
      DIMM3: Ramaxel RMT3010KD58E8F1333                 2 GB DDR3-1333 DDR3 SDRAM  (9-9-9-24 @ 666 MHz)  (8-8-8-22 @ 609 MHz)  (7-7-7-20 @ 533 MHz)  (6-6-6-17 @ 457 MHz)  (5-5-5-14 @ 380 MHz)
      Tipo de BIOS                                      Phoenix (08/03/2011)

    Pantalla:
      Adaptador de video                                Mobile Intel(R) HD Graphics  (803448 KB)
      Adaptador de video                                Mobile Intel(R) HD Graphics  (803448 KB)
      Aceleradora 3D                                    AMD Radeon HD 6630M (Whistler)
      Aceleradora 3D                                    Intel HD Graphics 3000
      Monitor                                           Samsung 140AT20-L01  [14" LCD]

    Multimedia:
      Adaptador de audio                                Conexant Cx20590 @ Intel Cougar Point PCH - High Definition Audio Controller [B-2]
      Adaptador de audio                                Intel Cougar Point HDMI @ Intel Cougar Point PCH - High Definition Audio Controller [B-2]

    Almacenamiento:
      Controlador IDE                                   Intel(R) 6 Series/C200 Series Chipset Family 6 Port SATA AHCI Controller - 1C03
      Controlador de almacenamiento                     Alcohol SCSI Controller
      Unidad de disco                                   Kingston DataTraveler 102 USB Device  (3 GB, USB)
      Unidad de disco                                   ST9500420AS ATA Device  (500 GB, 7200 RPM, SATA-II)
      Unidad óptica                                     HL-DT-ST DVDRAM GT33N ATA Device
      Estado SMART de los discos duros                  Aceptar

    Particiones:
      C: (NTFS)                                         228.0 GB (157.2 GB libre)
      D: (NTFS)                                         11999 MB (3614 MB libre)
      E: (NTFS)                                         224.8 GB (46.4 GB libre)
      Tamaño total                                      464.6 GB (207.1 GB libre)

    Entrada:
      Teclado                                           Standard PS/2 Keyboard
      Mouse                                             PS/2 Compatible Mouse

    Red:
      Dirección IP primaria                             192.168.0.113
      Dirección MAC primaria                            38-59-F9-DF-5E-A2
      Adaptador de red                                  1x1 11b/g/n Wireless LAN PCI Express Half Mini Card Adapter  (192.168.0.113)
      Adaptador de red                                  Microsoft Virtual WiFi Miniport Adapter
      Adaptador de red                                  Realtek PCIe GBE Family Controller

    Periféricos:
      Impresora                                         Adobe PDF
      Impresora                                         Enviar a OneNote 2007
      Impresora                                         Fax
      Impresora                                         HP LaserJet P1505n (Copy 1)
      Impresora                                         HP LaserJet P1505n
      Impresora                                         HP LaserJet Professional P1566
      Impresora                                         Microsoft XPS Document Writer
      Controlador USB2                                  Intel Cougar Point PCH - USB EHCI #1 Controller [B-2]
      Controlador USB2                                  Intel Cougar Point PCH - USB EHCI #2 Controller [B-2]
      Dispositivo USB                                   Generic USB Hub
      Dispositivo USB                                   Generic USB Hub
      Dispositivo USB                                   Integrated Camera
      Dispositivo USB                                   USB Composite Device
      Dispositivo USB                                   USB Mass Storage Device
      Batería                                           Microsoft AC Adapter
      Batería                                           Microsoft ACPI-Compliant Control Method Battery
      Batería                                           Microsoft Composite Battery

    DMI:
      Vendedor del BIOS DMI                             LENOVO
      Versión del BIOS DMI                              8HET35WW(1.17)
      Fabricante del sistema DMI                        LENOVO
      Producto del sistema DMI                          1141AYC
      Versión del sistema DMI                           ThinkPad E420
      Número de serie del sistema DMI                   R9G0V1Y
      UUID del sistema DMI                              81A586A6-1B51CB11-96F69D4A-6881E507
      Fabricante de la placa base DMI                   LENOVO
      Producto de la placa base DMI                     1141AYC
      Versión de la placa base DMI                      Not Available
      Número de serie de la placa base DMI              1ZJUV18Z4H8
      Fabricante del chasis DMI                         LENOVO
      Versión del chasis DMI                            Not Available
      Número de serie del chasis DMI                    R9G0V1Y
      Identificador del chasis DMI                      No Asset Information
      Tipo de chasis DMI                                Notebook


--------[ Debug - PCI ]-------------------------------------------------------------------------------------------------

    B00 D00 F00:  Intel Sandy Bridge-MB - Host Bridge/DRAM Controller
                  
      Offset 000:  86 80 04 01  06 00 90 20  09 00 00 06  00 00 00 00 
      Offset 010:  00 00 00 00  00 00 00 00  00 00 00 00  00 00 00 00 
      Offset 020:  00 00 00 00  00 00 00 00  00 00 00 00  AA 17 E2 21 
      Offset 030:  00 00 00 00  E0 00 00 00  00 00 00 00  00 00 00 00 
      Offset 040:  01 90 D1 FE  00 00 00 00  01 00 D1 FE  00 00 00 00 
      Offset 050:  11 02 00 00  19 00 00 00  0F 00 10 7F  01 00 80 7A 
      Offset 060:  05 00 00 F8  00 00 00 00  01 80 D1 FE  00 00 00 00 
      Offset 070:  00 00 80 7F  00 00 00 00  00 0C 80 FF  7F 00 00 00 
      Offset 080:  10 11 11 11  11 11 11 00  1A 00 00 00  00 00 00 00 
      Offset 090:  01 00 00 00  01 00 00 00  01 00 50 00  01 00 00 00 
      Offset 0A0:  01 00 00 80  00 00 00 00  01 00 60 00  01 00 00 00 
      Offset 0B0:  01 00 20 7B  01 00 00 7B  01 00 80 7A  01 00 20 7F 
      Offset 0C0:  00 00 00 00  00 00 00 00  00 00 00 00  00 00 00 00 
      Offset 0D0:  00 00 00 00  00 00 00 00  00 00 00 00  00 00 00 00 
      Offset 0E0:  09 00 0C 01  96 61 80 E2  90 00 00 14  00 00 00 00 
      Offset 0F0:  00 00 00 01  00 00 00 00  B8 0F 06 00  00 00 00 00 

    B00 D01 F00:  Intel Sandy Bridge-DT - PCI Express Graphics Root Port
                  
      Offset 000:  86 80 01 01  07 00 10 00  09 00 04 06  10 00 81 00 
      Offset 010:  00 00 00 00  00 00 00 00  00 01 01 00  60 60 00 00 
      Offset 020:  60 A2 60 A2  01 80 F1 8F  00 00 00 00  00 00 00 00 
      Offset 030:  00 00 00 00  88 00 00 00  00 00 00 00  10 01 00 00 
      Offset 040:  00 00 00 00  00 00 00 00  00 00 00 00  00 00 00 00 
      Offset 050:  00 00 00 00  00 00 00 00  00 00 00 00  00 00 00 00 
      Offset 060:  00 00 00 00  00 00 00 00  00 00 00 00  00 00 00 00 
      Offset 070:  00 00 00 00  00 00 00 00  00 00 00 00  00 00 00 0A 
      Offset 080:  01 90 03 C8  08 00 00 00  0D 80 00 00  AA 17 E2 21 
      Offset 090:  05 A0 00 00  00 00 00 00  00 00 00 00  00 00 00 00 
      Offset 0A0:  10 00 42 01  00 80 00 00  00 00 00 00  02 2D 21 02 
      Offset 0B0:  43 00 11 D8  80 25 0C 00  00 00 48 00  00 00 00 00 
      Offset 0C0:  00 00 00 00  00 08 00 00  00 00 00 00  00 00 00 00 
      Offset 0D0:  02 16 00 00  00 00 00 00  00 00 00 00  00 00 00 00 
      Offset 0E0:  00 00 00 00  00 00 00 00  00 00 00 00  00 00 00 00 
      Offset 0F0:  00 00 00 00  00 00 01 00  00 00 00 00  00 00 10 00 

    B00 D02 F00:  Intel Sandy Bridge-MB - Integrated Graphics Controller (MB GT2)
                  
      Offset 000:  86 80 16 01  07 00 90 00  09 00 00 03  00 00 00 00 
      Offset 010:  04 00 00 A0  00 00 00 00  0C 00 00 90  00 00 00 00 
      Offset 020:  01 70 00 00  00 00 00 00  00 00 00 00  AA 17 E3 21 
      Offset 030:  00 00 00 00  90 00 00 00  00 00 00 00  10 01 00 00 
      Offset 040:  09 00 0C 01  96 61 80 E2  90 00 00 14  00 00 00 00 
      Offset 050:  11 02 00 00  19 00 00 00  00 00 00 00  01 00 20 7B 
      Offset 060:  00 00 02 00  00 00 00 00  00 00 00 00  00 00 00 00 
      Offset 070:  00 00 00 00  00 00 00 00  00 00 00 00  00 00 00 00 
      Offset 080:  00 00 00 00  00 00 00 00  00 00 00 00  00 00 00 00 
      Offset 090:  05 D0 00 00  00 00 00 00  00 00 00 00  00 00 00 00 
      Offset 0A0:  00 00 00 00  13 00 06 03  00 00 00 00  00 00 00 00 
      Offset 0B0:  00 00 00 00  00 00 00 00  00 00 00 00  00 00 00 00 
      Offset 0C0:  00 00 00 00  00 00 00 00  00 00 00 00  00 00 00 00 
      Offset 0D0:  01 A4 22 00  00 00 00 00  00 00 00 00  00 00 00 00 
      Offset 0E0:  00 00 00 00  00 00 00 00  00 80 00 00  00 00 00 00 
      Offset 0F0:  00 00 00 00  00 00 00 00  00 00 06 00  18 40 71 7A 

    B00 D16 F00:  Intel Cougar Point PCH - Manageability Engine Interface 1 [B-2]
                  
      Offset 000:  86 80 3A 1C  06 00 10 00  04 00 80 07  00 00 80 00 
      Offset 010:  04 50 70 A2  00 00 00 00  00 00 00 00  00 00 00 00 
      Offset 020:  00 00 00 00  00 00 00 00  00 00 00 00  AA 17 E2 21 
      Offset 030:  00 00 00 00  50 00 00 00  00 00 00 00  10 01 00 00 
      Offset 040:  45 02 00 1E  08 00 01 80  06 00 00 60  F8 07 00 10 
      Offset 050:  01 8C 03 C8  08 00 00 00  00 00 00 00  00 00 00 00 
      Offset 060:  00 00 00 00  00 00 00 00  00 00 00 00  00 00 00 00 
      Offset 070:  00 00 00 00  00 00 00 00  00 00 00 00  00 00 00 00 
      Offset 080:  00 00 00 00  00 00 00 00  00 00 00 00  05 00 80 00 
      Offset 090:  00 00 00 00  00 00 00 00  00 00 00 00  00 00 00 00 
      Offset 0A0:  00 00 00 00  00 00 00 00  00 00 00 00  00 00 00 00 
      Offset 0B0:  00 00 00 00  00 00 00 00  00 00 00 00  02 00 00 C0 
      Offset 0C0:  4D 4C F4 34  9F BF 9A 1A  67 66 6A 41  E0 A5 14 A4 
      Offset 0D0:  BC C8 08 46  F1 FB 48 BD  33 10 4F CC  69 40 E9 74 
      Offset 0E0:  00 00 00 00  00 00 00 00  00 00 00 00  00 00 00 00 
      Offset 0F0:  00 00 00 00  00 00 00 00  00 00 00 00  00 00 00 00 

    B00 D1A F00:  Intel Cougar Point PCH - USB EHCI #2 Controller [B-2]
                  
      Offset 000:  86 80 2D 1C  06 00 90 02  04 20 03 0C  00 00 00 00 
      Offset 010:  00 A0 70 A2  00 00 00 00  00 00 00 00  00 00 00 00 
      Offset 020:  00 00 00 00  00 00 00 00  00 00 00 00  AA 17 E2 21 
      Offset 030:  00 00 00 00  50 00 00 00  00 00 00 00  10 01 00 00 
      Offset 040:  00 00 00 00  00 00 00 00  00 00 00 00  00 00 00 00 
      Offset 050:  01 58 C2 C9  00 80 00 00  0A 98 A0 20  00 00 00 00 
      Offset 060:  20 20 81 07  00 00 00 00  01 00 00 00  00 20 00 C0 
      Offset 070:  00 00 DF 3F  00 00 00 00  00 00 00 00  00 00 00 00 
      Offset 080:  00 00 80 00  11 88 0C 93  30 0D 00 24  00 00 00 00 
      Offset 090:  00 00 00 00  00 00 00 00  13 00 06 03  00 00 00 00 
      Offset 0A0:  00 00 00 00  00 00 00 00  00 00 00 00  00 00 00 00 
      Offset 0B0:  00 00 00 00  00 00 00 00  00 00 00 00  00 00 00 00 
      Offset 0C0:  00 00 00 00  00 00 00 00  00 00 00 00  00 00 00 00 
      Offset 0D0:  00 00 00 00  00 AA FF 00  00 00 00 00  00 00 00 00 
      Offset 0E0:  00 00 00 00  00 00 00 00  00 00 00 00  04 00 BD 78 
      Offset 0F0:  00 00 00 00  88 85 80 00  87 0F 06 08  08 17 5B 20 

    B00 D1B F00:  Intel Cougar Point PCH - High Definition Audio Controller [B-2]
                  
      Offset 000:  86 80 20 1C  06 00 10 00  04 00 03 04  10 00 00 00 
      Offset 010:  04 00 70 A2  00 00 00 00  00 00 00 00  00 00 00 00 
      Offset 020:  00 00 00 00  00 00 00 00  00 00 00 00  AA 17 E2 21 
      Offset 030:  00 00 00 00  50 00 00 00  00 00 00 00  16 01 00 00 
      Offset 040:  01 00 00 45  00 00 00 00  00 00 00 00  00 00 00 00 
      Offset 050:  01 60 42 C8  00 00 00 00  00 00 00 00  00 00 00 00 
      Offset 060:  05 70 80 00  00 00 00 00  00 00 00 00  00 00 00 00 
      Offset 070:  10 00 91 00  00 00 00 10  00 08 10 00  00 00 00 00 
      Offset 080:  00 00 00 00  00 00 00 00  00 00 00 00  00 00 00 00 
      Offset 090:  00 00 00 00  00 00 00 00  00 00 00 00  00 00 00 00 
      Offset 0A0:  00 00 00 00  00 00 00 00  00 00 00 00  00 00 00 00 
      Offset 0B0:  00 00 00 00  00 00 00 00  00 00 00 00  00 00 00 00 
      Offset 0C0:  00 04 00 01  02 24 00 40  00 0C A3 82  10 00 33 02 
      Offset 0D0:  00 0C A3 02  10 00 33 02  00 00 00 00  00 00 00 00 
      Offset 0E0:  00 00 00 00  00 00 00 00  00 00 00 00  00 00 00 00 
      Offset 0F0:  00 00 00 00  00 00 00 00  87 0F 06 08  00 00 00 00 

    B00 D1C F00:  Intel Cougar Point PCH - PCI Express Port 1 [B-2]
                  
      Offset 000:  86 80 10 1C  04 00 10 00  B4 00 04 06  10 00 81 00 
      Offset 010:  00 00 00 00  00 00 00 00  00 02 02 00  F0 00 00 20 
      Offset 020:  F0 FF 00 00  F1 FF 01 00  00 00 00 00  00 00 00 00 
      Offset 030:  00 00 00 00  40 00 00 00  00 00 00 00  10 01 00 00 
      Offset 040:  10 80 42 01  00 80 00 00  00 00 10 00  12 4C 12 01 
      Offset 050:  03 00 01 10  00 B2 04 00  00 00 00 00  00 00 00 00 
      Offset 060:  00 00 00 00  16 00 00 00  00 00 00 00  00 00 00 00 
      Offset 070:  02 00 01 00  00 00 00 00  00 00 00 00  00 00 00 00 
      Offset 080:  05 90 00 00  00 00 00 00  00 00 00 00  00 00 00 00 
      Offset 090:  0D A0 00 00  AA 17 E2 21  00 00 00 00  00 00 00 00 
      Offset 0A0:  01 00 02 C8  00 00 00 00  00 00 00 00  00 00 00 00 
      Offset 0B0:  00 00 00 00  00 00 00 00  00 00 00 00  00 00 00 00 
      Offset 0C0:  00 00 00 00  00 00 00 00  00 00 00 00  00 00 00 00 
      Offset 0D0:  00 00 00 01  02 0B 00 00  00 80 11 81  00 00 00 00 
      Offset 0E0:  00 3F 00 00  00 00 00 00  03 00 00 00  00 00 00 00 
      Offset 0F0:  00 00 00 00  00 00 00 00  87 0F 06 08  00 00 00 00 

    B00 D1C F01:  Intel Cougar Point PCH - PCI Express Port 2 [B-2]
                  
      Offset 000:  86 80 12 1C  07 00 10 00  B4 00 04 06  10 00 81 00 
      Offset 010:  00 00 00 00  00 00 00 00  00 03 03 00  50 50 00 20 
      Offset 020:  F0 FF 00 00  41 A0 41 A0  00 00 00 00  00 00 00 00 
      Offset 030:  00 00 00 00  40 00 00 00  00 00 00 00  11 02 00 00 
      Offset 040:  10 80 42 01  00 80 00 00  00 00 10 00  12 3C 12 02 
      Offset 050:  43 00 11 70  00 B2 0C 00  00 00 40 01  00 00 00 00 
      Offset 060:  00 00 00 00  16 00 00 00  00 00 00 00  00 00 00 00 
      Offset 070:  02 00 01 00  00 00 00 00  00 00 00 00  00 00 00 00 
      Offset 080:  05 90 00 00  00 00 00 00  00 00 00 00  00 00 00 00 
      Offset 090:  0D A0 00 00  AA 17 E2 21  00 00 00 00  00 00 00 00 
      Offset 0A0:  01 00 02 C8  00 00 00 00  00 00 00 00  00 00 00 00 
      Offset 0B0:  00 00 00 00  00 00 00 00  00 00 00 00  00 00 00 00 
      Offset 0C0:  00 00 00 00  00 00 00 00  00 00 00 00  00 00 00 00 
      Offset 0D0:  00 00 00 01  02 0B 00 00  00 80 11 81  00 00 00 00 
      Offset 0E0:  00 03 00 00  00 00 00 00  03 00 00 00  00 00 00 00 
      Offset 0F0:  00 00 00 00  00 00 00 00  87 0F 06 08  00 00 00 00 

    B00 D1C F02:  Intel Cougar Point PCH - PCI Express Port 3 [B-2]
                  
      Offset 000:  86 80 14 1C  07 00 10 00  B4 00 04 06  10 00 81 00 
      Offset 010:  00 00 00 00  00 00 00 00  00 04 08 00  40 40 00 20 
      Offset 020:  E0 A1 50 A2  51 A0 C1 A0  00 00 00 00  00 00 00 00 
      Offset 030:  00 00 00 00  40 00 00 00  00 00 00 00  12 03 00 00 
      Offset 040:  10 80 42 01  00 80 00 00  00 00 10 00  12 3C 12 03 
      Offset 050:  42 00 11 50  60 B2 14 00  08 00 00 01  00 00 00 00 
      Offset 060:  00 00 00 00  16 00 00 00  00 00 00 00  00 00 00 00 
      Offset 070:  02 00 01 00  00 00 00 00  00 00 00 00  00 00 00 00 
      Offset 080:  05 90 00 00  00 00 00 00  00 00 00 00  00 00 00 00 
      Offset 090:  0D A0 00 00  AA 17 E2 21  00 00 00 00  00 00 00 00 
      Offset 0A0:  01 00 02 C8  00 00 00 00  00 00 00 00  00 00 00 00 
      Offset 0B0:  00 00 00 00  00 00 00 00  00 00 00 00  00 00 00 00 
      Offset 0C0:  00 00 00 00  00 00 00 00  00 00 00 00  00 00 00 00 
      Offset 0D0:  00 00 00 01  02 0B 00 00  02 80 11 C1  00 00 00 00 
      Offset 0E0:  00 03 00 00  00 00 00 00  01 00 00 00  00 00 00 00 
      Offset 0F0:  00 00 00 00  00 00 00 00  87 0F 06 08  00 00 00 00 

    B00 D1C F03:  Intel Cougar Point PCH - PCI Express Port 4 [B-2]
                  
      Offset 000:  86 80 16 1C  07 00 10 00  B4 00 04 06  10 00 81 00 
      Offset 010:  00 00 00 00  00 00 00 00  00 09 09 00  30 30 00 00 
      Offset 020:  D0 A1 D0 A1  F1 FF 01 00  00 00 00 00  00 00 00 00 
      Offset 030:  00 00 00 00  40 00 00 00  00 00 00 00  13 04 00 00 
      Offset 040:  10 80 42 01  00 80 00 00  00 00 10 00  12 3C 12 04 
      Offset 050:  43 00 11 70  00 B2 1C 00  00 00 40 01  00 00 00 00 
      Offset 060:  00 00 00 00  16 00 00 00  00 00 00 00  00 00 00 00 
      Offset 070:  02 00 01 00  00 00 00 00  00 00 00 00  00 00 00 00 
      Offset 080:  05 90 00 00  00 00 00 00  00 00 00 00  00 00 00 00 
      Offset 090:  0D A0 00 00  AA 17 E2 21  00 00 00 00  00 00 00 00 
      Offset 0A0:  01 00 02 C8  00 00 00 00  00 00 00 00  00 00 00 00 
      Offset 0B0:  00 00 00 00  00 00 00 00  00 00 00 00  00 00 00 00 
      Offset 0C0:  00 00 00 00  00 00 00 00  00 00 00 00  00 00 00 00 
      Offset 0D0:  00 00 00 01  02 0B 00 00  00 80 11 81  00 00 00 00 
      Offset 0E0:  00 03 00 00  00 00 00 00  03 00 00 00  00 00 00 00 
      Offset 0F0:  00 00 00 00  00 00 00 00  87 0F 06 08  00 00 00 00 

    B00 D1C F07:  Intel Cougar Point PCH - PCI Express Port 8 [B-2]
                  
      Offset 000:  86 80 1E 1C  07 00 10 00  B4 00 04 06  10 00 81 00 
      Offset 010:  00 00 00 00  00 00 00 00  00 0A 0E 00  20 20 00 20 
      Offset 020:  50 A1 C0 A1  D1 A0 41 A1  00 00 00 00  00 00 00 00 
      Offset 030:  00 00 00 00  40 00 00 00  00 00 00 00  13 04 00 00 
      Offset 040:  10 80 42 01  00 80 00 00  00 00 10 00  12 4C 12 08 
      Offset 050:  03 00 01 10  60 B2 3C 00  08 00 00 00  00 00 00 00 
      Offset 060:  00 00 00 00  16 00 00 00  00 00 00 00  00 00 00 00 
      Offset 070:  02 00 01 00  00 00 00 00  00 00 00 00  00 00 00 00 
      Offset 080:  05 90 00 00  00 00 00 00  00 00 00 00  00 00 00 00 
      Offset 090:  0D A0 00 00  AA 17 E2 21  00 00 00 00  00 00 00 00 
      Offset 0A0:  01 00 02 C8  00 00 00 00  00 00 00 00  00 00 00 00 
      Offset 0B0:  00 00 00 00  00 00 00 00  00 00 00 00  00 00 00 00 
      Offset 0C0:  00 00 00 00  00 00 00 00  00 00 00 00  00 00 00 00 
      Offset 0D0:  00 00 00 01  02 0B 00 00  02 80 11 41  00 00 00 00 
      Offset 0E0:  00 03 00 00  00 00 00 00  03 00 00 00  00 00 00 00 
      Offset 0F0:  00 00 00 00  00 00 00 00  87 0F 06 08  00 00 00 00 

    B00 D1D F00:  Intel Cougar Point PCH - USB EHCI #1 Controller [B-2]
                  
      Offset 000:  86 80 26 1C  06 00 90 02  04 20 03 0C  00 00 00 00 
      Offset 010:  00 90 70 A2  00 00 00 00  00 00 00 00  00 00 00 00 
      Offset 020:  00 00 00 00  00 00 00 00  00 00 00 00  AA 17 E2 21 
      Offset 030:  00 00 00 00  50 00 00 00  00 00 00 00  17 01 00 00 
      Offset 040:  00 00 00 00  00 00 00 00  00 00 00 00  00 00 00 00 
      Offset 050:  01 58 C2 C9  00 80 00 00  0A 98 A0 20  00 00 00 00 
      Offset 060:  20 20 01 06  00 00 00 00  01 00 00 00  00 20 00 C0 
      Offset 070:  00 00 DF 3F  00 00 00 00  00 00 00 00  00 00 00 00 
      Offset 080:  00 00 80 00  11 88 0C 93  30 0D 00 24  00 00 00 00 
      Offset 090:  00 00 00 00  00 00 00 00  13 00 06 03  00 00 00 00 
      Offset 0A0:  00 00 00 00  00 00 00 00  00 00 00 00  00 00 00 00 
      Offset 0B0:  00 00 00 00  00 00 00 00  00 00 00 00  00 00 00 00 
      Offset 0C0:  00 00 00 00  00 00 00 00  00 00 00 00  00 00 00 00 
      Offset 0D0:  00 00 00 00  00 AA FF 00  00 00 00 00  00 00 00 00 
      Offset 0E0:  00 00 00 00  01 94 22 01  41 16 08 80  04 90 7A 78 
      Offset 0F0:  00 00 00 00  88 85 80 00  87 0F 06 08  08 17 5B 20 

    B00 D1F F00:  Intel HM65 PCH - LPC Interface Controller [B-2]
                  
      Offset 000:  86 80 49 1C  07 00 10 02  04 00 01 06  00 00 80 00 
      Offset 010:  00 00 00 00  00 00 00 00  00 00 00 00  00 00 00 00 
      Offset 020:  00 00 00 00  00 00 00 00  00 00 00 00  AA 17 E2 21 
      Offset 030:  00 00 00 00  E0 00 00 00  00 00 00 00  00 00 00 00 
      Offset 040:  01 04 00 00  80 00 00 00  01 05 00 00  10 00 00 00 
      Offset 050:  F8 00 00 00  00 00 00 00  00 00 00 00  00 00 00 00 
      Offset 060:  8B 8A 87 8B  D0 00 00 00  80 80 87 8A  F8 F0 00 00 
      Offset 070:  78 00 79 00  7A 00 7B 00  7C 00 7D 00  7E 00 7F 00 
      Offset 080:  10 00 0F 3F  69 00 04 00  00 00 00 00  00 00 00 00 
      Offset 090:  A1 06 0C 00  00 0F 00 00  01 00 80 FE  00 00 00 00 
      Offset 0A0:  04 0E 80 00  09 38 06 00  00 47 00 00  00 00 00 80 
      Offset 0B0:  00 00 00 00  00 00 00 00  00 80 00 00  00 00 00 00 
      Offset 0C0:  00 00 00 00  00 00 00 00  00 00 00 00  00 00 00 00 
      Offset 0D0:  0F 00 00 00  67 45 00 00  00 FF 00 00  08 00 00 00 
      Offset 0E0:  09 00 0C 10  00 00 00 00  13 06 64 0E  00 00 00 00 
      Offset 0F0:  01 C0 D1 FE  00 00 00 00  87 0F 06 08  00 00 00 00 

    B00 D1F F02:  Intel Cougar Point-M PCH - SATA AHCI 6-Port Controller [B-2]
                  
      Offset 000:  86 80 03 1C  07 00 B0 02  04 01 06 01  00 00 00 00 
      Offset 010:  89 70 00 00  95 70 00 00  81 70 00 00  91 70 00 00 
      Offset 020:  61 70 00 00  00 80 70 A2  00 00 00 00  AA 17 E2 21 
      Offset 030:  00 00 00 00  80 00 00 00  00 00 00 00  13 02 00 00 
      Offset 040:  00 80 00 80  00 00 00 00  00 00 00 00  00 00 00 00 
      Offset 050:  00 00 00 00  00 00 00 00  00 00 00 00  00 00 00 00 
      Offset 060:  00 00 00 00  00 00 00 00  00 00 00 00  00 00 00 00 
      Offset 070:  01 A8 03 40  08 00 00 00  00 00 00 00  00 00 00 00 
      Offset 080:  05 70 00 00  00 00 00 00  00 00 00 00  00 00 00 00 
      Offset 090:  60 0E 31 91  83 01 00 0E  08 42 5C 01  00 00 00 00 
      Offset 0A0:  E0 00 00 00  39 00 00 00  12 B0 10 00  48 00 00 00 
      Offset 0B0:  13 00 06 03  00 00 00 00  00 00 00 00  00 00 00 00 
      Offset 0C0:  00 00 00 00  05 00 00 00  00 00 00 00  00 00 00 00 
      Offset 0D0:  00 00 00 00  00 00 00 00  00 00 00 00  00 00 00 00 
      Offset 0E0:  00 00 00 00  00 00 00 00  00 00 00 00  00 00 00 00 
      Offset 0F0:  00 00 00 00  00 00 00 00  87 0F 06 08  00 00 00 00 

    B00 D1F F03:  Intel Cougar Point PCH - SMBus Controller [B-2]
                  
      Offset 000:  86 80 22 1C  03 00 80 02  04 00 05 0C  00 00 00 00 
      Offset 010:  04 40 70 A2  00 00 00 00  00 00 00 00  00 00 00 00 
      Offset 020:  A1 EF 00 00  00 00 00 00  00 00 00 00  AA 17 E2 21 
      Offset 030:  00 00 00 00  00 00 00 00  00 00 00 00  07 03 00 00 
      Offset 040:  01 00 00 00  00 00 00 00  00 00 00 00  00 00 00 00 
      Offset 050:  00 00 00 00  00 00 00 00  00 00 00 00  00 00 00 00 
      Offset 060:  03 04 04 00  00 00 08 08  00 00 00 00  00 00 00 00 
      Offset 070:  00 00 00 00  00 00 00 00  00 00 00 00  00 00 00 00 
      Offset 080:  04 00 00 00  00 00 00 00  00 00 00 00  00 00 00 00 
      Offset 090:  00 00 00 00  00 00 00 00  00 00 00 00  00 00 00 00 
      Offset 0A0:  00 00 00 00  00 00 00 00  00 00 00 00  00 00 00 00 
      Offset 0B0:  00 00 00 00  00 00 00 00  00 00 00 00  00 00 00 00 
      Offset 0C0:  00 00 00 00  00 00 00 00  00 00 00 00  00 00 00 00 
      Offset 0D0:  00 00 00 00  00 00 00 00  00 00 00 00  00 00 00 00 
      Offset 0E0:  00 00 00 00  00 00 00 00  00 00 00 00  00 00 00 00 
      Offset 0F0:  00 00 00 00  00 00 00 00  87 0F 06 08  00 00 00 00 

    B00 D1F F06:  Intel Cougar Point PCH - Thermal Management Controller [B-2]
                  
      Offset 000:  86 80 24 1C  00 00 10 00  04 00 80 11  00 00 00 00 
      Offset 010:  04 00 00 00  00 00 00 00  00 00 00 00  00 00 00 00 
      Offset 020:  00 00 00 00  00 00 00 00  00 00 00 00  AA 17 E2 21 
      Offset 030:  00 00 00 00  50 00 00 00  00 00 00 00  FF 03 00 00 
      Offset 040:  05 00 20 7F  00 00 00 00  00 00 00 00  00 00 00 00 
      Offset 050:  01 00 23 00  08 00 00 00  00 00 00 00  00 00 00 00 
      Offset 060:  00 00 00 00  00 00 00 00  00 00 00 00  00 00 00 00 
      Offset 070:  00 00 00 00  00 00 00 00  00 00 00 00  00 00 00 00 
      Offset 080:  05 00 00 00  00 00 00 00  00 00 00 00  00 00 00 00 
      Offset 090:  00 00 00 00  00 00 00 00  00 00 00 00  00 00 00 00 
      Offset 0A0:  00 00 00 00  00 00 00 00  00 00 00 00  00 00 00 00 
      Offset 0B0:  00 00 00 00  00 00 00 00  00 00 00 00  00 00 00 00 
      Offset 0C0:  00 00 00 00  00 00 00 00  00 00 00 00  00 00 00 00 
      Offset 0D0:  00 00 00 00  00 00 00 00  00 00 00 00  00 00 00 00 
      Offset 0E0:  00 00 00 00  00 00 00 00  00 00 00 00  00 00 00 00 
      Offset 0F0:  00 00 00 00  00 00 00 00  87 0F 06 08  00 00 00 00 

    B01 D00 F00:  AMD Radeon HD 6630M (Lenovo) Video Adapter
                  
      Offset 000:  02 10 41 67  06 04 10 00  00 00 00 03  10 00 00 00 
      Offset 010:  0C 00 00 80  00 00 00 00  04 00 60 A2  00 00 00 00 
      Offset 020:  01 6F 00 00  00 00 00 00  00 00 00 00  AA 17 E3 21 
      Offset 030:  00 00 00 00  50 00 00 00  00 00 00 00  00 01 00 00 
      Offset 040:  00 00 00 00  00 00 00 00  00 00 00 00  AA 17 E3 21 
      Offset 050:  01 58 03 06  00 00 00 00  10 A0 12 00  A1 8F 2C 01 
      Offset 060:  10 29 00 00  02 0D 00 00  43 00 11 10  00 00 00 00 
      Offset 070:  00 00 00 00  00 00 00 00  00 00 00 00  00 00 00 00 
      Offset 080:  00 00 00 00  00 00 00 00  02 00 01 00  00 00 00 00 
      Offset 090:  00 00 00 00  00 00 00 00  00 00 00 00  00 00 00 00 
      Offset 0A0:  05 00 81 00  0C F0 E0 FE  00 00 00 00  A0 49 00 00 
      Offset 0B0:  00 00 00 00  00 00 00 00  00 00 00 00  00 00 00 00 
      Offset 0C0:  00 00 00 00  00 00 00 00  00 00 00 00  00 00 00 00 
      Offset 0D0:  00 00 00 00  00 00 00 00  00 00 00 00  00 00 00 00 
      Offset 0E0:  00 00 00 00  00 00 00 00  00 00 00 00  00 00 00 00 
      Offset 0F0:  00 00 00 00  00 00 00 00  00 00 00 00  00 00 00 00 

    B03 D00 F00:  Realtek RTL8168/8111 PCI-E Gigabit Ethernet Adapter
                  
      Offset 000:  EC 10 68 81  07 04 10 00  06 00 00 02  10 00 00 00 
      Offset 010:  01 50 00 00  00 00 00 00  0C 40 40 A0  00 00 00 00 
      Offset 020:  0C 00 40 A0  00 00 00 00  00 00 00 00  AA 17 E2 21 
      Offset 030:  00 00 00 00  40 00 00 00  00 00 00 00  00 01 00 00 
      Offset 040:  01 50 C3 FF  08 00 00 00  00 00 00 00  00 00 00 00 
      Offset 050:  05 70 80 00  00 00 00 00  00 00 00 00  00 00 00 00 
      Offset 060:  00 00 00 00  00 00 00 00  00 00 00 00  00 00 00 00 
      Offset 070:  10 B0 02 02  C1 8C 90 05  10 50 19 00  11 3C 07 00 
      Offset 080:  43 01 11 10  00 00 00 00  00 00 00 00  00 00 00 00 
      Offset 090:  00 00 00 00  10 00 00 00  10 00 00 00  00 00 00 00 
      Offset 0A0:  00 00 00 00  00 00 00 00  00 00 00 00  00 00 00 00 
      Offset 0B0:  11 D0 03 80  04 00 00 00  04 08 00 00  00 00 00 00 
      Offset 0C0:  00 00 00 00  00 00 00 00  00 00 00 00  00 00 00 00 
      Offset 0D0:  03 00 00 00  00 00 00 00  00 00 00 00  00 00 00 00 
      Offset 0E0:  00 00 00 00  00 00 00 00  00 00 00 00  00 00 00 00 
      Offset 0F0:  00 00 00 00  00 00 00 00  00 00 00 00  00 00 00 00 

    B09 D00 F00:  Realtek RTL8188CE Wireless LAN 802.11n PCI-E Network Adapter
                  
      Offset 000:  EC 10 76 81  07 00 10 00  01 00 80 02  10 00 00 00 
      Offset 010:  01 30 00 00  00 00 00 00  04 00 D0 A1  00 00 00 00 
      Offset 020:  00 00 00 00  00 00 00 00  00 00 00 00  EC 10 95 81 
      Offset 030:  00 00 00 00  40 00 00 00  00 00 00 00  13 01 00 00 
      Offset 040:  01 50 C3 FF  08 00 00 00  00 00 00 00  00 00 00 00 
      Offset 050:  05 70 80 00  00 00 00 00  00 00 00 00  00 00 00 00 
      Offset 060:  00 00 00 00  00 00 00 00  00 00 00 00  00 00 00 00 
      Offset 070:  10 00 02 00  C0 8C 90 05  10 20 11 00  11 3C 07 00 
      Offset 080:  43 01 11 10  00 00 00 00  00 00 00 00  00 00 00 00 
      Offset 090:  00 00 00 00  10 00 00 00  10 00 00 00  00 00 00 00 
      Offset 0A0:  00 00 00 00  00 00 00 00  00 00 00 00  00 00 00 00 
      Offset 0B0:  00 00 00 00  00 00 00 00  00 00 00 00  00 00 00 00 
      Offset 0C0:  00 00 00 00  00 00 00 00  00 00 00 00  00 00 00 00 
      Offset 0D0:  00 00 00 00  00 00 00 00  00 00 00 00  00 00 00 00 
      Offset 0E0:  00 00 00 00  00 00 00 00  00 00 00 00  00 00 00 00 
      Offset 0F0:  00 00 00 00  00 00 00 00  00 00 00 00  00 00 00 00 

    PCI-8086-0104:  Intel SNB/IVB/HSW/CRW MCHBAR
                  
      Offset 4000:  66 66 14 00  44 43 10 86  00 00 00 00  6A 59 00 00 
      Offset 4010:  00 00 00 00  00 00 00 00  00 00 00 00  00 00 00 00 
      Offset 4020:  05 00 10 00  20 20 20 20  00 00 0E 00  00 00 00 00 

    PCI-8086-0104:  Intel SNB/IVB/HSW/CRW MCHBAR
                  
      Offset 4280:  00 00 00 00  00 00 00 00  00 00 00 00  44 00 00 00 
      Offset 4290:  80 40 00 00  0F 98 00 00  04 10 B4 46  00 00 00 00 
      Offset 42A0:  00 00 00 00  00 B2 00 01  00 00 00 00  00 00 00 00 

    PCI-8086-0104:  Intel SNB/IVB/HSW/CRW MCHBAR
                  
      Offset 4400:  99 79 18 00  54 54 14 0A  20 32 02 0A  90 56 00 00 
      Offset 4410:  00 00 00 00  00 00 00 00  00 00 00 00  00 00 00 00 
      Offset 4420:  05 00 10 00  21 20 20 20  01 00 0E 00  00 00 00 00 

    PCI-8086-0104:  Intel SNB/IVB/HSW/CRW MCHBAR
                  
      Offset 4680:  00 00 00 00  00 00 0C 00  00 00 00 00  44 00 00 00 
      Offset 4690:  80 40 00 00  0F 98 00 00  4F 14 6B 5A  50 02 00 00 
      Offset 46A0:  01 10 00 00  00 72 90 41  00 00 00 00  01 00 00 00 

    PCI-8086-0104:  Intel SNB/IVB/HSW/CRW MCHBAR
                  
      Offset 4800:  00 00 00 00  00 00 00 00  00 00 00 00  00 00 00 00 
      Offset 4810:  00 00 00 00  00 00 00 00  00 00 00 00  00 00 00 00 

    PCI-8086-0104:  Intel SNB/IVB/HSW/CRW MCHBAR
                  
      Offset 4A80:  00 00 00 00  00 00 00 00  00 00 00 00  00 00 00 00 
      Offset 4A90:  00 00 00 00  00 00 00 00  00 00 00 00  00 00 00 00 

    PCI-8086-0104:  Intel SNB/IVB/HSW/CRW MCHBAR
                  
      Offset 5000:  21 00 00 00  00 00 60 00  08 00 60 00  00 00 60 00 
      Offset 5010:  00 00 00 00  00 00 00 00  00 00 00 00  00 00 00 00 

    PCI-8086-0104:  Intel SNB/IVB/HSW/CRW MCHBAR
                  
      Offset 5880:  E6 71 91 CA  00 00 00 00  B7 BA E4 00  00 00 00 00 
      Offset 5890:  00 00 00 00  5B 59 9D 00  00 00 00 00  00 00 00 00 
      Offset 58A0:  00 00 00 00  21 21 00 00  00 00 00 00  00 00 00 00 
      Offset 58B0:  00 00 00 00  00 00 00 00  00 00 00 00  00 00 00 00 
      Offset 58C0:  00 00 00 00  00 00 00 00  00 00 00 00  00 00 00 00 
      Offset 58D0:  00 00 00 00  00 00 00 00  00 00 00 00  00 00 00 00 
      Offset 58E0:  00 00 00 00  00 00 00 00  00 00 00 00  00 00 00 00 
      Offset 58F0:  00 00 00 00  00 00 00 00  00 00 00 00  00 00 00 00 
      Offset 5900:  00 00 00 00  00 00 00 00  00 00 00 00  00 00 00 00 
      Offset 5910:  00 00 00 00  00 00 00 00  00 00 00 00  00 00 00 00 
      Offset 5920:  00 00 00 00  18 00 00 00  52 79 42 05  B6 5A 46 00 
      Offset 5930:  18 01 E0 00  60 01 0F 00  03 10 0A 00  3C 86 E2 0C 
      Offset 5940:  C2 16 9F 02  80 65 0E 00  0B 0D 00 00  00 00 00 00 
      Offset 5950:  00 00 00 00  00 00 10 00  00 16 01 60  00 08 00 00 
      Offset 5960:  42 CB 2B 09  AD A3 87 F5  38 1E 62 D8  1C B3 09 6C 
      Offset 5970:  DE D5 31 2C  DC D5 31 2C  31 00 00 00  31 00 00 00 
      Offset 5980:  31 00 00 00  DA 2D 91 A5  00 00 00 00  00 00 00 00 
      Offset 5990:  FF 00 00 00  FF 00 00 00  16 0D 0D 00  00 05 55 00 
      Offset 59A0:  00 00 00 00  00 00 00 00  00 00 00 00  00 00 00 00 
      Offset 59B0:  0C 03 00 80  94 14 14 18  04 01 00 80  94 14 14 18 
      Offset 59C0:  00 00 24 88  00 00 00 00  00 00 00 00  00 00 00 00 

    PCI-8086-0104:  Intel SNB/IVB/HSW/CRW MCHBAR
                  
      Offset 5E00:  05 00 00 00  05 00 00 00  00 00 00 00  00 00 00 00 
      Offset 5E10:  00 00 00 00  00 00 00 00  00 00 00 00  00 00 00 00 

    PCI-8086-1C24:  Intel 5/6/7/8-series PCH TBARB
                  
      Offset 00:  00 BA 00 FF  2B 3A 00 00  08 04 7F 00  00 00 40 00 
      Offset 10:  00 00 40 15  87 DE 8C 80  00 00 00 00  00 00 00 00 
      Offset 20:  00 00 00 00  00 00 00 00  00 00 00 00  00 00 00 00 
      Offset 30:  00 00 00 00  00 00 00 00  00 00 00 00  00 00 00 00 
      Offset 40:  00 02 00 FF  00 00 00 00  00 00 00 00  00 00 00 00 
      Offset 50:  00 00 00 00  00 00 00 00  00 00 00 00  00 00 00 00 
      Offset 60:  00 00 00 00  00 00 00 00  00 00 00 00  16 1B 20 05 
      Offset 70:  00 00 00 00  00 00 00 00  00 00 00 00  00 00 00 00 
      Offset 80:  00 00 00 00  00 00 00 FF  00 00 00 00  00 00 00 00 
      Offset 90:  B3 CB 45 0A  00 00 00 00  00 00 00 00  00 00 00 00 
      Offset A0:  00 00 00 00  00 00 00 00  00 00 00 00  00 00 00 00 
      Offset B0:  00 00 00 00  00 00 00 00  00 00 00 00  00 00 00 00 
      Offset C0:  00 00 00 00  00 00 00 FF  00 00 00 00  00 00 00 00 
      Offset D0:  00 00 00 00  00 00 00 00  00 00 00 00  00 00 00 00 
      Offset E0:  00 00 00 00  00 00 00 00  00 00 00 00  00 00 00 00 
      Offset F0:  00 00 00 00  00 00 00 00  00 00 00 00  00 00 00 00 


--------[ Debug - Video BIOS ]------------------------------------------------------------------------------------------

    C000:0000  U.....000000000000."..!.@...00IBM VGA Compatible BIOS. .f.v.....
    C000:0040  PCIR............................&...f...........................
    C000:0080  ../............................................DH.....DH.....DH.
    C000:00C0  ...0DH.....DI.....DI.....DJ.....DJ....0DJ.....DI....0DI.....DJ..
    C000:0100  ...DK.....DK.....DK....0.L......L......L....0.L......M......M...
    C000:0140  ..0.<..2.`..4....8....:....<....A.<..C.`..E....I....K....M....P 
    C000:0180  <..R `..T ...X ...Z ...\ ...`....a....b ...c....d....e ...f....g
    C000:01C0  ....h ...i....j....k ...l.-..m.-..n -..o.G..p.G..q G..}....~....
    C000:0200   ........ .-..`............ .1..l...........rQ.. n(U...!.......
    C000:0240   ....`"........... ....@.......... .1X. (.........V. .1X. .P....
    C000:0280  ....d..@A.&0..6.......... A. 0.`........0*..Q.*@0p.........4..Q.
    C000:02C0  *@..........H?@0b.2@@.........h[..r.<P....................E.....
    C000:0300  .......................................E........................
    C000:0340  ...........For Evaluation Use Only....(........c-'(.+...........
    C000:0380  ......................................(........c-'(.+...........
    C000:03C0  ......................................P........c_OP.U...........


------------------------------------------------------------------------------------------------------------------------

The names of actual companies and products mentioned herein may be the trademarks of their respective owners.
