proyecto de investigacion
marcia rojas
365
--------[ AIDA64 Extreme Edition ]--------------------------------------------------------------------------------------

    Versión                                           AIDA64 v3.00.2529 Beta/es
    Módulo de rendimiento                             4.0.568-x32
    Página principal                                  http://www.aida64.com/
    Tipo de informe                                   Asistente de informes
    Equipo                                            ECOLMICRO4
    Generador                                         Administrador
    Sistema operativo                                 Microsoft Windows XP Professional 5.1.2600 (WinXP RTM)
    Fecha                                             2015-06-30
    Hora                                              10:17


--------[ Resumen ]-----------------------------------------------------------------------------------------------------

    Equipo:
      Tipo de equipo                                    Monoprocesador ACPI de PC
      Sistema operativo                                 Microsoft Windows XP Professional
      Service Pack del SO                               Service Pack 3
      Internet Explorer                                 7.0.5730.13 (IE 7.0)
      DirectX                                           4.09.00.0904 (DirectX 9.0c)
      Nombre del equipo                                 ECOLMICRO4
      Nombre de usuario                                 Administrador
      Dominio de inicio de sesión                       ECOLMICRO4
      Fecha / Hora                                      2015-06-30 / 10:17

    Placa base:
      Tipo de CPU                                       Intel Pentium 4, 2666 MHz (20 x 133)
      Nombre de la placa base                           Dell OptiPlex GX270
      Chipset de la placa base                          Intel Springdale-G i865G
      Memoria del sistema                               253 MB  (DDR SDRAM)
      Tipo de BIOS                                      Phoenix (10/20/03)
      Puerto de comunicación                            Puerto de comunicaciones (COM1)
      Puerto de comunicación                            Puerto de impresora ECP (LPT1)

    Pantalla:
      Adaptador de video                                Intel(R) 82865G Graphics Controller  (64 MB)
      Aceleradora 3D                                    Intel Extreme Graphics 2
      Monitor                                           Dell E772p  [17" CRT]  (3X7293B8L4DD)

    Multimedia:
      Adaptador de audio                                Analog Devices 1981B(L) @ Intel 82801EB ICH5 - AC'97 Audio Controller [A-2/A-3]

    Almacenamiento:
      Controlador IDE                                   Intel(R) 82801EB Ultra ATA Storage Controllers
      Controlador IDE                                   Intel(R) 82801EB Ultra ATA Storage Controllers
      Unidad de disquetes                               Unidad de disquete
      Unidad de disco                                   IC35L060AVV207-0  (60 GB, 7200 RPM, Ultra-ATA/100)
      Unidad de disco                                   Kingston DataTraveler 102 USB Device  (3 GB, USB)
      Unidad óptica                                     HL-DT-ST RW/DVD GCC-4480B  (DVD:16x, CD:48x/24x/48x DVD-ROM/CD-RW)
      Estado SMART de los discos duros                  Aceptar

    Particiones:
      C: (NTFS)                                         11028 MB (4841 MB libre)
      D: (NTFS)                                         27117 MB (5170 MB libre)
      Tamaño total                                      38146 MB (10011 MB libre)

    Entrada:
      Teclado                                           Dispositivo de teclado HID
      Mouse                                             Mouse compatible con HID

    Red:
      Dirección IP primaria                             127.0.0.1
      Dirección MAC primaria                            00-0D-56-C9-54-39
      Adaptador de red                                  Intel(R) PRO/1000 MT Network Connection

    Periféricos:
      Impresora                                         Adobe PDF
      Impresora                                         HP DeskJet 1220C
      Impresora                                         HP LaserJet 4200 PCL 6
      Impresora                                         HP LaserJet Professional P1102w
      Impresora                                         PDFCreator
      Controlador USB1                                  Intel 82801EB ICH5 - USB Controller [A-2/A-3]
      Controlador USB1                                  Intel 82801EB ICH5 - USB Controller [A-2/A-3]
      Controlador USB1                                  Intel 82801EB ICH5 - USB Controller [A-2/A-3]
      Controlador USB1                                  Intel 82801EB ICH5 - USB Controller [A-2/A-3]
      Controlador USB2                                  Intel 82801EB ICH5 - Enhanced USB2 Controller [A-2/A-3]
      Dispositivo USB                                   Dispositivo compuesto USB
      Dispositivo USB                                   Dispositivo de almacenamiento masivo USB
      Dispositivo USB                                   Dispositivo de interfaz humana USB
      Dispositivo USB                                   Dispositivo de interfaz humana USB
      Dispositivo USB                                   Dispositivo de interfaz humana USB

    DMI:
      Vendedor del BIOS DMI                             Dell Computer Corporation
      Versión del BIOS DMI                              A03
      Fabricante del sistema DMI                        Dell Computer Corporation
      Producto del sistema DMI                          OptiPlex GX270
      Versión del sistema DMI                           
      Número de serie del sistema DMI                   HDHQ01J
      UUID del sistema DMI                              44454C4C-44001048-8051C8C0-4F30314A
      Fabricante de la placa base DMI                   Dell Computer Corp.
      Producto de la placa base DMI                     0U1324
      Versión de la placa base DMI                      
      Número de serie de la placa base DMI              ..CN137403CC049U.
      Fabricante del chasis DMI                         Dell Computer Corporation
      Versión del chasis DMI                            
      Número de serie del chasis DMI                    HDHQ01J
      Identificador del chasis DMI                      
      Tipo de chasis DMI                                Desktop Case


--------[ Debug - PCI ]-------------------------------------------------------------------------------------------------

    B00 D00 F00:  Intel 82865G Memory Controller Hub [A-2]
                  
      Offset 000:  86 80 70 25  06 01 90 20  02 00 00 06  00 00 00 00 
      Offset 010:  08 00 00 F0  00 00 00 00  00 00 00 00  00 00 00 00 
      Offset 020:  00 00 00 00  00 00 00 00  00 00 00 00  28 10 51 01 
      Offset 030:  00 00 00 00  E4 00 00 00  00 00 00 00  00 00 00 00 
      Offset 040:  00 00 00 00  00 00 00 00  00 00 00 00  00 00 00 00 
      Offset 050:  00 00 10 00  40 80 1C 00  00 00 00 00  00 00 00 00 
      Offset 060:  08 05 00 00  00 00 00 00  00 00 00 00  00 00 00 00 
      Offset 070:  00 00 00 00  00 00 00 00  00 00 00 00  00 00 00 00 
      Offset 080:  00 00 00 00  00 00 00 00  00 00 00 00  00 00 00 00 
      Offset 090:  10 11 11 11  11 11 11 00  00 00 00 00  00 0A 38 00 
      Offset 0A0:  02 00 30 00  17 42 00 1F  00 00 00 00  00 00 00 00 
      Offset 0B0:  00 00 00 00  20 00 00 00  00 00 00 00  20 10 00 00 
      Offset 0C0:  00 00 00 00  F0 0F 0D 04  00 00 00 00  00 00 00 00 
      Offset 0D0:  02 28 04 0E  0B 0D 00 00  00 00 00 00  00 00 20 01 
      Offset 0E0:  00 00 00 00  09 00 06 01  00 02 00 00  00 00 00 00 
      Offset 0F0:  00 00 00 00  02 00 00 00  68 0F 03 00  00 00 00 00 

    B00 D02 F00:  Intel 82865G Graphics Controller [A-2]
                  
      Offset 000:  86 80 72 25  07 00 90 00  02 00 00 03  00 00 00 00 
      Offset 010:  08 00 00 E8  00 00 B8 FE  99 ED 00 00  00 00 00 00 
      Offset 020:  00 00 00 00  00 00 00 00  00 00 00 00  28 10 51 01 
      Offset 030:  00 00 00 00  D0 00 00 00  00 00 00 00  10 01 00 00 
      Offset 040:  00 00 00 00  E0 23 E0 11  00 00 00 00  00 00 00 00 
      Offset 050:  00 00 10 00  00 00 00 00  00 00 00 00  00 00 00 00 
      Offset 060:  08 00 00 00  00 00 00 00  00 00 00 00  00 00 00 00 
      Offset 070:  00 00 00 00  00 00 01 02  FF 00 00 00  71 62 10 20 
      Offset 080:  00 00 00 00  00 00 00 00  00 00 00 00  00 00 00 00 
      Offset 090:  00 00 00 00  00 00 00 00  00 00 00 00  00 00 00 00 
      Offset 0A0:  00 00 00 00  00 00 00 00  00 00 00 00  00 00 00 00 
      Offset 0B0:  30 08 04 00  08 04 41 00  00 00 00 00  00 00 00 00 
      Offset 0C0:  00 00 00 00  F0 0F 0D 04  00 00 00 00  00 00 00 00 
      Offset 0D0:  01 00 21 00  00 00 00 00  00 00 00 00  00 00 00 00 
      Offset 0E0:  08 05 00 00  09 00 06 01  00 00 00 00  00 00 00 00 
      Offset 0F0:  00 00 00 00  00 00 00 00  68 0F 03 00  00 00 00 00 

    B00 D06 F00:  Intel 82865G I/O Memory Interface [A-2]
                  
      Offset 000:  86 80 76 25  02 00 80 00  02 00 80 08  00 00 00 00 
      Offset 010:  00 00 CF FE  00 00 00 00  00 00 00 00  00 00 00 00 
      Offset 020:  00 00 00 00  00 00 00 00  00 00 00 00  00 00 00 00 
      Offset 030:  00 00 00 00  00 00 00 00  00 00 00 00  00 00 00 00 
      Offset 040:  40 65 00 04  00 00 00 00  04 00 00 00  00 00 00 00 
      Offset 050:  01 00 80 00  00 00 00 00  00 00 00 00  00 00 00 00 
      Offset 060:  00 00 00 00  00 00 00 00  00 00 00 00  00 00 00 00 
      Offset 070:  04 00 00 00  00 00 00 00  00 00 00 00  00 00 00 00 
      Offset 080:  00 00 00 00  00 00 00 00  00 00 00 00  00 00 00 00 
      Offset 090:  00 00 55 05  00 00 00 00  00 00 00 00  00 00 00 00 
      Offset 0A0:  00 00 00 00  00 00 00 00  00 00 00 00  00 20 08 00 
      Offset 0B0:  00 00 00 00  F0 43 FC 7D  01 00 00 00  09 00 00 00 
      Offset 0C0:  00 08 00 00  20 00 00 00  00 00 00 00  00 00 00 00 
      Offset 0D0:  00 00 00 00  00 00 00 00  FF FF FF FF  FF FF FF 3F 
      Offset 0E0:  01 00 00 00  00 00 01 02  FF 0E 00 00  00 00 04 00 
      Offset 0F0:  00 0C 02 00  00 00 00 00  68 0F 03 00  74 F8 00 00 

    B00 D1D F00:  Intel 82801EB ICH5 - USB Controller [A-2/A-3]
                  
      Offset 000:  86 80 D2 24  05 00 80 02  02 00 03 0C  00 00 80 00 
      Offset 010:  00 00 00 00  00 00 00 00  00 00 00 00  00 00 00 00 
      Offset 020:  81 FF 00 00  00 00 00 00  00 00 00 00  28 10 51 01 
      Offset 030:  00 00 00 00  00 00 00 00  00 00 00 00  10 01 00 00 
      Offset 040:  00 00 00 00  00 00 00 00  00 00 00 00  00 00 00 00 
      Offset 050:  00 00 00 00  00 00 00 00  00 00 00 00  00 00 00 00 
      Offset 060:  10 00 00 00  00 00 00 00  00 00 00 00  00 00 00 00 
      Offset 070:  00 00 00 00  00 00 00 00  00 00 00 00  00 00 00 00 
      Offset 080:  00 00 00 00  00 00 00 00  00 00 00 00  00 00 00 00 
      Offset 090:  00 00 00 00  00 00 00 00  00 00 00 00  00 00 00 00 
      Offset 0A0:  00 00 00 00  00 00 00 00  00 00 00 00  00 00 00 00 
      Offset 0B0:  00 00 00 00  00 00 00 00  00 00 00 00  00 00 00 00 
      Offset 0C0:  00 20 00 00  03 00 00 00  00 00 00 00  00 00 00 00 
      Offset 0D0:  00 00 00 00  00 00 00 00  00 00 00 00  00 00 00 00 
      Offset 0E0:  00 00 00 00  00 00 00 00  00 00 00 00  00 00 00 00 
      Offset 0F0:  00 00 00 00  00 00 00 00  66 0F 04 00  00 00 00 00 

    B00 D1D F01:  Intel 82801EB ICH5 - USB Controller [A-2/A-3]
                  
      Offset 000:  86 80 D4 24  05 00 80 02  02 00 03 0C  00 00 00 00 
      Offset 010:  00 00 00 00  00 00 00 00  00 00 00 00  00 00 00 00 
      Offset 020:  61 FF 00 00  00 00 00 00  00 00 00 00  28 10 51 01 
      Offset 030:  00 00 00 00  00 00 00 00  00 00 00 00  13 02 00 00 
      Offset 040:  00 00 00 00  00 00 00 00  00 00 00 00  00 00 00 00 
      Offset 050:  00 00 00 00  00 00 00 00  00 00 00 00  00 00 00 00 
      Offset 060:  10 00 00 00  00 00 00 00  00 00 00 00  00 00 00 00 
      Offset 070:  00 00 00 00  00 00 00 00  00 00 00 00  00 00 00 00 
      Offset 080:  00 00 00 00  00 00 00 00  00 00 00 00  00 00 00 00 
      Offset 090:  00 00 00 00  00 00 00 00  00 00 00 00  00 00 00 00 
      Offset 0A0:  00 00 00 00  00 00 00 00  00 00 00 00  00 00 00 00 
      Offset 0B0:  00 00 00 00  00 00 00 00  00 00 00 00  00 00 00 00 
      Offset 0C0:  00 20 00 00  03 00 00 00  00 00 00 00  00 00 00 00 
      Offset 0D0:  00 00 00 00  00 00 00 00  00 00 00 00  00 00 00 00 
      Offset 0E0:  00 00 00 00  00 00 00 00  00 00 00 00  00 00 00 00 
      Offset 0F0:  00 00 00 00  00 00 00 00  66 0F 04 00  00 00 00 00 

    B00 D1D F02:  Intel 82801EB ICH5 - USB Controller [A-2/A-3]
                  
      Offset 000:  86 80 D7 24  05 00 80 02  02 00 03 0C  00 00 00 00 
      Offset 010:  00 00 00 00  00 00 00 00  00 00 00 00  00 00 00 00 
      Offset 020:  41 FF 00 00  00 00 00 00  00 00 00 00  28 10 51 01 
      Offset 030:  00 00 00 00  00 00 00 00  00 00 00 00  12 03 00 00 
      Offset 040:  00 00 00 00  00 00 00 00  00 00 00 00  00 00 00 00 
      Offset 050:  00 00 00 00  00 00 00 00  00 00 00 00  00 00 00 00 
      Offset 060:  10 00 00 00  00 00 00 00  00 00 00 00  00 00 00 00 
      Offset 070:  00 00 00 00  00 00 00 00  00 00 00 00  00 00 00 00 
      Offset 080:  00 00 00 00  00 00 00 00  00 00 00 00  00 00 00 00 
      Offset 090:  00 00 00 00  00 00 00 00  00 00 00 00  00 00 00 00 
      Offset 0A0:  00 00 00 00  00 00 00 00  00 00 00 00  00 00 00 00 
      Offset 0B0:  00 00 00 00  00 00 00 00  00 00 00 00  00 00 00 00 
      Offset 0C0:  00 20 00 00  03 00 00 00  00 00 00 00  00 00 00 00 
      Offset 0D0:  00 00 00 00  00 00 00 00  00 00 00 00  00 00 00 00 
      Offset 0E0:  00 00 00 00  00 00 00 00  00 00 00 00  00 00 00 00 
      Offset 0F0:  00 00 00 00  00 00 00 00  66 0F 04 00  00 00 00 00 

    B00 D1D F03:  Intel 82801EB ICH5 - USB Controller [A-2/A-3]
                  
      Offset 000:  86 80 DE 24  05 00 80 02  02 00 03 0C  00 00 00 00 
      Offset 010:  00 00 00 00  00 00 00 00  00 00 00 00  00 00 00 00 
      Offset 020:  21 FF 00 00  00 00 00 00  00 00 00 00  28 10 51 01 
      Offset 030:  00 00 00 00  00 00 00 00  00 00 00 00  10 01 00 00 
      Offset 040:  00 00 00 00  00 00 00 00  00 00 00 00  00 00 00 00 
      Offset 050:  00 00 00 00  00 00 00 00  00 00 00 00  00 00 00 00 
      Offset 060:  10 00 00 00  00 00 00 00  00 00 00 00  00 00 00 00 
      Offset 070:  00 00 00 00  00 00 00 00  00 00 00 00  00 00 00 00 
      Offset 080:  00 00 00 00  00 00 00 00  00 00 00 00  00 00 00 00 
      Offset 090:  00 00 00 00  00 00 00 00  00 00 00 00  00 00 00 00 
      Offset 0A0:  00 00 00 00  00 00 00 00  00 00 00 00  00 00 00 00 
      Offset 0B0:  00 00 00 00  00 00 00 00  00 00 00 00  00 00 00 00 
      Offset 0C0:  00 20 00 00  03 00 00 00  00 00 00 00  00 00 00 00 
      Offset 0D0:  00 00 00 00  00 00 00 00  00 00 00 00  00 00 00 00 
      Offset 0E0:  00 00 00 00  00 00 00 00  00 00 00 00  00 00 00 00 
      Offset 0F0:  00 00 00 00  00 00 00 00  66 0F 04 00  00 00 00 00 

    B00 D1D F07:  Intel 82801EB ICH5 - Enhanced USB2 Controller [A-2/A-3]
                  
      Offset 000:  86 80 DD 24  06 01 90 02  02 20 03 0C  00 00 00 00 
      Offset 010:  00 F4 B7 FE  00 00 00 00  00 00 00 00  00 00 00 00 
      Offset 020:  00 00 00 00  00 00 00 00  00 00 00 00  28 10 51 01 
      Offset 030:  00 00 00 00  50 00 00 00  00 00 00 00  17 04 00 00 
      Offset 040:  00 00 00 00  00 00 00 00  00 00 00 00  00 00 00 00 
      Offset 050:  01 58 C2 C9  00 00 00 00  0A 00 A0 20  00 00 00 00 
      Offset 060:  20 20 FF 01  00 00 00 00  01 00 00 00  00 00 00 C0 
      Offset 070:  00 00 D7 3F  00 00 00 00  00 00 00 00  00 00 00 00 
      Offset 080:  00 00 00 00  01 00 00 00  00 00 00 00  00 00 00 00 
      Offset 090:  00 00 00 00  00 00 00 00  00 00 00 00  00 00 00 00 
      Offset 0A0:  00 00 00 00  00 00 00 00  00 00 00 00  00 00 00 00 
      Offset 0B0:  00 00 00 00  00 00 00 00  00 00 00 00  00 00 00 00 
      Offset 0C0:  00 00 00 00  00 00 00 00  00 00 00 00  00 00 00 00 
      Offset 0D0:  00 00 00 00  00 00 00 00  55 55 00 00  10 00 2A 00 
      Offset 0E0:  00 00 00 00  00 00 00 00  00 00 00 00  00 00 00 00 
      Offset 0F0:  00 80 00 00  88 83 40 00  66 0F 04 00  06 14 00 00 

    B00 D1E F00:  Intel 82801EB I/O Controller Hub 5 (ICH5) [A-2/A-3]
                  
      Offset 000:  86 80 4E 24  07 01 80 00  C2 00 04 06  00 00 01 00 
      Offset 010:  00 00 00 00  00 00 00 00  00 01 01 20  D0 D0 80 22 
      Offset 020:  A0 FE A0 FE  F0 FF 00 00  00 00 00 00  00 00 00 00 
      Offset 030:  00 00 00 00  00 00 00 00  00 00 00 00  00 00 02 00 
      Offset 040:  02 28 30 76  00 01 00 00  00 00 00 00  00 00 00 00 
      Offset 050:  02 64 73 00  00 00 00 00  50 01 34 00  00 00 00 00 
      Offset 060:  00 00 00 00  00 00 00 00  00 00 00 00  00 00 00 00 
      Offset 070:  40 00 00 00  00 00 00 00  00 00 00 00  00 00 00 00 
      Offset 080:  00 00 81 00  00 00 00 00  00 00 00 00  00 00 00 00 
      Offset 090:  00 00 00 00  00 00 00 00  00 00 00 00  00 00 00 00 
      Offset 0A0:  00 00 00 00  00 00 00 00  00 00 00 00  00 00 00 00 
      Offset 0B0:  01 00 02 00  00 00 C0 00  00 00 00 00  00 00 00 00 
      Offset 0C0:  00 00 00 00  00 00 00 00  00 00 00 00  00 00 00 00 
      Offset 0D0:  00 00 00 00  00 00 00 00  00 00 00 00  00 00 00 00 
      Offset 0E0:  00 00 00 00  00 00 00 00  00 00 00 00  00 00 00 00 
      Offset 0F0:  00 00 00 00  00 00 00 00  66 0F 04 00  00 00 4D 35 

    B00 D1F F00:  Intel 82801EB ICH5 - LPC Bridge [A-2/A-3]
                  
      Offset 000:  86 80 D0 24  0F 01 80 02  02 00 01 06  00 00 80 00 
      Offset 010:  00 00 00 00  00 00 00 00  00 00 00 00  00 00 00 00 
      Offset 020:  00 00 00 00  00 00 00 00  00 00 00 00  00 00 00 00 
      Offset 030:  00 00 00 00  00 00 00 00  00 00 00 00  00 00 00 00 
      Offset 040:  01 08 00 00  10 00 00 00  00 00 00 00  00 00 00 00 
      Offset 050:  00 00 00 00  00 00 00 00  81 08 00 00  10 00 00 00 
      Offset 060:  8B 83 89 8A  90 00 00 00  80 80 80 85  00 00 00 00 
      Offset 070:  00 00 00 00  00 00 00 00  00 00 00 00  00 00 00 00 
      Offset 080:  00 00 00 00  00 00 00 00  00 00 00 00  00 00 00 00 
      Offset 090:  FF FC 00 00  00 00 00 00  00 00 00 00  00 00 00 00 
      Offset 0A0:  10 02 00 00  38 00 00 00  0D 00 00 00  00 03 00 00 
      Offset 0B0:  00 00 00 00  00 00 00 00  00 00 00 00  00 00 00 00 
      Offset 0C0:  00 00 00 00  04 08 00 00  00 00 00 00  01 00 00 00 
      Offset 0D0:  86 21 02 00  02 0F 00 00  00 00 00 00  00 00 00 00 
      Offset 0E0:  00 00 00 C0  01 0C 0D 34  33 22 11 00  00 00 67 45 
      Offset 0F0:  00 00 40 00  04 00 00 00  66 0F 04 3E  00 00 00 00 

    B00 D1F F01:  Intel 82801EB ICH5 - ATA-100 IDE Controller [A-2/A-3]
                  
      Offset 000:  86 80 DB 24  07 00 80 02  02 8A 01 01  00 00 00 00 
      Offset 010:  F1 01 00 00  F5 03 00 00  71 01 00 00  75 03 00 00 
      Offset 020:  A1 FF 00 00  00 FC B7 FE  00 00 00 00  28 10 51 01 
      Offset 030:  00 00 00 00  00 00 00 00  00 00 00 00  09 01 00 00 
      Offset 040:  07 E3 03 E3  00 00 00 00  05 00 01 02  00 00 00 00 
      Offset 050:  00 00 00 00  11 10 00 00  00 00 00 00  00 00 00 00 
      Offset 060:  08 00 00 00  00 00 00 00  08 00 00 00  00 00 00 00 
      Offset 070:  00 00 00 00  00 00 00 00  00 00 00 00  00 00 00 00 
      Offset 080:  00 00 00 00  00 00 00 00  00 00 00 00  00 00 00 00 
      Offset 090:  00 00 00 00  00 00 00 00  00 00 00 00  00 00 00 00 
      Offset 0A0:  00 00 00 00  00 00 00 00  00 00 00 00  00 00 00 00 
      Offset 0B0:  00 00 00 00  00 00 00 00  00 00 00 00  00 00 00 00 
      Offset 0C0:  00 00 00 00  00 00 00 00  00 00 00 00  00 00 00 00 
      Offset 0D0:  00 00 00 00  00 00 00 00  00 00 00 00  00 00 00 00 
      Offset 0E0:  00 00 00 00  00 00 00 00  00 00 00 00  00 00 00 00 
      Offset 0F0:  00 00 00 00  00 00 00 00  66 0F 04 00  00 00 00 00 

    B00 D1F F02:  Intel 82801EB ICH5 - Serial-ATA/150 IDE Controller [A-2/A-3]
                  
      Offset 000:  86 80 D1 24  05 00 A0 02  02 8F 01 01  00 00 00 00 
      Offset 010:  01 FE 00 00  11 FE 00 00  21 FE 00 00  31 FE 00 00 
      Offset 020:  A1 FE 00 00  00 00 00 00  00 00 00 00  28 10 51 01 
      Offset 030:  00 00 00 00  00 00 00 00  00 00 00 00  12 01 00 00 
      Offset 040:  00 00 00 00  00 00 00 00  00 00 00 00  00 00 00 00 
      Offset 050:  00 00 00 00  00 00 00 00  00 00 00 00  00 00 00 00 
      Offset 060:  00 00 00 00  00 00 00 00  00 00 00 00  00 00 00 00 
      Offset 070:  01 00 02 00  00 00 00 00  00 00 00 00  00 00 00 00 
      Offset 080:  05 70 00 00  00 00 00 00  00 00 00 00  00 00 00 00 
      Offset 090:  00 00 03 00  00 00 00 00  00 00 00 00  00 00 00 00 
      Offset 0A0:  68 00 00 00  00 03 00 00  00 00 00 00  00 00 00 00 
      Offset 0B0:  00 00 00 00  00 00 00 00  00 00 00 00  00 00 00 00 
      Offset 0C0:  00 00 00 00  00 00 00 00  00 00 00 00  00 00 00 00 
      Offset 0D0:  00 00 00 00  00 00 00 00  00 00 00 00  00 00 00 00 
      Offset 0E0:  00 00 00 00  00 00 00 00  00 00 00 00  00 00 00 00 
      Offset 0F0:  00 00 00 00  00 00 00 00  66 0F 04 00  00 00 00 00 

    B00 D1F F03:  Intel 82801EB ICH5 - SMBus Controller [A-2/A-3]
                  
      Offset 000:  86 80 D3 24  01 00 80 02  02 00 05 0C  00 00 00 00 
      Offset 010:  00 00 00 00  00 00 00 00  00 00 00 00  00 00 00 00 
      Offset 020:  A1 ED 00 00  00 00 00 00  00 00 00 00  28 10 51 01 
      Offset 030:  00 00 00 00  00 00 00 00  00 00 00 00  03 02 00 00 
      Offset 040:  01 00 00 00  00 00 00 00  00 00 00 00  00 00 00 00 
      Offset 050:  00 00 00 00  00 00 00 00  00 00 00 00  00 00 00 00 
      Offset 060:  00 00 00 00  00 00 00 00  00 00 00 00  00 00 00 00 
      Offset 070:  00 00 00 00  00 00 00 00  00 00 00 00  00 00 00 00 
      Offset 080:  00 00 00 00  00 00 00 00  00 00 00 00  00 00 00 00 
      Offset 090:  00 00 00 00  00 00 00 00  00 00 00 00  00 00 00 00 
      Offset 0A0:  00 00 00 00  00 00 00 00  00 00 00 00  00 00 00 00 
      Offset 0B0:  00 00 00 00  00 00 00 00  00 00 00 00  00 00 00 00 
      Offset 0C0:  00 00 00 00  00 00 00 00  00 00 00 00  00 00 00 00 
      Offset 0D0:  00 00 00 00  00 00 00 00  00 00 00 00  00 00 00 00 
      Offset 0E0:  00 00 00 00  00 00 00 00  00 00 00 00  00 00 00 00 
      Offset 0F0:  00 00 00 00  00 00 00 00  66 0F 04 00  00 00 00 00 

    B00 D1F F05:  Intel 82801EB ICH5 - AC'97 Audio Controller [A-2/A-3]
                  
      Offset 000:  86 80 D5 24  07 00 90 02  02 00 01 04  00 00 00 00 
      Offset 010:  01 EE 00 00  C1 ED 00 00  00 FA B7 FE  00 F9 B7 FE 
      Offset 020:  00 00 00 00  00 00 00 00  00 00 00 00  28 10 51 01 
      Offset 030:  00 00 00 00  50 00 00 00  00 00 00 00  03 02 00 00 
      Offset 040:  09 01 00 00  00 00 00 00  00 00 00 00  00 00 00 00 
      Offset 050:  01 00 C2 C9  00 00 00 00  00 00 00 00  00 00 00 00 
      Offset 060:  00 00 00 00  00 00 00 00  00 00 00 00  00 00 00 00 
      Offset 070:  00 00 00 00  00 00 00 00  00 00 00 00  00 00 00 00 
      Offset 080:  00 00 00 00  00 00 00 00  00 00 00 00  00 00 00 00 
      Offset 090:  00 00 00 00  00 00 00 00  00 00 00 00  00 00 00 00 
      Offset 0A0:  00 00 00 00  00 00 00 00  00 00 00 00  00 00 00 00 
      Offset 0B0:  00 00 00 00  00 00 00 00  00 00 00 00  00 00 00 00 
      Offset 0C0:  00 00 00 00  00 00 00 00  00 00 00 00  00 00 00 00 
      Offset 0D0:  00 00 00 00  00 00 00 00  00 00 00 00  00 00 00 00 
      Offset 0E0:  00 00 00 00  00 00 00 00  00 00 00 00  00 00 00 00 
      Offset 0F0:  00 00 00 00  00 00 00 00  66 0F 04 00  00 00 00 00 

    B01 D08 F00:  Conexant SmartHSFi V.9x 56k Speakerphone Modem
                  
      Offset 000:  F1 14 02 27  07 01 90 02  01 00 80 07  00 40 00 00 
      Offset 010:  00 00 AD FE  39 DF 00 00  00 00 00 00  00 00 00 00 
      Offset 020:  00 00 00 00  00 00 00 00  00 00 00 00  43 10 88 8D 
      Offset 030:  00 00 00 00  40 00 00 00  00 00 00 00  03 01 00 00 
      Offset 040:  01 00 22 C0  00 00 00 00  52 12 01 00  01 00 00 00 
      Offset 050:  00 00 00 00  00 00 00 00  00 00 00 00  00 00 00 00 
      Offset 060:  00 00 00 00  00 00 00 00  00 00 00 00  00 00 00 00 
      Offset 070:  00 00 00 00  00 00 00 00  00 00 00 00  00 00 00 00 
      Offset 080:  00 00 00 00  00 00 00 00  00 00 00 00  00 00 00 00 
      Offset 090:  00 00 00 00  00 00 00 00  00 00 00 00  00 00 00 00 
      Offset 0A0:  00 00 00 00  00 00 00 00  00 00 00 00  00 00 00 00 
      Offset 0B0:  00 00 00 00  00 00 00 00  00 00 00 00  00 00 00 00 
      Offset 0C0:  00 00 00 00  00 00 00 00  00 00 00 00  00 00 00 00 
      Offset 0D0:  00 00 00 00  00 00 00 00  00 00 00 00  00 00 00 00 
      Offset 0E0:  00 00 00 00  00 00 00 00  00 00 00 00  00 00 00 00 
      Offset 0F0:  00 00 00 00  00 00 00 00  00 00 00 00  00 00 00 00 

    B01 D0C F00:  Intel 82540EM Based Gigabit Network Adapter
                  
      Offset 000:  86 80 0E 10  17 01 30 02  02 00 00 02  10 40 00 00 
      Offset 010:  00 00 AE FE  00 00 00 00  41 DF 00 00  00 00 00 00 
      Offset 020:  00 00 00 00  00 00 00 00  00 00 00 00  28 10 51 01 
      Offset 030:  00 00 00 00  DC 00 00 00  00 00 00 00  12 01 FF 00 
      Offset 040:  00 00 00 00  00 00 00 00  00 00 00 00  00 00 00 00 
      Offset 050:  00 00 00 00  00 00 00 00  00 00 00 00  00 00 00 00 
      Offset 060:  00 00 00 00  00 00 00 00  00 00 00 00  00 00 00 00 
      Offset 070:  00 00 00 00  00 00 00 00  00 00 00 00  00 00 00 00 
      Offset 080:  00 00 00 00  00 00 00 00  00 00 00 00  00 00 00 00 
      Offset 090:  00 00 00 00  00 00 00 00  00 00 00 00  00 00 00 00 
      Offset 0A0:  00 00 00 00  00 00 00 00  00 00 00 00  00 00 00 00 
      Offset 0B0:  00 00 00 00  00 00 00 00  00 00 00 00  00 00 00 00 
      Offset 0C0:  00 00 00 00  00 00 00 00  00 00 00 00  00 00 00 00 
      Offset 0D0:  00 00 00 00  00 00 00 00  00 00 00 00  01 E4 22 C8 
      Offset 0E0:  00 20 00 1B  07 F0 02 00  00 00 40 04  00 00 00 00 
      Offset 0F0:  05 00 80 00  00 00 00 00  00 00 00 00  00 00 00 00 

    PCI-8086-2570:  Intel i848/865/875/E7210 MMR
                  
      Offset 00:  00 00 04 04  04 04 04 04  00 00 00 00  00 00 00 00 
      Offset 10:  00 01 00 00  00 00 00 00  00 00 00 00  00 00 00 00 
      Offset 20:  00 00 00 00  00 00 00 00  00 00 00 00  00 00 00 00 
      Offset 30:  00 00 00 00  00 00 00 00  00 00 00 00  00 00 00 00 
      Offset 40:  00 00 00 00  00 00 00 00  00 00 00 00  00 00 00 00 
      Offset 50:  00 00 00 00  00 00 00 00  00 00 00 00  00 00 00 00 
      Offset 60:  85 0D E4 56  C6 42 14 00  71 62 10 20  01 D0 00 00 


--------[ Debug - Video BIOS ]------------------------------------------------------------------------------------------

    C000:0000  U.T...000000000000[..A..@.p.00IBM VGA Compatible BIOS. .[.k.y...
    C000:0040  PCIR..r%........`........$...............u......................
    C000:0080  ....................................d......d......d.....0d......
    C000:00C0  d......d......d......d.....0d......d.....0d......d......d......d
    C000:0100  ......d.....0d......d......d.....0d......d......d...............
    C000:0140  ...................P.....Wb..........................{...G..G
    C000:0180  ......................?..?.................d$.`..@...........G
    C000:01C0  ...W.s.W.s.X.\.\...........G...W.p.W.p.X.[.............?..W.v.W
    C000:0200  .v.X.\../..........?...?.......%..........3............o........
    C000:0240  .....$q...._..._./.....'...'......?................/.....)...)..
    C000:0280  ...X.................)...).....<g..........?...../.../......J...
    C000:02C0  ..x..?.o.?.o..?.................?.o.?.o..?.............|...?.o
    C000:0300  .?.o..?..............Y.........'..'.................(....O.
    C000:0340  .O.................0.S..2....4....8.a..:....<....A.S..C....E....
    C000:0380  I.a..K....M....P S..R ...T ...X a..Z ...\ ......................
    C000:03C0  ................................................................


------------------------------------------------------------------------------------------------------------------------

The names of actual companies and products mentioned herein may be the trademarks of their respective owners.
