1034424
teresa rojas
366
--------[ AIDA64 Extreme Edition ]--------------------------------------------------------------------------------------

    Versión                                           AIDA64 v3.00.2529 Beta/es
    Módulo de rendimiento                             4.0.568-x32
    Página principal                                  http://www.aida64.com/
    Tipo de informe                                   Asistente de informes
    Equipo                                            DPTO_MICROBIOLO
    Generador                                         Administrador
    Sistema operativo                                 Microsoft Windows XP Professional 5.1.2600 (WinXP RTM)
    Fecha                                             2002-01-01
    Hora                                              00:22


--------[ Resumen ]-----------------------------------------------------------------------------------------------------

    Equipo:
      Tipo de equipo                                    Equipo multiprocesador ACPI
      Sistema operativo                                 Microsoft Windows XP Professional
      Service Pack del SO                               Service Pack 3
      Internet Explorer                                 6.0.2900.5512
      DirectX                                           4.09.00.0904 (DirectX 9.0c)
      Nombre del equipo                                 DPTO_MICROBIOLO
      Nombre de usuario                                 Administrador
      Dominio de inicio de sesión                       DPTO_MICROBIOLO
      Fecha / Hora                                      2002-01-01 / 00:22

    Placa base:
      Tipo de CPU                                       DualCore Intel Pentium E2180, 2000 MHz (10 x 200)
      Nombre de la placa base                           Asus P5L-VM 1394  (2 PCI, 1 PCI-E x1, 1 PCI-E x16, 4 DDR2 DIMM, Audio, Video, Gigabit LAN, IEEE-1394)
      Chipset de la placa base                          Intel Lakeport-G i945G
      Memoria del sistema                               1024 MB  (DDR2-667 DDR2 SDRAM)
      DIMM1: Elpida SyncPRO                             1 GB DDR2-667 DDR2 SDRAM  (5-5-5-15 @ 333 MHz)  (4-4-4-12 @ 266 MHz)
      Tipo de BIOS                                      AMI (06/06/07)
      Puerto de comunicación                            Puerto de comunicaciones (COM1)
      Puerto de comunicación                            Puerto de impresora ECP (LPT1)

    Pantalla:
      Adaptador de video                                Radeon X300/X550/X1050 Series Secondary  (512 MB)
      Adaptador de video                                Radeon X300/X550/X1050 Series  (512 MB)
      Aceleradora 3D                                    ATI Radeon X550/X1050 (RV370)
      Monitor                                           AOC CT710g  [17" CRT]  (182075963)

    Multimedia:
      Adaptador de audio                                Realtek ALC883 @ Intel 82801GB ICH7 - High Definition Audio Controller [A-1]

    Almacenamiento:
      Controlador IDE                                   Controladora estándar PCI IDE de doble canal
      Controlador IDE                                   Controladora estándar PCI IDE de doble canal
      Unidad de disquetes                               Unidad de disquete
      Unidad de disco                                   Kingston DataTraveler 102 USB Device  (3 GB, USB)
      Unidad de disco                                   ST3250310AS  (250 GB, 7200 RPM, SATA-II)
      Unidad óptica                                     DTSOFT Virtual CdRom Device
      Unidad óptica                                     TSSTcorp CDDVDW SH-S202J  (DVD+R9:16x, DVD-R9:12x, DVD+RW:20x/8x, DVD-RW:20x/6x, DVD-RAM:12x, DVD-ROM:16x, CD:48x/32x/48x DVD+RW/DVD-RW/DVD-RAM)
      Estado SMART de los discos duros                  Aceptar

    Particiones:
      C: (NTFS)                                         24003 MB (6606 MB libre)
      D: (NTFS)                                         209.4 GB (21.2 GB libre)
      Tamaño total                                      232.9 GB (27.7 GB libre)

    Entrada:
      Teclado                                           Standard 101/102-Key or Microsoft Natural PS/2 Keyboard with HP QLB
      Mouse                                             Mouse compatible con HID

    Red:
      Dirección IP primaria                             10.6.49.216
      Dirección MAC primaria                            00-1D-60-73-CE-F8
      Adaptador de red                                  Atheros L1 Gigabit Ethernet 10/100/1000Base-T Controller  (10.6.49.216)

    Periféricos:
      Impresora                                         Adobe PDF
      Impresora                                         Detectando automáticamente Adobe PDF en SHANNON
      Impresora                                         Detectando automáticamente Epson LX-300 en SHANNON
      Impresora                                         Detectando automáticamente Epson LX-300+ en DFRANCOS
      Impresora                                         Detectando automáticamente Foxit Reader PDF Printer en DFRANCOS
      Impresora                                         Epson LX-300+ (Copiar 1)
      Impresora                                         Epson LX-300+
      Impresora                                         Foxit Reader PDF Printer
      Impresora                                         HP LaserJet Professional P1102w
      Impresora                                         STATISTICAPDF
      Controlador FireWire                              VIA VT6308 Fire IIM IEEE1394 Host Controller (PHY: VIA VT6307)
      Controlador USB1                                  Intel 82801GB ICH7 - USB Universal Host Controller [A-1]
      Controlador USB1                                  Intel 82801GB ICH7 - USB Universal Host Controller [A-1]
      Controlador USB1                                  Intel 82801GB ICH7 - USB Universal Host Controller [A-1]
      Controlador USB1                                  Intel 82801GB ICH7 - USB Universal Host Controller [A-1]
      Controlador USB2                                  Intel 82801GB ICH7 - Enhanced USB2 Controller [A-1]
      Dispositivo USB                                   Dispositivo de almacenamiento masivo USB
      Dispositivo USB                                   Dispositivo de interfaz humana USB

    DMI:
      Vendedor del BIOS DMI                             American Megatrends Inc.
      Versión del BIOS DMI                              0903
      Fabricante del sistema DMI                        System manufacturer
      Producto del sistema DMI                          System Product Name
      Versión del sistema DMI                           System Version
      Número de serie del sistema DMI                   System Serial Number
      UUID del sistema DMI                              20BFE383-8DFED511-A8A8001D-6073CEF8
      Fabricante de la placa base DMI                   ASUSTeK Computer INC.
      Producto de la placa base DMI                     P5L-VM 1394
      Versión de la placa base DMI                      Rev 1.xx
      Número de serie de la placa base DMI              MB-1234567890
      Fabricante del chasis DMI                         Chassis Manufacture
      Versión del chasis DMI                            Chassis Version
      Número de serie del chasis DMI                    Chassis Serial Number
      Identificador del chasis DMI                      Asset-1234567890
      Tipo de chasis DMI                                Desktop Case
      Sockets de memoria Totales / Libres DMI           4 / 3


--------[ Debug - PCI ]-------------------------------------------------------------------------------------------------

    B00 D00 F00:  Intel 82945G Memory Controller Hub [A-2]
                  
      Offset 000:  86 80 70 27  06 00 90 20  02 00 00 06  00 00 00 00 
      Offset 010:  00 00 00 00  00 00 00 00  00 00 00 00  00 00 00 00 
      Offset 020:  00 00 00 00  00 00 00 00  00 00 00 00  43 10 7A 81 
      Offset 030:  00 00 00 00  E0 00 00 00  00 00 00 00  00 00 00 00 
      Offset 040:  01 90 D1 FE  01 40 D1 FE  01 00 00 E0  01 80 D1 FE 
      Offset 050:  00 00 02 00  03 00 00 10  00 00 00 00  00 00 00 00 
      Offset 060:  00 30 D1 FE  00 00 00 00  00 00 00 00  00 00 00 00 
      Offset 070:  00 00 00 00  00 00 00 00  00 00 00 00  00 00 00 00 
      Offset 080:  00 00 00 00  00 00 00 00  00 00 00 00  00 00 00 00 
      Offset 090:  10 11 11 00  00 33 33 00  FF 03 00 00  40 0A 38 00 
      Offset 0A0:  08 00 00 00  00 00 00 00  00 00 00 00  00 00 00 00 
      Offset 0B0:  00 00 00 00  00 00 00 00  00 00 00 00  00 00 00 00 
      Offset 0C0:  00 00 00 00  00 00 00 00  00 00 00 00  00 00 00 00 
      Offset 0D0:  00 00 00 00  00 00 00 00  00 00 00 00  20 01 00 00 
      Offset 0E0:  09 00 09 51  02 E1 9B 88  06 00 00 00  00 00 00 00 
      Offset 0F0:  00 00 00 00  00 00 00 00  86 0F 03 00  00 00 00 00 

    B00 D01 F00:  Intel 82945G PCI Express Root Port [A-2]
                  
      Offset 000:  86 80 71 27  07 01 10 00  02 00 04 06  04 00 01 00 
      Offset 010:  00 00 00 00  00 00 00 00  00 04 04 00  E0 E0 00 20 
      Offset 020:  F0 CF F0 CF  01 D0 F1 DF  00 00 00 00  00 00 00 00 
      Offset 030:  00 00 00 00  88 00 00 00  00 00 00 00  10 01 0A 00 
      Offset 040:  00 00 00 00  00 00 00 00  00 00 00 00  00 00 00 00 
      Offset 050:  00 00 00 00  00 00 00 00  00 00 00 00  00 00 00 00 
      Offset 060:  00 00 00 00  00 00 00 00  00 00 00 00  00 00 00 00 
      Offset 070:  00 00 00 00  00 00 00 00  00 00 00 00  00 00 00 02 
      Offset 080:  01 90 02 C8  00 00 00 00  0D 80 00 00  86 80 00 00 
      Offset 090:  05 A0 00 00  00 00 00 00  00 00 00 00  00 00 00 00 
      Offset 0A0:  10 00 41 01  00 00 00 00  00 00 00 00  01 2D 01 02 
      Offset 0B0:  40 00 01 11  80 25 00 00  C0 01 48 00  00 00 00 00 
      Offset 0C0:  00 00 00 00  00 00 00 00  00 00 00 00  00 00 00 00 
      Offset 0D0:  00 00 00 00  00 00 00 00  00 00 00 00  00 00 00 00 
      Offset 0E0:  00 00 00 00  00 00 00 00  00 00 00 00  00 00 00 00 
      Offset 0F0:  00 00 01 00  00 00 00 00  86 0F 03 00  00 00 00 00 

    B00 D1B F00:  Intel 82801GB ICH7 - High Definition Audio Controller [A-1]
                  
      Offset 000:  86 80 D8 27  06 00 10 00  01 00 03 04  04 00 00 00 
      Offset 010:  04 80 CF CF  00 00 00 00  00 00 00 00  00 00 00 00 
      Offset 020:  00 00 00 00  00 00 00 00  00 00 00 00  43 10 49 82 
      Offset 030:  00 00 00 00  50 00 00 00  00 00 00 00  13 01 00 00 
      Offset 040:  03 00 00 03  07 00 00 00  00 00 00 00  00 00 00 00 
      Offset 050:  01 60 42 C8  00 00 00 00  00 00 00 00  00 00 00 00 
      Offset 060:  05 70 80 00  00 00 00 00  00 00 00 00  00 00 00 00 
      Offset 070:  10 00 91 00  00 00 00 00  00 08 10 00  00 00 00 00 
      Offset 080:  00 00 00 00  00 00 00 00  00 00 00 00  00 00 00 00 
      Offset 090:  00 00 00 00  00 00 00 00  00 00 00 00  00 00 00 00 
      Offset 0A0:  00 00 00 00  00 00 00 00  00 00 00 00  00 00 00 00 
      Offset 0B0:  00 00 00 00  00 00 00 00  00 00 00 00  00 00 00 00 
      Offset 0C0:  00 00 00 01  00 00 00 00  00 00 00 00  00 00 00 00 
      Offset 0D0:  00 00 00 00  00 00 00 00  00 00 00 00  00 00 00 00 
      Offset 0E0:  00 00 00 00  00 00 00 00  00 00 00 00  00 00 00 00 
      Offset 0F0:  00 00 00 00  00 00 00 00  86 0F 01 00  00 00 00 00 

    B00 D1C F00:  Intel 82801GB ICH7 - PCI Express Root Port 1 [A-1]
                  
      Offset 000:  86 80 D0 27  07 01 10 00  01 00 04 06  04 00 81 00 
      Offset 010:  00 00 00 00  00 00 00 00  00 03 03 00  D0 D0 00 20 
      Offset 020:  F0 FF 00 00  F1 FF 01 00  00 00 00 00  00 00 00 00 
      Offset 030:  00 00 00 00  40 00 00 00  00 00 00 00  10 01 06 00 
      Offset 040:  10 80 41 01  C0 0F 00 00  00 00 10 00  11 2C 11 01 
      Offset 050:  40 00 01 10  60 05 08 00  00 00 00 00  00 00 00 00 
      Offset 060:  00 00 00 00  00 00 00 00  00 00 00 00  00 00 00 00 
      Offset 070:  00 00 00 00  00 00 00 00  00 00 00 00  00 00 00 00 
      Offset 080:  05 90 00 00  00 00 00 00  00 00 00 00  00 00 00 00 
      Offset 090:  0D A0 00 00  43 10 79 81  00 00 00 00  00 00 00 00 
      Offset 0A0:  01 00 02 C8  00 00 00 00  00 00 00 00  00 00 00 00 
      Offset 0B0:  00 00 00 00  00 00 00 00  00 00 00 00  00 00 00 00 
      Offset 0C0:  00 00 00 00  00 00 00 00  00 00 00 00  00 00 00 00 
      Offset 0D0:  00 00 00 00  00 00 00 00  00 00 11 00  00 00 00 00 
      Offset 0E0:  00 00 C7 00  06 07 08 00  00 00 00 00  00 00 00 00 
      Offset 0F0:  00 00 00 00  00 00 00 00  86 0F 01 00  00 00 00 00 

    B00 D1C F01:  Intel 82801GB ICH7 - PCI Express Root Port 2 [A-1]
                  
      Offset 000:  86 80 D2 27  07 01 10 00  01 00 04 06  04 00 81 00 
      Offset 010:  00 00 00 00  00 00 00 00  00 02 02 00  C0 C0 00 00 
      Offset 020:  E0 CF E0 CF  F1 FF 01 00  00 00 00 00  00 00 00 00 
      Offset 030:  00 00 00 00  40 00 00 00  00 00 00 00  11 02 06 00 
      Offset 040:  10 80 41 00  C0 0F 00 00  00 00 10 00  11 2C 11 02 
      Offset 050:  40 00 11 30  60 05 10 00  00 00 48 01  00 00 00 00 
      Offset 060:  00 00 00 00  00 00 00 00  00 00 00 00  00 00 00 00 
      Offset 070:  00 00 00 00  00 00 00 00  00 00 00 00  00 00 00 00 
      Offset 080:  05 90 00 00  00 00 00 00  00 00 00 00  00 00 00 00 
      Offset 090:  0D A0 00 00  43 10 79 81  00 00 00 00  00 00 00 00 
      Offset 0A0:  01 00 02 C8  00 00 00 00  00 00 00 00  00 00 00 00 
      Offset 0B0:  00 00 00 00  00 00 00 00  00 00 00 00  00 00 00 00 
      Offset 0C0:  00 00 00 00  00 00 00 00  00 00 00 00  00 00 00 00 
      Offset 0D0:  00 00 00 00  00 00 00 00  00 00 11 00  00 00 00 00 
      Offset 0E0:  00 00 C7 00  06 07 08 00  00 00 00 00  00 00 00 00 
      Offset 0F0:  00 00 00 00  00 00 00 00  86 0F 01 00  00 00 00 00 

    B00 D1D F00:  Intel 82801GB ICH7 - USB Universal Host Controller [A-1]
                  
      Offset 000:  86 80 C8 27  05 00 80 02  01 00 03 0C  00 00 80 00 
      Offset 010:  00 00 00 00  00 00 00 00  00 00 00 00  00 00 00 00 
      Offset 020:  01 80 00 00  00 00 00 00  00 00 00 00  43 10 79 81 
      Offset 030:  00 00 00 00  00 00 00 00  00 00 00 00  14 01 00 00 
      Offset 040:  00 00 00 00  00 00 00 00  00 00 00 00  00 00 00 00 
      Offset 050:  00 00 00 00  00 00 00 00  00 00 00 00  00 00 00 00 
      Offset 060:  10 00 00 00  00 00 00 00  00 00 00 00  00 00 00 00 
      Offset 070:  00 00 00 00  00 00 00 00  00 00 00 00  00 00 00 00 
      Offset 080:  00 00 00 00  00 00 00 00  00 00 00 00  00 00 00 00 
      Offset 090:  00 00 00 00  00 00 00 00  00 00 00 00  00 00 00 00 
      Offset 0A0:  00 00 00 00  00 00 00 00  00 00 00 00  00 00 00 00 
      Offset 0B0:  00 00 00 00  00 00 00 00  00 00 00 00  00 00 00 00 
      Offset 0C0:  00 27 00 00  00 00 00 00  00 00 01 00  00 00 00 00 
      Offset 0D0:  00 00 00 00  00 00 00 00  00 00 00 00  00 00 00 00 
      Offset 0E0:  00 00 00 00  00 00 00 00  00 00 00 00  00 00 00 00 
      Offset 0F0:  00 00 00 00  00 00 00 00  86 0F 01 00  00 00 00 00 

    B00 D1D F01:  Intel 82801GB ICH7 - USB Universal Host Controller [A-1]
                  
      Offset 000:  86 80 C9 27  05 00 80 02  01 00 03 0C  00 00 00 00 
      Offset 010:  00 00 00 00  00 00 00 00  00 00 00 00  00 00 00 00 
      Offset 020:  01 84 00 00  00 00 00 00  00 00 00 00  43 10 79 81 
      Offset 030:  00 00 00 00  00 00 00 00  00 00 00 00  11 02 00 00 
      Offset 040:  00 00 00 00  00 00 00 00  00 00 00 00  00 00 00 00 
      Offset 050:  00 00 00 00  00 00 00 00  00 00 00 00  00 00 00 00 
      Offset 060:  10 00 00 00  00 00 00 00  00 00 00 00  00 00 00 00 
      Offset 070:  00 00 00 00  00 00 00 00  00 00 00 00  00 00 00 00 
      Offset 080:  00 00 00 00  00 00 00 00  00 00 00 00  00 00 00 00 
      Offset 090:  00 00 00 00  00 00 00 00  00 00 00 00  00 00 00 00 
      Offset 0A0:  00 00 00 00  00 00 00 00  00 00 00 00  00 00 00 00 
      Offset 0B0:  00 00 00 00  00 00 00 00  00 00 00 00  00 00 00 00 
      Offset 0C0:  00 27 00 00  00 00 00 00  00 00 01 00  00 00 00 00 
      Offset 0D0:  00 00 00 00  00 00 00 00  00 00 00 00  00 00 00 00 
      Offset 0E0:  00 00 00 00  00 00 00 00  00 00 00 00  00 00 00 00 
      Offset 0F0:  00 00 00 00  00 00 00 00  86 0F 01 00  00 00 00 00 

    B00 D1D F02:  Intel 82801GB ICH7 - USB Universal Host Controller [A-1]
                  
      Offset 000:  86 80 CA 27  05 00 80 02  01 00 03 0C  00 00 00 00 
      Offset 010:  00 00 00 00  00 00 00 00  00 00 00 00  00 00 00 00 
      Offset 020:  01 88 00 00  00 00 00 00  00 00 00 00  43 10 79 81 
      Offset 030:  00 00 00 00  00 00 00 00  00 00 00 00  12 03 00 00 
      Offset 040:  00 00 00 00  00 00 00 00  00 00 00 00  00 00 00 00 
      Offset 050:  00 00 00 00  00 00 00 00  00 00 00 00  00 00 00 00 
      Offset 060:  10 00 00 00  00 00 00 00  00 00 00 00  00 00 00 00 
      Offset 070:  00 00 00 00  00 00 00 00  00 00 00 00  00 00 00 00 
      Offset 080:  00 00 00 00  00 00 00 00  00 00 00 00  00 00 00 00 
      Offset 090:  00 00 00 00  00 00 00 00  00 00 00 00  00 00 00 00 
      Offset 0A0:  00 00 00 00  00 00 00 00  00 00 00 00  00 00 00 00 
      Offset 0B0:  00 00 00 00  00 00 00 00  00 00 00 00  00 00 00 00 
      Offset 0C0:  00 27 00 00  00 00 00 00  00 00 01 00  00 00 00 00 
      Offset 0D0:  00 00 00 00  00 00 00 00  00 00 00 00  00 00 00 00 
      Offset 0E0:  00 00 00 00  00 00 00 00  00 00 00 00  00 00 00 00 
      Offset 0F0:  00 00 00 00  00 00 00 00  86 0F 01 00  00 00 00 00 

    B00 D1D F03:  Intel 82801GB ICH7 - USB Universal Host Controller [A-1]
                  
      Offset 000:  86 80 CB 27  05 00 80 02  01 00 03 0C  00 00 00 00 
      Offset 010:  00 00 00 00  00 00 00 00  00 00 00 00  00 00 00 00 
      Offset 020:  01 90 00 00  00 00 00 00  00 00 00 00  43 10 79 81 
      Offset 030:  00 00 00 00  00 00 00 00  00 00 00 00  13 04 00 00 
      Offset 040:  00 00 00 00  00 00 00 00  00 00 00 00  00 00 00 00 
      Offset 050:  00 00 00 00  00 00 00 00  00 00 00 00  00 00 00 00 
      Offset 060:  10 00 00 00  00 00 00 00  00 00 00 00  00 00 00 00 
      Offset 070:  00 00 00 00  00 00 00 00  00 00 00 00  00 00 00 00 
      Offset 080:  00 00 00 00  00 00 00 00  00 00 00 00  00 00 00 00 
      Offset 090:  00 00 00 00  00 00 00 00  00 00 00 00  00 00 00 00 
      Offset 0A0:  00 00 00 00  00 00 00 00  00 00 00 00  00 00 00 00 
      Offset 0B0:  00 00 00 00  00 00 00 00  00 00 00 00  00 00 00 00 
      Offset 0C0:  00 27 00 00  00 00 00 00  00 00 01 00  00 00 00 00 
      Offset 0D0:  00 00 00 00  00 00 00 00  00 00 00 00  00 00 00 00 
      Offset 0E0:  00 00 00 00  00 00 00 00  00 00 00 00  00 00 00 00 
      Offset 0F0:  00 00 00 00  00 00 00 00  86 0F 01 00  00 00 00 00 

    B00 D1D F07:  Intel 82801GB ICH7 - Enhanced USB2 Controller [A-1]
                  
      Offset 000:  86 80 CC 27  06 00 90 02  01 20 03 0C  00 00 00 00 
      Offset 010:  00 FC CF CF  00 00 00 00  00 00 00 00  00 00 00 00 
      Offset 020:  00 00 00 00  00 00 00 00  00 00 00 00  43 10 79 81 
      Offset 030:  00 00 00 00  50 00 00 00  00 00 00 00  14 01 00 00 
      Offset 040:  00 00 00 00  00 00 00 00  00 00 00 00  00 00 00 00 
      Offset 050:  01 58 C2 C9  00 00 00 00  0A 00 A0 20  00 00 00 00 
      Offset 060:  20 20 FF 01  00 00 00 00  01 00 00 00  00 20 00 C0 
      Offset 070:  00 00 DF 3F  00 00 00 00  00 00 00 00  00 00 00 00 
      Offset 080:  00 00 00 00  01 00 00 00  00 00 00 00  00 00 00 00 
      Offset 090:  00 00 00 00  00 00 00 00  00 00 00 00  00 00 00 00 
      Offset 0A0:  00 00 00 00  00 00 00 00  00 00 00 00  00 00 00 00 
      Offset 0B0:  00 00 00 00  00 00 00 00  00 00 00 00  00 00 00 00 
      Offset 0C0:  00 00 00 00  00 00 00 00  00 00 00 00  00 00 00 00 
      Offset 0D0:  00 00 00 00  00 AA FF 00  FF 00 FF 00  20 00 00 88 
      Offset 0E0:  00 00 00 00  DB B6 6D 00  00 00 00 00  00 00 00 00 
      Offset 0F0:  00 80 00 09  88 85 40 00  86 0F 01 00  06 17 02 20 

    B00 D1E F00:  Intel 82801GB I/O Controller Hub 7 (ICH7) [A-1]
                  
      Offset 000:  86 80 4E 24  07 01 10 00  E1 01 04 06  00 00 01 00 
      Offset 010:  00 00 00 00  00 00 00 00  00 01 01 20  B0 B0 80 22 
      Offset 020:  D0 CF D0 CF  F1 FF 01 00  00 00 00 00  00 00 00 00 
      Offset 030:  00 00 00 00  50 00 00 00  00 00 00 00  00 00 06 00 
      Offset 040:  00 00 00 00  00 00 00 00  00 00 00 00  00 12 00 00 
      Offset 050:  0D 00 00 00  43 10 79 81  00 00 00 00  00 00 00 00 
      Offset 060:  00 00 00 00  00 00 00 00  00 00 00 00  00 00 00 00 
      Offset 070:  00 00 00 00  00 00 00 00  00 00 00 00  00 00 00 00 
      Offset 080:  00 00 00 00  00 00 00 00  00 00 00 00  00 00 00 00 
      Offset 090:  00 00 00 00  00 00 00 00  00 00 00 00  00 00 00 00 
      Offset 0A0:  00 00 00 00  00 00 00 00  00 00 00 00  00 00 00 00 
      Offset 0B0:  00 00 00 00  00 00 00 00  00 00 00 00  00 00 00 00 
      Offset 0C0:  00 00 00 00  00 00 00 00  00 00 00 00  00 00 00 00 
      Offset 0D0:  00 00 00 00  00 00 00 00  00 00 00 00  00 00 00 00 
      Offset 0E0:  00 00 00 00  00 00 00 00  00 00 00 00  00 00 00 00 
      Offset 0F0:  00 00 00 00  00 00 00 00  86 0F 01 00  00 00 00 00 

    B00 D1F F00:  Intel 82801GB ICH7 - LPC Bridge [A-1]
                  
      Offset 000:  86 80 B8 27  07 00 10 02  01 00 01 06  00 00 80 00 
      Offset 010:  00 00 00 00  00 00 00 00  00 00 00 00  00 00 00 00 
      Offset 020:  00 00 00 00  00 00 00 00  00 00 00 00  43 10 79 81 
      Offset 030:  00 00 00 00  E0 00 00 00  00 00 00 00  00 00 00 00 
      Offset 040:  01 08 00 00  80 00 00 00  81 04 00 00  10 00 00 00 
      Offset 050:  00 00 00 00  00 00 00 00  00 00 00 00  00 00 00 00 
      Offset 060:  8B 8A 85 85  D0 00 00 00  83 85 80 80  00 00 00 00 
      Offset 070:  00 00 00 00  00 00 00 00  00 00 00 00  00 00 00 00 
      Offset 080:  00 00 0F 14  00 00 00 00  91 02 04 00  00 00 00 00 
      Offset 090:  00 00 00 00  00 00 00 00  00 00 00 00  00 00 00 00 
      Offset 0A0:  28 02 00 00  29 00 00 00  13 00 00 00  00 03 00 00 
      Offset 0B0:  00 00 F0 00  00 00 00 00  00 00 00 00  00 00 00 00 
      Offset 0C0:  00 00 00 00  00 00 00 00  00 00 00 00  00 00 00 00 
      Offset 0D0:  33 22 11 00  67 45 00 00  C0 80 00 00  00 00 00 00 
      Offset 0E0:  09 00 0C 10  A8 00 24 00  00 00 00 00  00 00 00 00 
      Offset 0F0:  01 C0 D1 FE  00 00 00 00  86 0F 01 00  00 00 00 00 

    B00 D1F F01:  Intel 82801GB ICH7 - ATA-100 IDE Controller [A-1]
                  
      Offset 000:  86 80 DF 27  05 00 80 02  01 8A 01 01  00 00 00 00 
      Offset 010:  01 00 00 00  01 00 00 00  01 00 00 00  01 00 00 00 
      Offset 020:  A1 FF 00 00  00 00 00 00  00 00 00 00  43 10 79 81 
      Offset 030:  00 00 00 00  00 00 00 00  00 00 00 00  00 01 00 00 
      Offset 040:  03 A3 00 80  00 00 00 00  01 00 02 00  00 00 00 00 
      Offset 050:  00 00 00 00  31 00 00 00  00 00 00 00  00 00 00 00 
      Offset 060:  00 00 00 00  00 00 00 00  00 00 00 00  00 00 00 00 
      Offset 070:  00 00 00 00  00 00 00 00  00 00 00 00  00 00 00 00 
      Offset 080:  00 00 00 00  00 00 00 00  00 00 00 00  00 00 00 00 
      Offset 090:  00 00 00 00  00 00 00 00  00 00 00 00  00 00 00 00 
      Offset 0A0:  00 00 00 00  00 00 00 00  00 00 00 00  00 00 00 00 
      Offset 0B0:  00 00 00 00  00 00 00 00  00 00 00 00  00 00 00 00 
      Offset 0C0:  00 00 00 00  03 00 00 00  00 00 00 00  00 00 00 00 
      Offset 0D0:  00 00 00 00  00 00 00 00  00 00 00 00  00 00 00 00 
      Offset 0E0:  00 00 00 00  00 00 00 00  00 00 00 00  00 00 00 00 
      Offset 0F0:  00 00 00 00  00 00 00 00  86 0F 01 00  00 00 00 00 

    B00 D1F F02:  Intel 82801GB ICH7 - SATA Controller [A-1]
                  
      Offset 000:  86 80 C0 27  05 00 B0 02  01 8F 01 01  00 00 00 00 
      Offset 010:  01 A8 00 00  01 A4 00 00  01 A0 00 00  01 98 00 00 
      Offset 020:  01 94 00 00  00 00 00 00  00 00 00 00  43 10 01 26 
      Offset 030:  00 00 00 00  70 00 00 00  00 00 00 00  11 02 00 00 
      Offset 040:  07 A3 00 80  00 00 00 00  01 00 01 00  00 00 00 00 
      Offset 050:  00 00 00 00  30 10 00 00  00 00 00 00  00 00 00 00 
      Offset 060:  00 00 00 00  00 00 00 00  00 00 00 00  00 00 00 00 
      Offset 070:  01 00 02 40  00 00 00 00  00 00 00 00  00 00 00 00 
      Offset 080:  05 70 00 00  00 00 00 00  00 00 00 00  00 00 00 00 
      Offset 090:  00 00 1F 00  80 01 00 40  00 00 00 00  00 00 00 00 
      Offset 0A0:  00 00 00 00  00 00 00 00  00 00 00 00  00 00 00 00 
      Offset 0B0:  00 00 00 00  00 00 00 00  00 00 00 00  00 00 00 00 
      Offset 0C0:  00 00 00 00  05 00 00 00  00 00 00 00  00 00 00 00 
      Offset 0D0:  00 00 00 00  00 00 00 00  00 00 00 00  00 00 00 00 
      Offset 0E0:  00 00 00 00  00 00 00 00  00 00 00 00  00 00 00 00 
      Offset 0F0:  00 00 00 00  00 00 00 00  86 0F 01 00  00 00 00 00 

    B00 D1F F03:  Intel 82801GB ICH7 - SMBus Controller [A-1]
                  
      Offset 000:  86 80 DA 27  01 00 80 02  01 00 05 0C  00 00 00 00 
      Offset 010:  00 00 00 00  00 00 00 00  00 00 00 00  00 00 00 00 
      Offset 020:  01 04 00 00  00 00 00 00  00 00 00 00  43 10 79 81 
      Offset 030:  00 00 00 00  00 00 00 00  00 00 00 00  00 02 00 00 
      Offset 040:  01 00 00 00  00 00 00 00  00 00 00 00  00 00 00 00 
      Offset 050:  00 00 00 00  00 00 00 00  00 00 00 00  00 00 00 00 
      Offset 060:  00 00 00 00  00 00 00 00  00 00 00 00  00 00 00 00 
      Offset 070:  00 00 00 00  00 00 00 00  00 00 00 00  00 00 00 00 
      Offset 080:  00 00 00 00  00 00 00 00  00 00 00 00  00 00 00 00 
      Offset 090:  00 00 00 00  00 00 00 00  00 00 00 00  00 00 00 00 
      Offset 0A0:  00 00 00 00  00 00 00 00  00 00 00 00  00 00 00 00 
      Offset 0B0:  00 00 00 00  00 00 00 00  00 00 00 00  00 00 00 00 
      Offset 0C0:  00 00 00 00  00 00 00 00  00 00 00 00  00 00 00 00 
      Offset 0D0:  00 00 00 00  00 00 00 00  00 00 00 00  00 00 00 00 
      Offset 0E0:  00 00 00 00  00 00 00 00  00 00 00 00  00 00 00 00 
      Offset 0F0:  00 00 00 00  00 00 00 00  86 0F 01 00  00 00 00 00 

    B01 D03 F00:  VIA VT6308 Fire IIM IEEE1394 Host Controller
                  
      Offset 000:  06 11 44 30  17 00 10 02  C0 10 00 0C  04 40 00 00 
      Offset 010:  00 F8 DF CF  01 B8 00 00  00 00 00 00  00 00 00 00 
      Offset 020:  00 00 00 00  00 00 00 00  00 00 00 00  43 10 FE 81 
      Offset 030:  00 00 00 00  50 00 00 00  00 00 00 00  15 01 00 20 
      Offset 040:  00 00 00 00  00 00 00 00  00 00 00 00  00 00 00 00 
      Offset 050:  01 00 02 E4  00 00 00 00  00 00 00 00  00 00 00 00 
      Offset 060:  00 00 00 00  00 00 00 00  00 00 00 00  00 00 00 00 
      Offset 070:  00 00 00 00  00 00 00 00  00 00 00 00  00 00 00 00 
      Offset 080:  00 00 00 00  00 00 00 00  00 00 00 00  00 00 00 00 
      Offset 090:  00 00 00 00  00 00 00 00  00 00 00 00  00 00 00 00 
      Offset 0A0:  00 00 00 00  00 00 00 00  00 00 00 00  00 00 00 00 
      Offset 0B0:  00 00 00 00  00 00 00 00  00 00 00 00  00 00 00 00 
      Offset 0C0:  00 00 00 00  00 00 00 00  00 00 00 00  00 00 00 00 
      Offset 0D0:  00 00 00 00  00 00 00 00  00 00 00 00  00 00 00 00 
      Offset 0E0:  00 00 00 00  00 00 00 00  00 00 00 00  00 00 00 00 
      Offset 0F0:  00 00 00 00  00 00 00 00  00 00 00 00  00 00 00 00 

    B02 D00 F00:  Attansic L1 Gigabit Ethernet Adapter
                  
      Offset 000:  69 19 48 10  06 00 10 00  B0 00 00 02  04 00 00 00 
      Offset 010:  04 00 EC CF  00 00 00 00  00 00 00 00  00 00 00 00 
      Offset 020:  00 00 00 00  00 00 00 00  00 00 00 00  43 10 26 82 
      Offset 030:  00 00 EA CF  40 00 00 00  00 00 00 00  11 01 00 00 
      Offset 040:  01 48 02 C0  00 00 00 00  05 58 80 00  00 00 00 00 
      Offset 050:  00 00 00 00  00 00 00 00  10 00 01 00  80 7F 28 00 
      Offset 060:  00 20 1B 00  11 F4 03 00  40 00 11 10  03 00 00 00 
      Offset 070:  00 00 00 00  00 00 00 00  00 00 00 00  00 00 00 00 
      Offset 080:  00 00 00 00  69 19 48 10  00 00 00 00  00 00 00 00 
      Offset 090:  00 00 00 00  00 00 00 00  00 00 00 00  00 00 00 00 
      Offset 0A0:  00 00 00 00  00 00 00 00  00 00 00 00  00 00 00 00 
      Offset 0B0:  00 00 00 00  00 00 00 00  00 00 00 00  00 00 00 00 
      Offset 0C0:  00 00 00 00  00 00 00 00  00 00 00 00  00 00 00 00 
      Offset 0D0:  00 00 00 00  00 00 00 00  00 00 00 00  00 00 00 00 
      Offset 0E0:  00 00 00 00  00 00 00 00  00 00 00 00  00 00 00 00 
      Offset 0F0:  00 00 00 00  00 00 00 00  00 00 00 00  00 00 00 00 

    B04 D00 F00:  ATI Radeon X550/X1050 (RV370) Video Adapter
                  
      Offset 000:  02 10 63 5B  07 00 10 00  00 00 00 03  04 00 80 00 
      Offset 010:  08 00 00 D0  01 E0 00 00  00 00 FE CF  00 00 00 00 
      Offset 020:  00 00 00 00  00 00 00 00  00 00 00 00  43 10 08 02 
      Offset 030:  00 00 FC CF  50 00 00 00  00 00 00 00  10 01 00 00 
      Offset 040:  00 00 00 00  00 00 00 00  00 00 00 00  43 10 08 02 
      Offset 050:  01 58 02 06  00 00 00 00  10 80 01 00  60 02 2C 01 
      Offset 060:  10 09 00 00  01 1D 00 00  40 00 01 11  00 00 00 00 
      Offset 070:  00 00 00 00  00 00 00 00  00 00 00 00  00 00 00 00 
      Offset 080:  05 00 80 00  00 00 00 00  00 00 00 00  00 00 00 00 
      Offset 090:  00 00 00 00  00 00 00 00  00 00 00 00  00 00 00 00 
      Offset 0A0:  00 00 00 00  00 00 00 00  00 00 00 00  00 00 00 00 
      Offset 0B0:  00 00 00 00  00 00 00 00  00 00 00 00  00 00 00 00 
      Offset 0C0:  00 00 00 00  00 00 00 00  00 00 00 00  00 00 00 00 
      Offset 0D0:  00 00 00 00  00 00 00 00  00 00 00 00  00 00 00 00 
      Offset 0E0:  00 00 00 00  00 00 00 00  00 00 00 00  00 00 00 00 
      Offset 0F0:  00 00 00 00  00 00 00 00  00 00 00 00  00 00 00 00 

    B04 D00 F01:  ATI Radeon X550/X1050 (RV370) - Secondary Video Adapter
                  
      Offset 000:  02 10 73 5B  07 00 10 00  00 00 80 03  04 00 00 00 
      Offset 010:  00 00 FF CF  00 00 00 00  00 00 00 00  00 00 00 00 
      Offset 020:  00 00 00 00  00 00 00 00  00 00 00 00  43 10 09 02 
      Offset 030:  00 00 00 00  50 00 00 00  00 00 00 00  FF 00 00 00 
      Offset 040:  00 00 00 00  00 00 00 00  00 00 00 00  00 00 00 00 
      Offset 050:  01 58 02 06  00 00 00 00  10 00 01 00  40 02 00 00 
      Offset 060:  00 00 00 00  01 1D 00 00  40 00 01 11  00 00 00 00 
      Offset 070:  00 00 00 00  00 00 00 00  00 00 00 00  00 00 00 00 
      Offset 080:  00 00 00 00  00 00 00 00  00 00 00 00  00 00 00 00 
      Offset 090:  00 00 00 00  00 00 00 00  00 00 00 00  00 00 00 00 
      Offset 0A0:  00 00 00 00  00 00 00 00  00 00 00 00  00 00 00 00 
      Offset 0B0:  00 00 00 00  00 00 00 00  00 00 00 00  00 00 00 00 
      Offset 0C0:  00 00 00 00  00 00 00 00  00 00 00 00  00 00 00 00 
      Offset 0D0:  00 00 00 00  00 00 00 00  00 00 00 00  00 00 00 00 
      Offset 0E0:  00 00 00 00  00 00 00 00  00 00 00 00  00 00 00 00 
      Offset 0F0:  00 00 00 00  00 00 00 00  00 00 00 00  00 00 00 00 

    PCI-8086-2770:  Intel i945/955/975/E7230 MCHBAR
                  
      Offset 100:  10 20 20 20  00 00 00 00  33 00 00 00  07 00 00 00 
      Offset 110:  E8 38 40 DB  33 8C 78 54  5F 02 00 80  FF 01 FF 03 
      Offset 120:  06 4A 00 40  02 05 00 80  F0 11 00 00  00 00 00 00 
      Offset 130:  C4 06 00 00  6D 06 1A 87  01 02 08 00  00 00 00 00 
      Offset 140:  00 00 00 00  00 00 00 00  00 00 00 00  00 00 00 00 
      Offset 150:  00 00 00 00  00 00 00 00  00 00 00 00  00 00 00 00 
      Offset 160:  00 00 00 00  20 00 00 00  00 92 62 43  98 87 22 E0 
      Offset 170:  00 00 00 00  00 00 00 00  00 00 00 00  00 00 00 00 
      Offset 180:  20 20 20 20  00 00 00 00  00 00 00 00  00 00 00 00 
      Offset 190:  E8 38 40 DB  33 8C 78 52  5F 02 00 80  FF 01 FF 03 
      Offset 1A0:  06 4A 00 40  02 04 00 00  00 00 00 00  00 00 00 00 

    PCI-8086-2770:  Intel i945/955/975/E7230 MCHBAR
                  
      Offset 200:  00 04 0F 00  00 00 00 00  30 01 02 04  08 00 00 00 
      Offset 210:  01 00 00 00  00 00 00 00  00 00 00 00  00 00 00 00 

    PCI-8086-2770:  Intel i945/955/975/E7230 MCHBAR
                  
      Offset C00:  32 00 00 20  01 01 01 01  00 00 00 00  00 00 00 00 
      Offset C10:  00 00 00 00  03 02 80 00  1F 1F 2F 3E  06 00 54 42 
      Offset C20:  00 00 00 00  00 00 00 00  00 00 00 00  00 00 00 00 
      Offset C30:  00 00 00 00  00 00 00 00  00 00 00 00  00 00 00 00 
      Offset C40:  00 00 00 00  00 00 00 00  00 00 00 00  00 00 00 00 
      Offset C50:  00 00 00 00  00 00 00 00  00 00 00 00  00 00 00 00 
      Offset C60:  00 00 00 00  00 00 00 00  00 00 00 00  00 00 00 00 
      Offset C70:  00 00 00 00  00 00 00 00  00 00 00 00  00 00 00 00 
      Offset C80:  00 00 00 00  00 00 00 00  00 00 00 00  00 00 00 00 
      Offset C90:  00 00 00 00  00 00 00 00  00 00 00 00  00 00 00 00 
      Offset CA0:  00 00 00 00  00 00 00 00  00 00 00 00  00 00 00 00 
      Offset CB0:  00 00 00 00  00 00 00 00  00 00 00 00  00 00 00 00 
      Offset CC0:  00 00 00 00  00 00 00 00  00 00 00 00  00 00 00 00 
      Offset CD0:  01 01 01 01  00 00 00 00  01 00 00 FF  00 00 00 00 
      Offset CE0:  00 00 00 00  00 00 80 00  00 00 00 00  00 00 00 00 
      Offset CF0:  00 00 00 00  00 00 00 00  00 00 00 00  00 00 00 00 


--------[ Debug - Video BIOS ]------------------------------------------------------------------------------------------

    C000:0000  U.............................IBM............... 761295520......
    C000:0040  ??......F.......2006/10/04 21:30.....R.... ..... ..w..C..B......
    C000:0080  ..113-AA91502-102 BR#22216 CL#175968...(C) 1988-2003, ATI Techno
    C000:00C0  logies Inc. BK-ATI VER008.015.139.000. cy22216c.cfg v611 .V380PC
    C000:0100  IEDGD1UN..OEM VER.000.000...ASUS BIOS Version 5B63.8.15.139.AS39
    C000:0140  ....t.......t.. .[................C...c[.........x0o.\.........
    C000:0180  $TVS.................................4.....................PCIR
    C000:01C0  ..c[........h.......ATI RV370..........7..W.qU..R}.>...-A*......
    C000:0200  .......7.......................!.u...-........q........ff;...k..
    C000:0240  ................................................................
    C000:0280  ................................................................
    C000:02C0  ..................L ....0.....4.....0.....4.....0.p...4....@0...
    C000:0300  ..4.....0.....4.....0.....4.....0.....4.....0.....4.....0.....4.
    C000:0340  ....0.....4......@............a.dA..........OD..P ....P`........
    C000:0380  X ..........| ..........X`.........J.........J........0....@.A..
    C000:03C0  ...=..x.....|........................................... .......


------------------------------------------------------------------------------------------------------------------------

The names of actual companies and products mentioned herein may be the trademarks of their respective owners.
