7002640
alina puig
virologia
--------[ AIDA64 Extreme Edition ]--------------------------------------------------------------------------------------

    Versión                                           AIDA64 v3.00.2529 Beta/es
    Módulo de rendimiento                             4.0.568-x64
    Página principal                                  http://www.aida64.com/
    Tipo de informe                                   Asistente de informes
    Equipo                                            VIROLOGIA-PC
    Generador                                         Virologia
    Sistema operativo                                 Microsoft Windows 7 Ultimate 6.1.7600.16385 (Win7 RTM)
    Fecha                                             2015-06-30
    Hora                                              10:40


--------[ Resumen ]-----------------------------------------------------------------------------------------------------

    Equipo:
      Tipo de equipo                                    ACPI x64-based PC
      Sistema operativo                                 Microsoft Windows 7 Ultimate
      Service Pack del SO                               -
      Internet Explorer                                 8.0.7600.16385 (IE 8.0 - Windows 7)
      DirectX                                           DirectX 11.0
      Nombre del equipo                                 VIROLOGIA-PC
      Nombre de usuario                                 Virologia
      Dominio de inicio de sesión                       Virologia-PC
      Fecha / Hora                                      2015-06-30 / 10:40

    Placa base:
      Tipo de CPU                                       QuadCore Intel Core i5-3330, 3000 MHz (30 x 100)
      Nombre de la placa base                           Unknown Motherboard
      Chipset de la placa base                          Intel Panther Point B75, Intel Ivy Bridge
      Memoria del sistema                               6080 MB  (DDR3-1600 DDR3 SDRAM)
      DIMM1: ASint SLA302G08-GGNHC                      4 GB DDR3-1600 DDR3 SDRAM  (11-11-11-28 @ 800 MHz)  (10-10-10-27 @ 761 MHz)  (9-9-9-24 @ 685 MHz)  (8-8-8-22 @ 609 MHz)  (7-7-7-19 @ 533 MHz)  (6-6-6-16 @ 457 MHz)
      DIMM3: ASint SLZ302G08-GGNHC                      2 GB DDR3-1600 DDR3 SDRAM  (11-11-11-28 @ 800 MHz)  (10-10-10-27 @ 761 MHz)  (9-9-9-24 @ 685 MHz)  (8-8-8-22 @ 609 MHz)  (7-7-7-19 @ 533 MHz)  (6-6-6-16 @ 457 MHz)
      Tipo de BIOS                                      AMI (10/30/2012)
      Puerto de comunicación                            Puerto de comunicaciones (COM1)
      Puerto de comunicación                            Puerto de impresora (LPT1)

    Pantalla:
      Adaptador de video                                NVIDIA GeForce GT 620  (2 GB)
      Adaptador de video                                NVIDIA GeForce GT 620  (2 GB)
      Aceleradora 3D                                    nVIDIA GeForce GT 620
      Monitor                                           LG E2242 (Analog)  [22" LCD]  (212NDHBB7345)

    Multimedia:
      Adaptador de audio                                nVIDIA HDMI/DP @ nVIDIA GF119 - High Definition Audio Controller
      Adaptador de audio                                VIA VT1708S @ Intel Panther Point PCH - High Definition Audio Controller [C-1]

    Almacenamiento:
      Controlador IDE                                   Intel(R) 7 Series/C216 Chipset Family SATA AHCI Controller
      Unidad de disco                                   ATA TOSHIBA DT01ACA1 SCSI Disk Device  (931 GB)
      Unidad de disco                                   Kingston DataTraveler 102 USB Device  (7 GB, USB)
      Unidad de disco                                   Kingston DataTraveler 2.0 USB Device  (3 GB, USB)
      Unidad óptica                                     ASUS DVD RAM GH95N SCSI CdRom Device
      Estado SMART de los discos duros                  Aceptar

    Particiones:
      C: (NTFS)                                         146.4 GB (109.4 GB libre)
      D: (NTFS)                                         785.0 GB (762.2 GB libre)
      Tamaño total                                      931.4 GB (871.6 GB libre)

    Entrada:
      Teclado                                           Dispositivo de teclado HID
      Mouse                                             Mouse compatible con HID

    Red:
      Dirección IP primaria                             10.6.49.159
      Dirección MAC primaria                            08-60-6E-44-E7-3D
      Adaptador de red                                  Realtek PCIe GBE Family Controller  (10.6.49.159)

    Periféricos:
      Impresora                                         Adobe PDF
      Impresora                                         Fax
      Impresora                                         Microsoft XPS Document Writer
      Controlador USB2                                  Intel Panther Point PCH - USB 2.0 EHCI Controller #1 [C-1]
      Controlador USB2                                  Intel Panther Point PCH - USB 2.0 EHCI Controller #2 [C-1]
      Controlador USB3                                  Intel Panther Point PCH - USB 3.0 xHCI Controller [C-1]
      Dispositivo USB                                   Dispositivo compuesto USB
      Dispositivo USB                                   Dispositivo de almacenamiento USB
      Dispositivo USB                                   Dispositivo de almacenamiento USB
      Dispositivo USB                                   Dispositivo de entrada USB
      Dispositivo USB                                   Dispositivo de entrada USB
      Dispositivo USB                                   Dispositivo de entrada USB
      Dispositivo USB                                   Generic USB Hub
      Dispositivo USB                                   Generic USB Hub

    DMI:
      Vendedor del BIOS DMI                             American Megatrends Inc.
      Versión del BIOS DMI                              0514
      Fabricante del sistema DMI                        ASUSTeK Computer INC.
      Producto del sistema DMI                          CM6340
      Versión del sistema DMI                           System Version
      Número de serie del sistema DMI                   CCPDCG000H8S
      UUID del sistema DMI                              C0972645-DAD7DD11-A7920860-6E44E73D
      Fabricante de la placa base DMI                   ASUSTeK COMPUTER INC.
      Producto de la placa base DMI                     CM6340
      Versión de la placa base DMI                      Rev X.0x
      Número de serie de la placa base DMI              121003381801684
      Fabricante del chasis DMI                         Chassis Manufacture
      Versión del chasis DMI                            Chassis Version
      Número de serie del chasis DMI                    Chassis Serial Number
      Identificador del chasis DMI                      
      Tipo de chasis DMI                                Desktop Case


--------[ Debug - PCI ]-------------------------------------------------------------------------------------------------

    B00 D00 F00:  Intel Ivy Bridge-DT - Host Bridge/DRAM Controller
                  
      Offset 000:  86 80 50 01  06 00 90 20  09 00 00 06  00 00 00 00 
      Offset 010:  00 00 00 00  00 00 00 00  00 00 00 00  00 00 00 00 
      Offset 020:  00 00 00 00  00 00 00 00  00 00 00 00  43 10 CA 84 
      Offset 030:  00 00 00 00  E0 00 00 00  00 00 00 00  00 00 00 00 
      Offset 040:  01 90 D1 FE  00 00 00 00  01 00 D1 FE  00 00 00 00 
      Offset 050:  03 00 00 00  09 00 00 00  00 00 00 00  01 00 00 DF 
      Offset 060:  05 00 00 F8  00 00 00 00  01 80 D1 FE  00 00 00 00 
      Offset 070:  00 00 00 7E  01 00 00 00  00 0C 00 FE  7F 00 00 00 
      Offset 080:  10 11 11 00  00 00 11 00  1A 00 00 00  00 00 00 00 
      Offset 090:  01 00 00 7E  01 00 00 00  01 00 F0 9D  01 00 00 00 
      Offset 0A0:  01 00 00 80  01 00 00 00  01 00 00 9E  01 00 00 00 
      Offset 0B0:  01 00 00 E0  01 00 00 E0  01 00 00 DF  01 00 00 E0 
      Offset 0C0:  00 00 00 00  00 00 00 00  00 00 00 00  00 00 00 00 
      Offset 0D0:  00 00 00 00  00 00 00 00  00 00 00 00  00 00 00 00 
      Offset 0E0:  09 00 0C 01  92 A0 00 E2  D0 00 40 04  00 00 00 00 
      Offset 0F0:  00 00 00 00  00 00 00 00  C8 0F 09 00  00 00 00 00 

    B00 D01 F00:  Intel Ivy Bridge-DT - PCI Express Graphics Root Port
                  
      Offset 000:  86 80 51 01  07 00 10 00  09 00 04 06  10 00 81 00 
      Offset 010:  00 00 00 00  00 00 00 00  00 01 01 00  E0 E0 00 20 
      Offset 020:  00 F6 00 F7  01 E8 F1 F1  00 00 00 00  00 00 00 00 
      Offset 030:  00 00 00 00  88 00 00 00  00 00 00 00  10 01 18 00 
      Offset 040:  00 00 00 00  00 00 00 00  00 00 00 00  00 00 00 00 
      Offset 050:  00 00 00 00  00 00 00 00  00 00 00 00  00 00 00 00 
      Offset 060:  00 00 00 00  00 00 00 00  00 00 00 00  00 00 00 00 
      Offset 070:  00 00 00 00  00 00 00 00  00 00 00 00  00 00 00 0A 
      Offset 080:  01 90 03 C8  08 00 00 00  0D 80 00 00  43 10 CA 84 
      Offset 090:  05 A0 00 00  00 00 00 00  00 00 00 00  00 00 00 00 
      Offset 0A0:  10 00 42 01  01 80 00 00  00 00 00 00  03 AD 61 02 
      Offset 0B0:  40 00 01 51  80 25 0C 00  00 00 40 00  00 00 00 00 
      Offset 0C0:  00 00 00 00  00 00 00 00  00 00 00 00  0E 00 00 00 
      Offset 0D0:  43 00 00 00  00 00 00 00  00 00 00 00  00 00 00 00 
      Offset 0E0:  00 00 00 00  00 00 00 00  00 00 00 00  00 00 00 00 
      Offset 0F0:  00 00 00 00  00 00 01 00  00 00 00 00  01 00 10 00 

    B00 D14 F00:  Intel Panther Point PCH - USB 3.0 xHCI Controller [C-1]
                  
      Offset 000:  86 80 31 1E  06 04 90 02  04 30 03 0C  00 00 00 00 
      Offset 010:  04 00 10 F7  00 00 00 00  00 00 00 00  00 00 00 00 
      Offset 020:  00 00 00 00  00 00 00 00  00 00 00 00  43 10 CA 84 
      Offset 030:  00 00 00 00  70 00 00 00  00 00 00 00  00 01 00 00 
      Offset 040:  FD 0F 0E 80  39 C2 03 80  00 00 00 00  00 00 00 00 
      Offset 050:  17 00 00 00  00 00 00 00  00 00 00 00  00 00 00 00 
      Offset 060:  30 20 00 00  00 00 00 00  00 00 00 00  00 00 00 00 
      Offset 070:  01 80 C2 C1  08 00 00 00  00 00 00 00  00 00 00 00 
      Offset 080:  05 00 B7 00  0C F0 E0 FE  00 00 00 00  A8 49 00 00 
      Offset 090:  00 00 00 00  00 00 00 00  00 00 00 00  00 00 00 00 
      Offset 0A0:  00 00 00 00  00 00 00 00  00 00 00 00  00 00 00 00 
      Offset 0B0:  8F 00 00 00  00 00 00 00  00 00 00 00  00 00 00 00 
      Offset 0C0:  03 0C 00 00  00 00 00 00  00 00 00 00  00 00 00 00 
      Offset 0D0:  0F 00 00 00  0F 00 00 00  0F 00 00 00  0F 00 00 00 
      Offset 0E0:  00 00 00 00  00 00 00 00  00 00 00 00  00 00 00 00 
      Offset 0F0:  00 00 00 00  00 00 00 00  87 0F 04 08  00 00 00 00 

    B00 D16 F00:  Intel Panther Point PCH - Host Embedded Controller Interface 1 (HECI1) [C-1]
                  
      Offset 000:  86 80 3A 1E  06 00 10 00  04 00 80 07  00 00 80 00 
      Offset 010:  04 B0 11 F7  00 00 00 00  00 00 00 00  00 00 00 00 
      Offset 020:  00 00 00 00  00 00 00 00  00 00 00 00  43 10 CA 84 
      Offset 030:  00 00 00 00  50 00 00 00  00 00 00 00  15 01 00 00 
      Offset 040:  55 02 00 1E  20 00 01 80  06 01 00 60  E0 17 00 10 
      Offset 050:  01 8C 03 C8  08 00 00 00  00 00 00 00  00 00 00 00 
      Offset 060:  00 00 00 00  00 00 00 00  00 00 00 00  00 00 00 00 
      Offset 070:  00 00 00 00  00 00 00 00  00 00 00 00  00 00 00 00 
      Offset 080:  00 00 00 00  00 00 00 00  00 00 00 00  05 00 80 00 
      Offset 090:  00 00 00 00  00 00 00 00  00 00 00 00  00 00 00 00 
      Offset 0A0:  00 00 00 00  00 00 00 00  00 00 00 00  00 00 00 00 
      Offset 0B0:  00 00 00 00  00 00 00 00  00 00 00 00  02 00 00 C0 
      Offset 0C0:  48 87 9B 09  10 30 54 48  CB C8 C4 20  0C 4B 85 95 
      Offset 0D0:  AC E7 0E 08  10 01 D7 F6  A3 C7 20 4E  10 34 58 D7 
      Offset 0E0:  00 00 00 00  00 00 00 00  00 00 00 00  00 00 00 00 
      Offset 0F0:  00 00 00 00  00 00 00 00  00 00 00 00  00 00 00 00 

    B00 D1A F00:  Intel Panther Point PCH - USB 2.0 EHCI Controller #2 [C-1]
                  
      Offset 000:  86 80 2D 1E  06 00 90 02  04 20 03 0C  00 00 00 00 
      Offset 010:  00 80 11 F7  00 00 00 00  00 00 00 00  00 00 00 00 
      Offset 020:  00 00 00 00  00 00 00 00  00 00 00 00  43 10 CA 84 
      Offset 030:  00 00 00 00  50 00 00 00  00 00 00 00  17 01 00 00 
      Offset 040:  00 00 00 00  00 00 00 00  00 00 00 00  00 00 00 00 
      Offset 050:  01 58 C2 C9  00 00 00 00  0A 98 A0 20  00 00 00 00 
      Offset 060:  20 20 81 07  00 00 00 00  01 00 00 01  00 20 00 00 
      Offset 070:  00 00 DF 3F  00 00 00 00  00 00 00 00  00 00 00 00 
      Offset 080:  00 00 80 00  11 88 0C 93  30 0D 00 24  00 00 00 00 
      Offset 090:  00 00 00 00  00 00 00 00  13 00 06 03  00 00 00 00 
      Offset 0A0:  00 00 00 00  00 00 00 00  00 00 00 00  00 00 00 00 
      Offset 0B0:  00 00 00 00  00 00 00 00  00 00 00 00  00 00 00 00 
      Offset 0C0:  00 00 00 00  00 00 00 00  00 00 00 00  00 00 00 00 
      Offset 0D0:  00 00 00 00  00 AA FF 00  00 00 00 00  00 00 00 00 
      Offset 0E0:  00 00 00 00  04 58 04 01  00 0A 00 00  94 22 D2 45 
      Offset 0F0:  00 00 00 00  88 85 80 00  87 0F 04 08  08 17 5B 20 

    B00 D1B F00:  Intel Panther Point PCH - High Definition Audio Controller [C-1]
                  
      Offset 000:  86 80 20 1E  06 00 10 00  04 00 03 04  10 00 00 00 
      Offset 010:  04 00 11 F7  00 00 00 00  00 00 00 00  00 00 00 00 
      Offset 020:  00 00 00 00  00 00 00 00  00 00 00 00  43 10 15 84 
      Offset 030:  00 00 00 00  50 00 00 00  00 00 00 00  16 01 00 00 
      Offset 040:  01 00 00 05  00 00 00 00  00 00 00 00  00 00 00 00 
      Offset 050:  01 60 42 C8  00 00 00 00  00 00 00 00  00 00 00 00 
      Offset 060:  05 70 80 00  00 00 00 00  00 00 00 00  00 00 00 00 
      Offset 070:  10 00 91 00  00 00 00 10  00 08 10 00  00 00 00 00 
      Offset 080:  00 00 00 00  00 00 00 00  00 00 00 00  00 00 00 00 
      Offset 090:  00 00 00 00  00 00 00 00  00 00 00 00  00 00 00 00 
      Offset 0A0:  00 00 00 00  00 00 00 00  00 00 00 00  00 00 00 00 
      Offset 0B0:  00 00 00 00  00 00 00 00  00 00 00 00  00 00 00 00 
      Offset 0C0:  00 04 02 01  00 24 00 40  00 0C A3 82  10 00 33 02 
      Offset 0D0:  00 0C A3 02  10 00 33 02  00 00 00 00  00 00 00 00 
      Offset 0E0:  00 00 00 00  00 00 00 00  00 00 00 00  00 00 00 00 
      Offset 0F0:  00 00 00 00  00 00 00 00  87 0F 04 08  00 00 00 00 

    B00 D1C F00:  Intel Panther Point PCH - PCI Express Port 1
                  
      Offset 000:  86 80 10 1E  04 00 10 00  C4 00 04 06  10 00 81 00 
      Offset 010:  00 00 00 00  00 00 00 00  00 02 02 00  F0 00 00 20 
      Offset 020:  F0 FF 00 00  F1 FF 01 00  00 00 00 00  00 00 00 00 
      Offset 030:  00 00 00 00  40 00 00 00  00 00 00 00  10 01 00 00 
      Offset 040:  10 80 42 01  00 80 00 00  00 00 10 00  42 4C 12 01 
      Offset 050:  00 00 01 18  00 FD 04 00  00 00 00 00  00 00 00 00 
      Offset 060:  00 00 00 00  16 00 00 00  00 00 00 00  00 00 00 00 
      Offset 070:  01 00 01 00  00 00 00 00  00 00 00 00  00 00 00 00 
      Offset 080:  05 90 00 00  00 00 00 00  00 00 00 00  00 00 00 00 
      Offset 090:  0D A0 00 00  43 10 CA 84  00 00 00 00  00 00 00 00 
      Offset 0A0:  01 00 02 C8  00 00 00 00  00 00 00 00  00 00 00 00 
      Offset 0B0:  00 00 00 00  00 00 00 00  00 00 00 00  00 00 00 00 
      Offset 0C0:  00 00 00 00  00 00 00 00  00 00 00 00  00 00 00 00 
      Offset 0D0:  00 00 00 01  02 0B 00 00  00 80 11 81  00 00 00 00 
      Offset 0E0:  00 3F 00 00  00 00 00 00  01 00 00 00  00 00 00 00 
      Offset 0F0:  00 00 00 00  00 00 00 00  87 0F 04 08  00 00 00 00 

    B00 D1C F05:  Intel Panther Point PCH - PCI Express Port 6
                  
      Offset 000:  86 80 1A 1E  07 00 10 00  C4 00 04 06  10 00 81 00 
      Offset 010:  00 00 00 00  00 00 00 00  00 03 03 00  D0 D0 00 00 
      Offset 020:  F0 FF 00 00  11 F2 11 F2  00 00 00 00  00 00 00 00 
      Offset 030:  00 00 00 00  40 00 00 00  00 00 00 00  11 02 00 00 
      Offset 040:  10 80 42 01  00 80 00 00  00 00 10 00  12 3C 12 06 
      Offset 050:  40 00 11 70  00 B2 2C 00  00 00 40 00  00 00 00 00 
      Offset 060:  00 00 00 00  16 00 00 00  00 00 00 00  00 00 00 00 
      Offset 070:  02 00 01 00  00 00 00 00  00 00 00 00  00 00 00 00 
      Offset 080:  05 90 00 00  00 00 00 00  00 00 00 00  00 00 00 00 
      Offset 090:  0D A0 00 00  43 10 CA 84  00 00 00 00  00 00 00 00 
      Offset 0A0:  01 00 02 C8  00 00 00 00  00 00 00 00  00 00 00 00 
      Offset 0B0:  00 00 00 00  00 00 00 00  00 00 00 00  00 00 00 00 
      Offset 0C0:  00 00 00 00  00 00 00 00  00 00 00 00  00 00 00 00 
      Offset 0D0:  00 00 00 01  02 0B 00 00  00 80 11 81  00 00 00 00 
      Offset 0E0:  00 03 00 00  00 00 00 00  01 00 00 00  00 00 00 00 
      Offset 0F0:  00 00 00 00  00 00 00 00  87 0F 04 08  00 00 00 00 

    B00 D1D F00:  Intel Panther Point PCH - USB 2.0 EHCI Controller #1 [C-1]
                  
      Offset 000:  86 80 26 1E  06 00 90 02  04 20 03 0C  00 00 00 00 
      Offset 010:  00 70 11 F7  00 00 00 00  00 00 00 00  00 00 00 00 
      Offset 020:  00 00 00 00  00 00 00 00  00 00 00 00  43 10 CA 84 
      Offset 030:  00 00 00 00  50 00 00 00  00 00 00 00  17 01 00 00 
      Offset 040:  00 00 00 00  00 00 00 00  00 00 00 00  00 00 00 00 
      Offset 050:  01 58 C2 C9  00 00 00 00  0A 98 A0 20  00 00 00 00 
      Offset 060:  20 20 01 06  00 00 00 00  01 00 00 01  00 20 00 00 
      Offset 070:  00 00 DF 3F  00 00 00 00  00 00 00 00  00 00 00 00 
      Offset 080:  00 00 80 00  11 88 0C 93  30 0D 00 24  00 00 00 00 
      Offset 090:  00 00 00 00  00 00 00 00  13 00 06 03  00 00 00 00 
      Offset 0A0:  00 00 00 00  00 00 00 00  00 00 00 00  00 00 00 00 
      Offset 0B0:  00 00 00 00  00 00 00 00  00 00 00 00  00 00 00 00 
      Offset 0C0:  00 00 00 00  00 00 00 00  00 00 00 00  00 00 00 00 
      Offset 0D0:  00 00 00 00  00 AA FF 00  00 00 00 00  00 00 00 00 
      Offset 0E0:  00 00 00 00  40 01 90 4A  80 42 40 48  C0 C0 60 10 
      Offset 0F0:  00 00 00 00  88 85 80 00  87 0F 04 08  08 17 5B 20 

    B00 D1E F00:  Intel 82801xx I/O Controller Hub
                  
      Offset 000:  86 80 4E 24  07 00 10 00  A4 01 04 06  00 00 01 00 
      Offset 010:  00 00 00 00  00 00 00 00  00 04 04 20  F0 00 80 22 
      Offset 020:  F0 FF 00 00  F1 FF 01 00  00 00 00 00  00 00 00 00 
      Offset 030:  00 00 00 00  50 00 00 00  00 00 00 00  FF 00 00 00 
      Offset 040:  00 00 00 00  00 00 00 00  00 00 00 00  00 12 00 10 
      Offset 050:  0D 00 00 00  43 10 CA 84  00 00 00 00  00 00 00 00 
      Offset 060:  00 00 00 00  00 00 00 00  00 00 00 00  00 00 00 00 
      Offset 070:  00 00 00 00  00 00 00 00  00 00 00 00  00 00 00 00 
      Offset 080:  00 00 00 00  00 00 00 00  00 00 00 00  00 00 00 00 
      Offset 090:  00 00 00 00  00 00 00 00  00 00 00 00  00 00 00 00 
      Offset 0A0:  00 00 00 00  00 00 00 00  00 00 00 00  00 00 00 00 
      Offset 0B0:  00 00 00 00  00 00 00 00  00 00 00 00  00 00 00 00 
      Offset 0C0:  00 00 00 00  00 00 00 00  00 00 00 00  00 00 00 00 
      Offset 0D0:  00 00 00 00  00 00 00 00  00 00 00 00  00 00 00 00 
      Offset 0E0:  00 00 00 00  00 00 00 00  00 00 00 00  00 00 00 00 
      Offset 0F0:  00 00 00 00  00 00 00 00  87 0F 04 08  00 00 00 00 

    B00 D1F F00:  Intel B75 Chipset - LPC Interface Controller [C-1]
                  
      Offset 000:  86 80 49 1E  07 00 10 02  04 00 01 06  00 00 80 00 
      Offset 010:  00 00 00 00  00 00 00 00  00 00 00 00  00 00 00 00 
      Offset 020:  00 00 00 00  00 00 00 00  00 00 00 00  43 10 CA 84 
      Offset 030:  00 00 00 00  E0 00 00 00  00 00 00 00  00 00 00 00 
      Offset 040:  01 04 00 00  80 00 00 00  01 05 00 00  10 00 00 00 
      Offset 050:  F8 00 00 00  00 00 00 00  00 00 00 00  00 00 00 00 
      Offset 060:  8B 8A 8B 83  D0 00 00 00  80 8F 86 8E  F8 F0 00 00 
      Offset 070:  78 F0 78 F0  78 F0 78 F0  78 F0 78 F0  78 F0 78 F0 
      Offset 080:  10 00 0E 3C  91 02 0C 00  00 00 00 00  00 00 00 00 
      Offset 090:  00 00 00 00  00 0F 00 00  00 00 00 00  00 00 00 00 
      Offset 0A0:  08 0E 80 00  09 18 06 00  00 47 00 00  00 00 01 00 
      Offset 0B0:  00 00 00 00  00 00 00 00  00 00 00 00  00 00 00 00 
      Offset 0C0:  00 00 00 00  00 00 00 00  00 00 00 00  00 00 00 00 
      Offset 0D0:  33 22 11 00  67 45 00 00  CF FF 00 00  08 00 00 00 
      Offset 0E0:  09 00 0C 10  00 00 00 00  19 06 E4 04  00 00 00 00 
      Offset 0F0:  01 C0 D1 FE  00 00 00 00  87 0F 04 08  00 00 00 00 

    B00 D1F F02:  Intel Panther Point PCH - SATA AHCI Controller [C-1]
                  
      Offset 000:  86 80 02 1E  07 04 B0 02  04 01 06 01  00 00 00 00 
      Offset 010:  71 F0 00 00  61 F0 00 00  51 F0 00 00  41 F0 00 00 
      Offset 020:  21 F0 00 00  00 60 11 F7  00 00 00 00  43 10 CA 84 
      Offset 030:  00 00 00 00  80 00 00 00  00 00 00 00  00 02 00 00 
      Offset 040:  00 80 00 80  00 00 00 00  00 00 00 00  00 00 00 00 
      Offset 050:  00 00 00 00  00 00 00 00  00 00 00 00  00 00 00 00 
      Offset 060:  00 00 00 00  00 00 00 00  00 00 00 00  00 00 00 00 
      Offset 070:  01 A8 03 40  08 00 00 00  00 00 00 00  00 00 00 00 
      Offset 080:  05 70 01 00  0C F0 E0 FE  B0 49 00 00  00 00 00 00 
      Offset 090:  60 00 3F A1  83 01 00 00  08 42 5C 01  00 00 00 00 
      Offset 0A0:  E0 00 00 00  39 00 00 00  12 B0 10 00  48 00 00 00 
      Offset 0B0:  13 00 06 03  00 00 00 00  00 00 00 00  00 00 00 00 
      Offset 0C0:  00 00 00 00  00 00 00 00  00 00 00 00  00 00 00 00 
      Offset 0D0:  00 00 00 00  00 00 00 00  00 00 00 00  00 00 00 00 
      Offset 0E0:  00 00 00 00  00 00 00 00  00 00 00 00  00 00 00 00 
      Offset 0F0:  00 00 00 00  00 00 00 00  87 0F 04 08  00 00 00 00 

    B00 D1F F03:  Intel Panther Point PCH - SMBus Controller [C-1]
                  
      Offset 000:  86 80 22 1E  03 00 80 02  04 00 05 0C  00 00 00 00 
      Offset 010:  04 50 11 F7  00 00 00 00  00 00 00 00  00 00 00 00 
      Offset 020:  01 F0 00 00  00 00 00 00  00 00 00 00  43 10 CA 84 
      Offset 030:  00 00 00 00  00 00 00 00  00 00 00 00  0B 03 00 00 
      Offset 040:  01 00 00 00  00 00 00 00  00 00 00 00  00 00 00 00 
      Offset 050:  00 00 00 00  00 00 00 00  00 00 00 00  00 00 00 00 
      Offset 060:  03 04 04 00  00 00 08 08  00 00 00 00  00 00 00 00 
      Offset 070:  00 00 00 00  00 00 00 00  00 00 00 00  00 00 00 00 
      Offset 080:  04 00 00 00  00 00 00 00  00 00 00 00  00 00 00 00 
      Offset 090:  00 00 00 00  00 00 00 00  00 00 00 00  00 00 00 00 
      Offset 0A0:  00 00 00 00  00 00 00 00  00 00 00 00  00 00 00 00 
      Offset 0B0:  00 00 00 00  00 00 00 00  00 00 00 00  00 00 00 00 
      Offset 0C0:  00 00 00 00  00 00 00 00  00 00 00 00  00 00 00 00 
      Offset 0D0:  00 00 00 00  00 00 00 00  00 00 00 00  00 00 00 00 
      Offset 0E0:  00 00 00 00  00 00 00 00  00 00 00 00  00 00 00 00 
      Offset 0F0:  00 00 00 00  00 00 00 00  87 0F 04 08  00 00 00 00 

    B00 D1F F06:  Intel Panther Point PCH - Thermal Management Controller [C-1]
                  
      Offset 000:  86 80 24 1E  00 00 10 00  04 00 80 11  00 00 00 00 
      Offset 010:  04 00 00 00  00 00 00 00  00 00 00 00  00 00 00 00 
      Offset 020:  00 00 00 00  00 00 00 00  00 00 00 00  43 10 CA 84 
      Offset 030:  00 00 00 00  50 00 00 00  00 00 00 00  0B 03 00 00 
      Offset 040:  05 00 00 E0  00 00 00 00  00 00 00 00  00 00 00 00 
      Offset 050:  01 00 23 00  08 00 00 00  00 00 00 00  00 00 00 00 
      Offset 060:  00 00 00 00  00 00 00 00  00 00 00 00  00 00 00 00 
      Offset 070:  00 00 00 00  00 00 00 00  00 00 00 00  00 00 00 00 
      Offset 080:  05 00 00 00  00 00 00 00  00 00 00 00  00 00 00 00 
      Offset 090:  00 00 00 00  00 00 00 00  00 00 00 00  00 00 00 00 
      Offset 0A0:  00 00 00 00  00 00 00 00  00 00 00 00  00 00 00 00 
      Offset 0B0:  00 00 00 00  00 00 00 00  00 00 00 00  00 00 00 00 
      Offset 0C0:  00 00 00 00  00 00 00 00  00 00 00 00  00 00 00 00 
      Offset 0D0:  00 00 00 00  00 00 00 00  00 00 00 00  00 00 00 00 
      Offset 0E0:  00 00 00 00  00 00 00 00  00 00 00 00  00 00 00 00 
      Offset 0F0:  00 00 00 00  00 00 00 00  87 0F 04 08  00 00 00 00 

    B01 D00 F00:  Asus GT620 Video Adapter
                  
      Offset 000:  DE 10 49 10  07 00 10 00  A1 00 00 03  10 00 80 00 
      Offset 010:  00 00 00 F6  0C 00 00 E8  00 00 00 00  0C 00 00 F0 
      Offset 020:  00 00 00 00  01 E0 00 00  00 00 00 00  43 10 EA 83 
      Offset 030:  00 00 00 00  60 00 00 00  00 00 00 00  10 01 00 00 
      Offset 040:  43 10 EA 83  00 00 00 00  00 00 00 00  00 00 00 00 
      Offset 050:  01 00 00 00  01 00 00 00  CE D6 23 00  00 00 00 00 
      Offset 060:  01 68 03 00  08 00 00 00  05 78 80 00  00 00 00 00 
      Offset 070:  00 00 00 00  00 00 00 00  10 B4 02 00  E0 8D 2C 01 
      Offset 080:  10 29 00 00  01 2D 05 00  40 01 01 11  00 00 00 00 
      Offset 090:  00 00 00 00  00 00 00 00  00 00 00 00  10 00 00 00 
      Offset 0A0:  00 00 00 00  00 00 00 00  01 00 00 00  00 00 00 00 
      Offset 0B0:  00 00 00 00  09 00 14 01  00 00 00 00  00 00 00 00 
      Offset 0C0:  00 00 00 00  00 00 00 00  00 00 00 00  00 00 00 00 
      Offset 0D0:  00 00 00 00  00 00 00 00  00 00 00 00  00 00 00 00 
      Offset 0E0:  00 00 00 00  00 00 00 00  00 00 00 00  00 00 00 00 
      Offset 0F0:  00 00 00 00  00 00 00 00  00 00 00 00  00 00 00 00 

    B01 D00 F01:  nVIDIA GF119 - High Definition Audio Controller
                  
      Offset 000:  DE 10 08 0E  06 00 10 00  A1 00 03 04  10 00 80 00 
      Offset 010:  00 00 08 F7  00 00 00 00  00 00 00 00  00 00 00 00 
      Offset 020:  00 00 00 00  00 00 00 00  00 00 00 00  43 10 EA 83 
      Offset 030:  00 00 00 00  60 00 00 00  00 00 00 00  11 02 00 00 
      Offset 040:  43 10 EA 83  00 00 00 00  00 00 00 00  00 00 00 00 
      Offset 050:  00 00 00 00  00 00 00 00  CE D6 23 00  00 00 00 00 
      Offset 060:  01 68 03 00  08 00 00 00  05 78 80 00  00 00 00 00 
      Offset 070:  00 00 00 00  00 00 00 00  10 00 02 00  A0 8D 2C 01 
      Offset 080:  00 28 01 00  01 2D 05 00  40 01 01 11  00 00 00 00 
      Offset 090:  00 00 00 00  00 00 00 00  00 00 00 00  10 00 00 00 
      Offset 0A0:  00 00 00 00  00 00 00 00  00 00 00 00  00 00 00 00 
      Offset 0B0:  00 00 00 00  00 00 00 00  00 00 00 00  00 00 00 00 
      Offset 0C0:  00 00 00 00  00 00 00 00  00 00 00 00  00 00 00 00 
      Offset 0D0:  00 00 00 00  00 00 00 00  00 00 00 00  00 00 00 00 
      Offset 0E0:  00 00 00 00  00 00 00 00  00 00 00 00  00 00 00 00 
      Offset 0F0:  00 00 00 00  00 00 00 00  00 00 00 00  00 00 00 00 

    B03 D00 F00:  Realtek RTL8168/8111 PCI-E Gigabit Ethernet Adapter
                  
      Offset 000:  EC 10 68 81  07 04 10 00  09 00 00 02  10 00 00 00 
      Offset 010:  01 D0 00 00  00 00 00 00  0C 40 10 F2  00 00 00 00 
      Offset 020:  0C 00 10 F2  00 00 00 00  00 00 00 00  43 10 05 85 
      Offset 030:  00 00 00 00  40 00 00 00  00 00 00 00  00 01 00 00 
      Offset 040:  01 50 C3 FF  08 01 00 00  00 00 00 00  00 00 00 00 
      Offset 050:  05 70 80 00  00 00 00 00  00 00 00 00  00 00 00 00 
      Offset 060:  00 00 00 00  00 00 00 00  00 00 00 00  00 00 00 00 
      Offset 070:  10 B0 02 02  C0 8C 90 05  00 50 10 00  11 7C 07 00 
      Offset 080:  40 00 11 10  00 00 00 00  00 00 00 00  00 00 00 00 
      Offset 090:  00 00 00 00  1F 00 00 00  10 00 00 00  00 00 00 00 
      Offset 0A0:  00 00 00 00  00 00 00 00  00 00 00 00  00 00 00 00 
      Offset 0B0:  11 D0 03 80  04 00 00 00  04 08 00 00  00 00 00 00 
      Offset 0C0:  00 00 00 00  00 00 00 00  00 00 00 00  00 00 00 00 
      Offset 0D0:  03 00 FC 80  FF FF FF FF  00 00 00 00  00 00 00 00 
      Offset 0E0:  00 00 00 00  00 00 00 00  00 00 00 00  00 00 00 00 
      Offset 0F0:  00 00 00 00  00 00 00 00  00 00 00 00  00 00 00 00 

    PCI-8086-0150:  Intel SNB/IVB/HSW/CRW MCHBAR
                  
      Offset 4000:  BB 8B 1C 00  65 64 18 0C  20 22 02 0A  B4 58 00 00 
      Offset 4010:  00 00 00 00  00 00 00 00  00 00 00 00  00 00 10 00 
      Offset 4020:  05 00 10 00  28 28 20 20  33 00 0E 00  00 00 00 00 

    PCI-8086-0150:  Intel SNB/IVB/HSW/CRW MCHBAR
                  
      Offset 4280:  00 00 00 00  00 00 0C 00  00 00 00 00  44 00 00 00 
      Offset 4290:  80 40 00 00  FF 98 00 00  60 18 80 6C  18 42 00 00 
      Offset 42A0:  03 10 00 00  00 82 F8 41  00 00 00 00  01 00 00 00 

    PCI-8086-0150:  Intel SNB/IVB/HSW/CRW MCHBAR
                  
      Offset 4400:  BB 8B 1C 00  65 64 18 0C  20 42 02 0A  B4 58 00 00 
      Offset 4410:  00 00 00 00  00 00 00 00  00 00 00 00  00 00 10 00 
      Offset 4420:  05 00 10 00  28 20 20 20  02 00 0E 00  00 00 00 00 

    PCI-8086-0150:  Intel SNB/IVB/HSW/CRW MCHBAR
                  
      Offset 4680:  00 00 00 00  00 00 0C 00  00 00 00 00  44 00 00 00 
      Offset 4690:  80 40 00 00  FF 98 00 00  60 18 80 6C  18 02 00 00 
      Offset 46A0:  01 10 00 00  00 82 F8 41  00 00 00 00  02 00 00 00 

    PCI-8086-0150:  Intel SNB/IVB/HSW/CRW MCHBAR
                  
      Offset 4800:  00 00 00 00  00 00 00 00  00 00 00 00  00 00 00 00 
      Offset 4810:  00 00 00 00  00 00 00 00  00 00 00 00  00 00 00 00 

    PCI-8086-0150:  Intel SNB/IVB/HSW/CRW MCHBAR
                  
      Offset 4A80:  00 00 00 00  00 00 00 00  00 00 00 00  00 00 00 00 
      Offset 4A90:  00 00 00 00  00 00 00 00  00 00 00 00  00 00 00 00 

    PCI-8086-0150:  Intel SNB/IVB/HSW/CRW MCHBAR
                  
      Offset 5000:  24 00 00 00  10 00 62 00  08 00 60 00  00 00 60 00 
      Offset 5010:  00 00 00 00  00 00 10 08  00 00 00 00  00 00 00 00 

    PCI-8086-0150:  Intel SNB/IVB/HSW/CRW MCHBAR
                  
      Offset 5880:  E7 71 91 CA  00 00 00 00  D0 DA E4 00  00 00 00 00 
      Offset 5890:  FC F0 D3 02  5F AE 7A 00  00 00 00 00  00 00 00 00 
      Offset 58A0:  00 00 00 00  00 00 00 00  00 00 00 00  00 00 00 00 
      Offset 58B0:  00 00 00 00  00 00 00 00  00 00 00 00  00 00 00 00 
      Offset 58C0:  00 00 00 00  00 00 00 00  00 00 00 00  00 00 00 00 
      Offset 58D0:  00 00 00 00  00 00 00 00  00 00 00 00  00 00 00 00 
      Offset 58E0:  00 00 00 00  00 00 00 00  00 00 00 00  00 00 00 00 
      Offset 58F0:  00 00 00 00  00 00 00 00  00 00 00 00  00 00 00 00 
      Offset 5900:  00 00 00 00  00 00 00 00  00 00 00 00  00 00 00 00 
      Offset 5910:  00 00 00 00  00 00 00 00  00 00 00 00  00 00 00 00 
      Offset 5920:  00 00 00 00  10 00 00 00  A2 A5 C0 5E  00 00 00 00 
      Offset 5930:  68 02 E0 01  00 00 0D 00  03 10 0A 00  E8 E4 98 55 
      Offset 5940:  00 00 00 00  00 00 00 00  00 00 00 00  00 00 00 00 
      Offset 5950:  00 00 00 00  00 00 04 00  00 1E 01 E0  00 10 08 00 
      Offset 5960:  00 00 00 00  4F 4B F8 E4  E4 42 F8 E4  93 12 D2 B6 
      Offset 5970:  00 00 00 00  00 00 00 00  2E 00 00 00  2E 00 00 00 
      Offset 5980:  2B 00 00 00  99 62 70 AE  00 00 00 00  00 00 00 00 
      Offset 5990:  FF 00 00 00  FF 00 00 00  15 0D 07 00  00 14 69 00 
      Offset 59A0:  00 00 00 00  00 00 00 00  00 00 00 00  00 00 00 00 
      Offset 59B0:  80 03 00 80  94 14 14 18  90 01 00 80  94 14 14 18 
      Offset 59C0:  00 00 43 88  00 00 00 00  00 00 00 00  00 00 00 00 

    PCI-8086-0150:  Intel SNB/IVB/HSW/CRW MCHBAR
                  
      Offset 5E00:  06 00 00 00  06 00 00 00  00 00 00 00  00 00 00 00 
      Offset 5E10:  00 00 00 00  00 00 00 00  00 00 00 00  00 00 00 00 

    PCI-8086-1E24:  Intel 5/6/7/8-series PCH TBARB
                  
      Offset 00:  01 BA 00 E0  2B 3A 00 00  80 00 3A 00  00 00 C0 00 
      Offset 10:  00 00 40 1A  87 DE 8C 80  00 00 E0 10  00 00 00 00 
      Offset 20:  00 00 85 01  00 00 00 00  00 00 00 00  00 00 00 00 
      Offset 30:  00 80 00 00  00 00 00 00  00 00 00 00  00 00 00 80 
      Offset 40:  01 02 00 FF  00 00 00 00  00 00 00 00  00 00 00 00 
      Offset 50:  00 00 00 00  00 00 00 00  00 00 00 00  00 00 00 00 
      Offset 60:  00 00 00 00  00 00 00 00  00 00 00 00  20 1B 16 05 
      Offset 70:  00 00 00 00  00 00 00 00  00 00 00 00  00 00 00 00 
      Offset 80:  01 01 00 04  61 61 00 FF  00 00 00 00  00 00 00 00 
      Offset 90:  C8 9A C0 9C  00 00 00 00  00 00 00 00  00 00 00 00 
      Offset A0:  00 00 00 00  00 00 00 00  00 00 00 00  00 00 00 00 
      Offset B0:  00 00 00 00  00 00 00 00  00 00 00 00  00 00 00 00 
      Offset C0:  01 01 00 00  00 00 00 FF  00 00 00 00  00 00 00 00 
      Offset D0:  00 00 00 00  00 00 00 00  3E 00 9D 00  00 00 00 00 
      Offset E0:  00 00 00 00  00 00 00 00  00 00 00 00  00 00 00 00 
      Offset F0:  00 00 00 00  00 00 00 00  00 00 00 00  00 00 00 00 


--------[ Debug - Video BIOS ]------------------------------------------------------------------------------------------

    C000:0000  U.p.K7400.L.w.VIDEO ..........IBM VGA Compatible......+Q10/24/12
    C000:0040  ..........@......s+.C.......d..........9.y..E..EPMIDl.o.......
    C000:0080  .....3GT620 VB Ver 75.19.66.00.AS03.VB1.........................
    C000:00C0  .......................Version 75.19.66.00.1E ...Copyright (C) 1
    C000:0100  996-2012 NVIDIA Corp..............GF119 Board - 13100001........
    C000:0140  .....Chip Rev   ................................................
    C000:0180  ........PCIR..I.........p.......HYB$..BIT......E2...,.B.!.8.C...
    C000:01C0  Y.D...g.A...k.I...n.L.....M.....N.....P.D...S.....T.....U.....V.
    C000:0200  ....x.....d.....p.....i.C.....S.UK.b.k-..................f.u....
    C000:0240  ..............\\....0.............L....=O.C....M.M.M.M.N=O.M..=O
    C000:0280  MT..L.L.p..=q..tM...k...l...n...p...p.......p......Fp...l.......
    C000:02C0  ....l...l...l............P.....(UK.iK#".#E...P.K..K.K...........
    C000:0300  a.b.b............f.u....<..C...08/01/12.........................
    C000:0340  300.13100001..................u.n.............E....b .........u.
    C000:0380  n.........,......b1.......5...........n.....G.....L...X...Q.f.u.
    C000:03C0  ......;...0...........U...a.....X.f...............n.....q.....t.


--------[ Debug - Unknown ]---------------------------------------------------------------------------------------------

    HDD             ATA TOSHIBA DT01ACA1 SCSI Disk Device


------------------------------------------------------------------------------------------------------------------------

The names of actual companies and products mentioned herein may be the trademarks of their respective owners.
